headline,body
"In revamped Grap, ban on diesel car when air severe+","New Delhi, July 13 -- Diesel vehicles not conforming to BS-VI will be banned in the National Capital Region (NCR) if the Air Quality Index (AQI) rises above 450, construction work will be halted above an AQI of 400, and diesel generators cannot be run if the index breaches 300, according to a revised Graded Response Action Plan (Grap) to combat air pollution./Released by the Commission for Air Quality Management (CAQM) on Wednesday, the new Grap will now take into account the index of air pollution, which reflects the concentration of several pollutants, and not just PM2.5 and PM10 as triggers for the curbs. More importantly, the imposition of restrictions under the three most serious levels will be pre-emptive instead of after pollution levels have spiked./Grap is a set of progressively stricter list of curbs on the type of vehicles, or the types of works or business that lead to air pollution when air pollution levels hit certain trigger points./The plan first came into force in 2017 but has been criticised for being ineffective, especially since it was considered reactive as stricter curbs were enforced 48 hours after pollution had already worsened./""Actions under stages II, III, and IV shall be invoked at least three days in advance of the AQI reaching the projected levels of that stage, based on the dynamic model and weather/meteorological forecast... on a day-to-day basis,"" the policy document said./Previously, as per policy, agencies waited until PM 2.5 or PM 10 concentration crossed particular threshold for two consecutive days./""The idea is to not wait and then take action, but to take action in advance and when Grap was formed, we did not have forecasting models. Now, these models will be used to forecast in advance and therefore these peak pollution events can be prevented in advance,"" said Anumita Roy Chowdhury, executive director, research and advocacy at CSE and part of the expert member./According to officials, the CAQM will receive reports from the Early Warning System for Delhi, a forecasting mechanism developed by the Indian Institute of Tropical Meteorology (IITM) along with the ministry of Earth Sciences (MoES) in 2019, and its Decision Support System (DSS), which was launched in 2021./The DSS takes into account multiple readings and observations, including pollution data from across northern India, satellite data of aerosols and of farm fires. Forecasts can be made up to 10 days, with accuracy fairly high for up to a week./A CAQM official said the policy was formulated keeping states in consultation and the final policy has been shared with the chief secretaries and the state governments. ""There is no requirement of a notification of the policy and since the states were stakeholders in its formation, they can begin working on it. The policy will also be shared with the Supreme Court soon and if there are any changes that are required, fresh directions will be issued again.""/A subcommittee will meet frequently and issue necessary orders for invoking provisions of Grap based on the prevailing air quality and forecast, the document added./The revised policy involves short-term (within 1 year), mid-term (within 2-3 years) and long-term (3-5 years) action plans across NCR with immediate effect, the commission said./Under the new plan, stage I is when the AQI is in ""poor"" range (between 201 and 300), stage II when it is in ""very poor"" (between 301 and 400), stage III when it is ""severe"" (between 401 and 450), and stage IV when the AQI is in ""severe plus"" (above 450)./For stages II, III and IV, the curbs will be invoked three days in advance if there are predictions for AQI thresholds being breached./Among the other key change is the limit on diesel private cars. In stage IV, the use of these will be banned unless they conform to the Bharat Stage VI (BS-VI) standard - the first time private cars will be banned on the basis of the fuel. Additionally, state authorities can also announce these curbs, as well as on BS-III petrol vehicles, in the third stage if they wish to, the policy says./To be sure, AQI hit the ""severe plus"" stage on only four days in 2021 - twice in November, once in December, and once in January./A second significant change is in allowing construction and demolition work to continue until AQI hits (or is predicted to) 401 or more. Last year, AQI was in this range for 20 days, but construction work was banned for 38 days in keeping with the earlier parameters./Another relaxation for the construction sector applies to what has been defined as linear projects, which are mostly public use work such as for highways, roads, flyovers etc, which will need to stop only in stage IV./The curbs on diesel generators will take effect in stage II - last year, the air quality was in this range for 64 days. The use of coal or wood-fired ovens in restaurants will also kick in from stage II./Every year, for close to a decade now, the Capital and much of north India is plunged into a public health crisis in the run-up to and during most of the winter. The crisis begins when these regions are shrouded in smoke from farm fires in states of Punjab and Haryana, where farmers set fire to miles and miles of paddy fields after harvest to clear them of residue./It is then precipitated by meteorological conditions marked by a lack of wind that would have otherwise blown local pollutants away, and festival fireworks during Diwali, creating the perfect storm of factors that lead to conditions that leave India's Capital with no option but to shut schools, halt construction work, limit businesses and advise children and the elderly to stay indoors./""The Commission has comprehensively revisited the contours of the Grap in vogue, towards an effective implementation mechanism and control on the adverse air quality scenario that generally persists in the entire NCR during the peak winter months,"" said CAQM in the new policy released on Wednesday./The policy was framed after the commission in December last year invited suggestions from the public and experts for a permanent solution to the air pollution problem. It then formed a nine-member expert group on January 7 to frame the policy focusing on five broad areas, including ensuring widespread access to affordable clean fuels and technology to the industry./SN Tripathi, Steering Committee member of the National Clean Air Programme of the Union environment ministry, said the new policy should help control peak pollution events while gradually acting on different pollutants across different sectors. ""AQI consists of gases too and we have seen gases leading to the formation of secondary particulate matter. If action is taken in advance, the peak will come down considerably and over time, Delhi-NCR can see an improvement in the pollution levels, both in the short-term as well as long-term.""/Published by HT Digital Content Services with permission from Hindustan Times. For any query with respect to this article or any other content requirement, please contact Editor at /<a href=""mailto:contentservices@htlive.com"">contentservices@htlive.com</a>"
New Grap curbs likely to impact more than 950K diesel vehicles in Delhi-NCR,"India, July 15 -- Close to 950,000 diesel vehicles, including private cars, could be banned from the roads if air pollution levels are projected to cross the air quality index of 450, an analysis of government data shows, suggesting there could be a crisis for commuters if adequate arrangements are not made./Authorities on Wednesday unveiled a revision to the Graded Response Action Plan to fight air pollution, which includes a direction to authorities to stop all but a few diesel vehicles - whether cars, SUVs or trucks - from being used in Delhi and adjoining NCR cities if the AQI is projected to rise above 450, a scenario when the fourth and the final stage of restrictions will be activated./An analysis of vehicle data showed that there are 942,447 of these vehicles in Delhi alone. The only diesel vehicles that can be driven are those conforming to the Bharat Stage VI tailpipe emissions standards, a category that has a very minuscule proportion (27,860)./In all, the city has 10 million registered vehicles, with 1.12 million of these conforming to Bharat BS-VI, a standard that became mandatory for all new cars registered after April 1, 2020./Emission standards determine the maximum limit of pollutants a vehicle can emit for it to be legally approved. Diesel vehicles typically emit significantly higher amounts of nitrogen oxides (NOx) compounds, which have a significant impact on human health. In BS-VI standards, diesel vehicles will need to emit less than a third of the volume of NOx they were allowed to under the BS-IV standard./Overall, however, only a tenth of all 10 million vehicles registered in Delhi comply with the new, less-polluting BS-VI standard./The Commission of Air Quality Management (CAQM), which revised the Grap, has also allowed National Capital Region (NCR) states to ban the use of BS-III petrol and BS IV diesel cars in the third stage of curbs, which is meant to be activated if the AQI is projected to go beyond 400./As per government records, Delhi has 2,957,630 registered BS-III (BS3) vehicles. Although how many of these are diesel was not immediately available, transport department officials said most are likely to be petrol since diesel vehicles older than 10 years are deemed de-registered in the city./Transport minister Kailash Gahlot did not comment on the matter. Transport commissioner Ashish Kundra said: ""It is a good move. Will review the measures once we get the final policy document.""/A senior official requesting anonymity said the government will hold a meeting to discuss the implementation of the new Grap measures./Residents, however, were surprised by the new curbs on diesel cars measures and called it ""drastic"" and ""knee jerk""./""No doubt stringent measures must be taken in Delhi-NCR during severe and severe+ AQI situations. But seems the commission itself does not have any trust on the pollution under control (PUC) test certificates being issued in Delhi NCR. If the PUC certificates can't be relied on, why are people forced to stand in long queues at regular intervals to get a PUC done? If PUC can't be trusted, why is the government making huge collections every year from crores of vehicles? Instead of putting up a ban or restriction on vehicles, can't they make the PUC tests more trustworthy,"" said BS Vohra, president of east Delhi RWAs joint front./Every year, for close to a decade now, the Capital and much of north India is plunged into a public health crisis in the run-up to and during most of the winter. The crisis begins when these regions are shrouded in smoke from farm fires in states of Punjab and Haryana, where farmers set fire to miles and miles of paddy fields after harvest to clear them of residue./It is then precipitated by meteorological conditions marked by a lack of wind that would have otherwise blown local pollutants away, and festival fireworks during Diwali, creating the perfect storm of factors that lead to conditions that leave India's Capital with no option but to shut schools, halt construction work, limit businesses and advise children and the elderly to stay indoors./Published by HT Digital Content Services with permission from Hindustan Times. For any query with respect to this article or any other content requirement, please contact Editor at /<a href=""mailto:contentservices@htlive.com"">contentservices@htlive.com</a>"
New Grap restrictions likely to impact more than 950K diesel vehicles,"India, July 15 -- Close to 950,000 diesel vehicles, including private cars, could be banned from the roads if air pollution levels are projected to cross the air quality index of 450, an analysis of government data shows, suggesting there could be a crisis for commuters if adequate arrangements are not made./Authorities on Wednesday unveiled a revision to the Graded Response Action Plan to fight air pollution, which includes a direction to authorities to stop all but a few diesel vehicles - whether cars, SUVs or trucks - from being used in Delhi and adjoining NCR cities if the AQI is projected to rise above 450, a scenario when the fourth and the final stage of restrictions will be activated./An analysis of vehicle data showed that there are 942,447 of these vehicles in Delhi alone. The only diesel vehicles that can be driven are those conforming to the Bharat Stage VI tailpipe emissions standards, a category that has a very minuscule proportion (27,860)./In all, the city has 10 million registered vehicles, with 1.12 million of these conforming to Bharat BS-VI, a standard that became mandatory for all new cars registered after April 1, 2020./Emission standards determine the maximum limit of pollutants a vehicle can emit for it to be legally approved. Diesel vehicles typically emit significantly higher amounts of nitrogen oxides (NOx) compounds, which have a significant impact on human health. In BS-VI standards, diesel vehicles will need to emit less than a third of the volume of NOx they were allowed to under the BS-IV standard./Overall, however, only a tenth of all 10 million vehicles registered in Delhi comply with the new, less-polluting BS-VI standard./The Commission of Air Quality Management (CAQM), which revised the Grap, has also allowed National Capital Region (NCR) states to ban the use of BS-III petrol and BS IV diesel cars in the third stage of curbs, which is meant to be activated if the AQI is projected to go beyond 400./As per government records, Delhi has 2,957,630 registered BS-III (BS3) vehicles. Although how many of these are diesel was not immediately available, transport department officials said most are likely to be petrol since diesel vehicles older than 10 years are deemed de-registered in the city./Transport minister Kailash Gahlot did not comment on the matter. Transport commissioner Ashish Kundra said: ""It is a good move. Will review the measures once we get the final policy document.""/A senior official requesting anonymity said the government will hold a meeting to discuss the implementation of the new Grap measures./Residents, however, were surprised by the new curbs on diesel cars measures and called it ""drastic"" and ""knee jerk""./""No doubt stringent measures must be taken in Delhi-NCR during severe and severe+ AQI situations. But seems the commission itself does not have any trust on the pollution under control (PUC) test certificates being issued in Delhi NCR. If the PUC certificates can't be relied on, why are people forced to stand in long queues at regular intervals to get a PUC done? If PUC can't be trusted, why is the government making huge collections every year from crores of vehicles? Instead of putting up a ban or restriction on vehicles, can't they make the PUC tests more trustworthy,"" said BS Vohra, president of east Delhi RWAs joint front./Every year, for close to a decade now, the Capital and much of north India is plunged into a public health crisis in the run-up to and during most of the winter. The crisis begins when these regions are shrouded in smoke from farm fires in states of Punjab and Haryana, where farmers set fire to miles and miles of paddy fields after harvest to clear them of residue./It is then precipitated by meteorological conditions marked by a lack of wind that would have otherwise blown local pollutants away, and festival fireworks during Diwali, creating the perfect storm of factors that lead to conditions that leave India's Capital with no option but to shut schools, halt construction work, limit businesses and advise children and the elderly to stay indoors./Published by HT Digital Content Services with permission from Hindustan Times. For any query with respect to this article or any other content requirement, please contact Editor at /<a href=""mailto:contentservices@htlive.com"">contentservices@htlive.com</a>"
"Delhi, Punjab govts working on joint proposal to pay farmers for not burning paddy stubble","India, July 19 -- The Aam Aadmi Party (AAP) governments in Punjab and Delhi are proposing a scheme that would give Punjab's farmers Rs.2,500 per acre as an incentive for not burning crop residue during the upcoming kharif harvest season, people familiar with the matter said. The move is aimed at tackling paddy stubble fires - a major contributor to severe air pollution in the National Capital Region before the advent of winter./HT learns that the AAP government in Delhi has agreed to share a part of the cost for the scheme, which may also require a significant contribution from the Union government. Punjab chief secretary VK Janjua confirmed that the proposal is being fine-tuned. The scheme involves an expenditure of Rs.1,875 crore.The Punjab and Delhi governments may contribute Rs.375 crore each, and the two governments are hoping that the Centre will contribute the remaining Rs.1,125 crore, officials indicated./""The proposal will be shortly sent to the finance department and subsequently it will be forwarded to the Delhi government. We are also writing to the Centre to allocate funds for its share of promised incentives,"" said a senior officer in the agriculture department, asking not to be identified./The previous Congress government in the state had sought Rs.100 per quintal as incentive from the Centre to check stubble burning in 2019. Punjab's farm unions have also been demanding a direct cash incentive instead of subsidy for machines for in-situ management of paddy straw. The funds, however, did not come through./"" In case the Centre doesn't accept our demand for its share in cash hand-out scheme, the AAP governments in Chandigarh and Delhi will still go ahead with their plan and will give at least Rs.1,000 acre to farmers,"" says a senior bureaucrat in Chandigarh in the know of matter./A spokesperson for the Delhi government on Tuesday refused comment when asked about the scheme./During the kharif season, paddy is sown over 29-30 lakh hectares (70-72 lakh acres) in Punjab. According to the proposal, all farmers who desist from burning paddy residue will be covered under the incentive plan./The state produces roughly 185 lakh tonne of paddy crop residue every year. Of this, 49% is managed in-situ (mixing the residue in the soil) and ex-situ (used as fuel) methods and rest is set ablaze./After the paddy harvest, the window for rabi (wheat) sowing is very short. The farmers prefer to burn the stubble as it is the cheapest method to ready their farms for next sowing./In the past four seasons, at least 90,000 machines have been supplied to farmers in Punjab, with the Centre releasing Rs.269 crore, Rs.273 crore, Rs.272 crore and Rs.331 crore in 2018, 2019, 2020 and 2021, respectively./The Centre has allocated Rs.275 crore (against a demand of Rs.474 crore) to Punjab for in-situ management of stubble for the current kharif harvest season. All these grants, however, have failed to bring down the raging farm fires, with 2021 alone reporting a total of 71,246 incidents during the paddy harvest season./The Punjab government, according to officials, will ask the Centre to be a contributor in the proposed scheme of cash incentive instead of funding the existing scheme of subsidy for machinery for stubble management./""It's a good step if the government is serious to lend support to the farmers. I believe Punjab farmers are eager to do their bit for the environment and if they are offered an incentive, they will readily do so,"" said Bharatiya Kisan Union (BKU) president Balbir Singh Rajewal. However, he was sceptical about the funds. ""From where will the government bring funds? An incentive of Rs.1,500 per acre to farmers for adopting sowing of direct-seeded rice (this doesn't require transplantation) is already pending,"" he said./The Punjab government has kept an outlay of Rs.200 crore in its budget this year to check the menace of stubble burning./In Delhi and its surrounding areas, pollution becomes the focal point of the discourse around public health every year as winter sets in as the area becomes one of the most polluted regions in the world owing to a series of factors such as stubble burning by neighbouring states, emissions from millions of vehicles, construction and road dust./Data collated by pollution monitoring bodies show that anywhere between 25%-40% of pollutants that form the toxic haze over Delhi between the months of September and November are caused by paddy stubble fires./In previous years, the AAP government in Delhi has blamed the public health emergency on inaction by neighbouring governments, particularly Punjab, often leading to Twitter battles between Kejriwal and former Punjab CM Amarinder Singh. But with the AAP in power in both states now, the pressure has built on the party to find a solution to the crisis./Published by HT Digital Content Services with permission from Hindustan Times. For any query with respect to this article or any other content requirement, please contact Editor at /<a href=""mailto:contentservices@htlive.com"">contentservices@htlive.com</a>"
NGT forms panel after Kolkata residents allege air pollution due to cats,"India, July 20 -- The National Green Tribunal (NGT) has set up a three-member committee to find out if droppings, hair and dander of dozens of cats were causing air pollution in an apartment in Kolkata after allegations from the residents of the complex./A section of residents of an apartment in south east Kolkata, comprising around 80 flats in four blocks, moved NGT's eastern bench alleging that a flat owner has kept dozens of cats in her second floor flat and feeds a few more in the vicinity./""The owner feeds around 40-45 cats every day. While 20-25 cats stay in her flat, she feeds another 15 - 20 stray cats in the corridor. They litter everywhere and the smell of animals, their scat and urine make it very uncomfortable. This is causing air pollution as their hair and dander floats in the air which may trigger diseases,"" said a resident of the apartment, who didn't wish to be named./The residents said that they had earlier moved the West Bengal Pollution Control Board, which referred the case to the Kolkata Municipal Corporation. But to date no actions have been taken, they alleged./NGT first heard the case in May this year and directed the respondents to file their affidavits within four weeks./""It is stated that due to the presence of these cats inside the flat as well as in this housing colony there is immense air pollution due to scat (animal droppings) and foul smell along with hair shed by the cats which is causing immense harm to the residents of the area,"" an NGT bench said, adding, ""In our opinion, the matter requires consideration.""/Last week, the NGT bench comprising Justice B Amit Sthalekar, judicial member and Saibal Dasgupta, expert member formed a three-member committee to look into the allegations./""We are also of the view that it would be appropriate to constitute a committee to inspect the site in question. We, therefore, constitute a committee comprising the following members - senior scientist of West Bengal Pollution Control Board, senior official from Kolkata Municipal Corporation and officer-in-charge of Gariahat Police Station,"" the bench ordered./The committee has been asked to inspect the spot and submit its report within four weeks. NGT is likely to hear the matter again on August 17./""There is no scientific evidence which claims that cats cause air pollution. If cat droppings are being blamed, then at the most the owner can be asked to maintain cleanliness. Infact cats are known to be rat killers which are disease carriers and it is beneficial to have them around in housing complexes. Under no circumstances should the idea of cats as air pollutants be entertained which will send a wrong message to citizens and proliferate misconceptions,"" said Tiasa Adhya, a small cat specialist./Even though the flat owner, who feeds the cats, could not be contacted till the time the report was filed, animal rights activists have rubbished the allegations./""It is ridiculous to say that the scat, hair and danders of a few dozen cats are triggering air pollution in a housing campus located in a polluted city like Kolkata which has dozens of other polluting agents. Our Constitution says that it is our fundamental duty to have compassion for animals. So no one can object to keeping a pet. However, the pet owner must ensure that the animals are vaccinated and sterilised. If a state government or the civic body doesn't operate any animal shelter or the shelters are all full, animal loving residents have no option but to keep rescued animals like cats and dogs at home. It is, however, advisable that cleanliness must be maintained to the extent possible,"" said Gauri Maulekhi, an animal rights advocate./Published by HT Digital Content Services with permission from Hindustan Times. For any query with respect to this article or any other content requirement, please contact Editor at /<a href=""mailto:contentservices@htlive.com"">contentservices@htlive.com</a>"
