headline,body
Can heart attack be triggered by air pollution? Know from a health expert,"Delhi, Dec. 31 -- A heart attack occurs when the blood flow, which brings oxygen to the heart muscle, is reduced or obstructed due to the blocking or severely narrowing of the arteries that supply the heart. The signs of it may include chest pain, breathlessness, breaking out in a cold sweat, nausea, upper body pain or dizziness./According to the World Health Organisation, an estimated 17.9 million people died from Cardiovascular diseases (CVDs) in 2016, representing 31% of all global deaths. Of these deaths, 85% were due to heart attack and stroke. We often picture a heart attack as grimacing from the extreme chest pain and clutching our chest but few know that heart attacks are silent too and symptoms in women may sometimes be different from men./As per the British Heart Foundation, ""Air pollution can affect your heart and circulation by damaging the inside walls of your blood vessels, causing them to become narrower and harder, restricting the movement of your blood vessels, which can increase your blood pressure and add to the strain on your heart, making your blood more likely to clot, affecting the normal electrical functioning of your heart which could cause abnormal heart rhythms and causing small changes to the structure of the heart like those that are seen in the early stages of heart failure.""/In a report by Physicians For Social Responsibility, it was revealed that, ""air pollutants contribute to serious, even fatal damage to the cardiovascular system and air pollution is a factor that you can't control just through healthy lifestyle."" It added, ""Harmful air pollutants lead to cardiovascular diseases such as artery blockages leading to heart attacks (arterial occlusion) and death of heart tissue due to oxygen deprivation, leading to permanent heart damage (infarct formation).""/Asserting the same, Dr Santosh Kumar Dora, Senior Cardiologist, Asian Heart Institute, Mumbai shared, ""Worldwide, exposure to air pollution has been estimated to account for 16% of deaths from ischemic heart disease and 11% of deaths from stroke. There is also evidence on air pollution leading to increased incidence of diabetes and neurodegenerative disease. In a large-scale prospective study in women, living within 50 m of a major roadway increased the risk of sudden cardiac death by 38% compared with living >= 500 m away. These studies show the impact of rising air pollution and cardiovascular disease burden and death.""/Solution:/Cautioning that exposure to air pollution can rapidly deteriorate the health in some heart patients, where the lungs are also congested, Dr Santosh spilled the beans on a few measures. He stated, ""Residence should be located far from factories, major roadways. Wearing face masks and installing air purifiers at homes. Avoid commutes during rush hour. Use indoor air purifiers and closing windows, air conditioners.""/Though the government has currently made it mandatory to wear a face mask while going out of home amid the ongoing Covid-19 pandemic, Dr Santosh suggested that he safest mask to filter out coronavirus is the N-95 mask. He claimed, ""Coronavirus measures approximately 0.125 micron. So the N-95 mask will be very useful to filter out the PM2.5 and PM 10 particles very effectively.""/Studies have shown triple layer surgical masks and multi-layered cotton masks also are effective to prevent coronavirus spread. As N-95 masks are costly, these masks are cheaper options. All these masks which protect us from Covid-19, also will be useful to protect us from PM 2.5 and PM 10 air pollutant particles and prevent heart health from deteriorating./Published by HT Digital Content Services with permission from Hindustan Times. For any query with respect to this article or any other content requirement, please contact Editor at /<a href=""mailto:contentservices@htlive.com"">contentservices@htlive.com</a>"
Involvement of people living with non-communicable diseases,"India, Dec. 31 -- justify;"" >The Universal Health Coverage (UHC) Day 2021 theme of ""leaving no one behind"" is approprate, given the gaps in equitable access to health care during the Covid-19 pandemic. While the Ayushman Bharat Pradhan Mantri Jan Arogya Yojana is meant to enhance equitable access to health care, in India, inequity is related to socioeconomic and political status, caste, class, geography and gender differences, among others, resulting in inequitable health outcomes and health service utilisation. These dimensions also converge and intersect, wherein schemes meant for the most vulnerable members of the community are often left behind due to lack of awareness. While accelerating progress towards UHC is essential to ensuring the health and wellbeing of all people, the brunt of inequitable access to health care is borne by those living with chronic illnesses. Every year,approximately 100 million people are pushed into poverty as a result of out-of-pocket expenditure for health care, a large proportion due to non-communicable diseases (NCDs)./NCDs, including cardiovascular diseases, cancers, diabetes, chronic respiratory diseases and mental health conditions, tend to be of long duration and are the most common causes of death and disability worldwide and in India (71 % and 63% of all deaths, respectively). Many NCDs are preventable, driven by modifiable risk factors including tobacco use, unhealthy diet, physical inactivity, alcohol use and air pollution.Besides causing financial distress, these diseases also afflict physical and mental stress, not just on those bearing the condition but, also their caregivers. These People Living with NCDs (PLWNCDs--those with the condition/s and their care givers) bear the brunt of the disease, coupled with the mental trauma of navigating a complicated health system. Pandemics only worsens the challenges faced by PLWNCDs, both in terms of derailing regular care, and also increasing risk of severe morbidity or mortality./To sensitise the public, set up infrastructure, and carry out NCD screenings at the primary health care level, the ministry of health and family welfare, Government of India, has implemented aNational Programme for Prevention and Control of Cancer, Diabetes and Cardiovascular Disease and Stroke (NPCDCS) since 2010. India also adopted ten national NCD targets in 2013 and, thereafter, released the National Multi-Sectoral Action Plan for Prevention and Control of Common NCDs - 2017-22 (NMAP). The NMAP supports a whole-of-government (all ministries/departments of central and state governments) and whole-of-society(community, civil society organisations (CSOs), private sector) approach to NCD prevention and control. However, any reference to PLWNCDs is starkly missing in these initiatives./Community participation and empowerment is an important best buy for achieving equitable, people-led health care and palliative care.The Alma-Ata Declaration on primary care emphasised that communities have a right and responsibility to be involved in their health. Even with years of evidence, reiterating the need of communities to be at the centre of efforts to prevent and treat NCDs, their meaningful involvement remains tokenistic. There is a gap in leveraging how PLWNCDs can be partners to health care providers, grassroots health workers and CSOs. They have unique, first hand insights and expertise of the contextual challenges to NCD prevention, diagnosis, treatment, care, and palliation and, on ensuring overall quality of life. This varied group represent a range of demographic backgrounds which can not only augment the efficiency of the health system but also, be a strong voice for NCD prevention./In India, there are a handful of groups making efforts towards meaningful involvement of PLWNCDs as pivotal stakeholders. The Healthy India Alliance (HIA), also known as the India NCD Alliance (/<a href=""http://www.healthyindiaalliance.org"">www.healthyindiaalliance.org</a>/), is one such coalition focusing on concerted PLWNCD-led action. HIA has been closely involved with the Our Views, Our Voices initiative, of the global NCD Alliance (/<a href=""http://www.ncdalliance.org"">www.ncdalliance.org</a>/), wherein the perspectives of PLWNCDs are embedded into the core of civil society action planning. Through several pan-India community conversations, HIA has absorbed the expertise of the Peoples' Collective, calling for people-centeredness in policy formulation, programme implementation and health system strengthening. HIA developed theIndia Advocacy Agenda for People Living With NCDs, highlighting the needs, priorities and challenges of People Living with NCDs. HIA also undertook a situational analysisto map the UHC landscape in India, the health systems' capacity to prioritise NCDs within the ambit of UHC and, call for a people-centred response. PLWNCDs in India, have also provided key inputs for the development of the Global Charter on Meaningful Involvement of People Living with NCD, which is now open for endorsements by stakeholders (/<a href=""https://www.ourviewsourvoices.org/global-charter/endorse"">https://www.ourviewsourvoices.org/global-charter/endorse</a>/)./The pandemic while highlighting inequities, has also shone light on the power of a united peoples' movement in dealing with unprecedented impediments, when Covid mitigation disrupted routine services, including NCD care. Health care is no longer restricted to medical facilities, having diffused to homes and the communities. PLWNCDs and citizens have taken on the onus of care and management. This reiterates their critical role as key players in the effectiveness of a hybrid, in-person and virtual health care system. Meaningful involvement of PLWNCDs warrants leadership and active involvement in all aspects of the NCD response including - governance, policy formulation and enforcement, design and delivery of programmes and services, community mobilisation, evidence generation and impact evaluation./The way forward:/PLWNCDs represent a diverse and dynamic section of society, with valuable social, economic, cultural and professional skills. They are a rich human resource that embodies the humane facet to the statistics that NCDs and UHC are often restricted to. They must thrive and lead the way so that no one is left behind, in letter and spirit./Published by HT Digital Content Services with permission from Hindustan Times. For any query with respect to this article or any other content requirement, please contact Editor at /<a href=""mailto:contentservices@htlive.com"">contentservices@htlive.com</a>"
Childhood pneumonia: India's silent epidemic,"India, Jan. 8 -- With the Covid-19 pandemic raging on for two years, the world has recognised the challenges around inequitable access to resilient health systems, especially access to oxygen. This remains a prime barrier in other major respiratory illness which plague India - especially India's young. Childhood pneumonia, which causes the death of a child every 39 seconds in the country, was the cause for nearly 127,000 deaths in 2018 (UNICEF)./The National Family Health Survey (NFHS) 2019-21, reveals that the number of parents seeking medical care for childhood pneumonia dropped marginally from 73% to 69%. This, even as the cases among Indian households stood at 2.8%./While the pandemic played a part in this disregard of the killer disease, it also points to lack of awareness about the disease. A better understanding and prioritisation of childhood pneumonia in the community are required. As with Covid-19, it is important to watch out for distinguishing symptoms of pneumonia - to differentiate it from a simple nose block or breathing problems due to upper chest congestion./Pneumonia can be caused by bacteria, viruses or fungi, and causes acute respiratory infection. The lungs are made up of small sacs called alveoli, which fill with air when a healthy person breathes. When someone has pneumonia, the alveoli fill up with pus and fluid, limiting oxygen intake. Incorrect or delay in treatment can cause respiratory failure./Children who live in overcrowded conditions and are exposed to environmental contaminants such as indoor and outdoor air pollution are at an elevated risk of contracting pneumonia./As we are seeing with the Covid-19 pandemic, any change in the course a widespread disease takes can only be done if everyone, including the public, acts in unison. We need a campaign that resonates across the length and breadth of the country - something similar to the ""Do Boond Zindagi Ki"" campaign for polio eradication. The government's recently launched SAANS (Social Awareness and Action Plan to Neutralise Pneumonia Successfully) campaign is expected to bring a positive change in the way the country perceives childhood pneumonia. Besides, the inclusion of the Pneumococcal Conjugate Vaccine (PCV) in the universal immunisation programme will go a long way in disease prevention./But several challenges remain, mainly because identification of pneumonia symptoms requires a high level of diagnostic skills. It is unfair to expect such skills among the frontline health workers such as Accredited Social Health Activists (ASHAs) who are not well equipped, but are still given the responsibility of identifying signs of pneumonia in the early stages. In rural areas, a majority of the care-seeking happens through informal private providers without a formal medical background, and hence they lack the skills to make an informed diagnosis./Diagnosing pneumonia by getting X-rays and blood samples takes time and is available at health care facilities that are not always accessible. The lack of availability of rapid testing kits that can quickly diagnose pneumonia is another challenge./The need of the moment is an extensive network of health care providers who are equipped to traverse every nook and corner of the country, diagnosing, treating, and referring patients to the nearest health care facility. The cadre of community health workers, present in every village of India, is equipped and authorised to do so. This is the time to strengthen their capacities to improve their performance./Private providers should also be roped in to reach the remotest corners of the country. This has to be supported by an intelligent digital backbone that studies the incidence of cases, monitors spikes, and triggers concerted action. Efforts are also needed to shift the organisational culture of accountability to ensure quality./While we, as a country, suffered terribly from the pandemic, the hard-earned learnings can be used to manage other critical health emergencies, such as pneumonia, as well. Let's breathe life back into our struggling children./Rajiv Tandon is director - Health, and Lopamudra Ray Saraswati is manager - Health, Research Triangle Institute International, India/The views expressed are personal/Published by HT Digital Content Services with permission from Hindustan Times. For any query with respect to this article or any other content requirement, please contact Editor at /<a href=""mailto:contentservices@htlive.com"">contentservices@htlive.com</a>"
Delhi's first CNG-based pet crematorium to be operational by April,"India, Jan. 11 -- The South Delhi Municipal Corporation (SDMC) has initiated the construction work on the first municipal pet crematorium of the city in Dwarka and the work on the project is likely to be completed in the next four months by April 2022, leader of the House Inderjeet Sehrawat said on Monday./Sehrawat said that the veterinary department is setting up the city's first CNG-based cremation centre for small animals in Dwarka Sector 29, where provisions will be made to store their ashes for 15 days after being cremated with proper rituals. ""The project is being executed in public-private partnership mode (for 10 years) and the entire cost of construction, upkeep, and maintenance of this crematorium will be taken up by the NGO Green Revolution Foundation. The arrangement with the agency allows it to operate the facility for 10 years and the agency has been selected through an open tender process,"" Sehrawat said./As part of the agreement, the corporation has allotted land for the cremation centre; the SDMC will retain ownership of the crematorium./A senior veterinary department official said that the facility will come up on a 700 square metre site inside the 4-acre dog centre complex in Dwarka where the sterilisation centre is already operational./""Pet owners will be able to get back the ashes. There will be other facilities such as prayer rooms available. We are also making provisions for a locker room. The facility will have two furnaces with a capacity of 200kg biomass capacity and a 150kg biomass capacity per cycle each. Each cremation cycle will take 30 minutes to 1 hour,"" the official said, adding that the facility will be smokeless./""As part of the contract, the developer will have to install an air pollution control system. The CNG eco-friendly crematorium will be constructed with advanced air purification technology to make it 98% smokeless and pollution-free. The smoke will also pass through a wet scrubber. While initially we planned to set up a dog-only crematorium, the project has been expanded to include other small animals such as cats, goat, sheep and monkeys,"" the official explained./Sehrawat said that the corporation has fixed a fee of Rs.2,000 for cremating animals that weigh less than 30 kilograms and Rs.3,000 for cremating dogs and other animals that weigh more. ""Cremation of stray dogs from areas under the jurisdiction of the SDMC will be done free of cost while a rate of Rs.500 has been fixed for the cremation of stray dogs from areas under the jurisdiction of other civic agencies,"" Sehrawat added./The other four agencies-- north MCD, east MCD, New Delhi Municipal Council and Delhi Cantonment Board- will be expected to transport the dead animals to the centre while the NGO has been tasked to ensure transportation of dead animals in SDMC areas to the Dwarka centre, Sehrawat added./The much-delayed project was first announced in 2018. Recently, the north MCD also expressed interest in setting up a similar facility. The Dwarka dog crematorium site had become a point of controversy in April-May, when the city was facing its worst mortality rates due to the second wave of Covid pandemic, and the civic body had decided to create temporary pyre platforms with the goal of expanding the daily Covid cremation capacity. Ultimately, the site was never used for human cremations./Dr Ravindra Sharma, director (veterinary department) SDMC, said since many pet lovers wanted dignified last rites for their pets, the crematorium will also arrange for priests and urns. ""There will be a priest at the crematorium, to perform traditional rituals. At the new crematorium, there will be a facility to store ashes for 15 days from the date of cremation, so that people can collect them later,"" he said./Pet-owners in the city have lauded the idea. Upendra Kumar of Greater Kailash-1, who owns an Alsatian, said that since south Delhi is home to a large number of pet-owners, the crematorium will really be beneficial. ""Many of us had run from pillar to post to get our pets cremated, as south Delhi presently has only a small private crematorium for pets. This new crematorium will certainly give solace to us and peace to the souls of our pets,"" he said./With inputs from Sanjeev Jha/Published by HT Digital Content Services with permission from Hindustan Times. For any query with respect to this article or any other content requirement, please contact Editor at /<a href=""mailto:contentservices@htlive.com"">contentservices@htlive.com</a>"
Dementia: A sharp rise in cases expected - how to avoid being one of them,"India, Jan. 14 -- As scientists predict dementia cases will triple over the next three decades, we asked an expert how to identify the early symptoms and what we can do to avoid it./A diagnosis of dementia is a frightening prospect./Sufferers lose the ability to think, remember and reason so severely that it's difficult to go about daily life. They struggle to control their emotions, to communicate and perform daily tasks. It's debilitating and poorly understood./In the next three decades, the number of people suffering from dementia is set to triple - climbing from about 57 million today to more than 152 million people by 2050, according to results from a new study published in The Lancet./Although it's a grim prediction, many of the risk factors for dementia are what scientists describe as ""modifiable"" - meaning, changes in behavior can affect your chances of developing dementia./So, what can we do to stave off this crippling condition?/Before it's too late, consider these risk factors/Dementia is not a specific disease. It's a general term used to describe the latest stage of a neurodegenerative disease - when it is too late to reverse the changes./Not all of the cognitive impairments that can lead to dementia will, however. Some can be reversed and, crucially, many can be prevented through changes in the way we lead our lives, says Marina Boccardi, dementia expert at the German Research Center for Neurodegenerative Diseases (DZNE)./""If we miss the chance to cure reversable conditions, that's when they could become dementia,"" she told DW./It's difficult to pin down exactly what causes the neurological damages that can be precursors to dementia. But scientists have identified several factors that make your chances much more likely. The Lancet Commission on Dementia Prevention lists 12 main risks: Lower levels of education, hypertension, impaired hearing, smoking, obesity, depression, a lack of physical activity, diabetes and low social contact, as well as excessive alcohol consumption, traumatic brain injuries and air pollution. Recent research has also highlighted a link between sexual assault and dementia./The good news is a majority of these risks can be lowered through changes in behavior, Boccardi points out. ""If we as individuals or our governments do something concrete to reduce these risk factors, we may avoid as many as 40% of dementia cases,"" she told DW./So, how can we prevent dementia?/Many of the risks stem from a lack of stimulation - physical, social and mental./Regular exercise and a healthy diet - low in sugar and saturated fats, devoid of smoking and high alcohol consumption - can reduce the risks associated with diabetes, hypertension, high blood pressure and depression. As can healthy sleeping patterns - not too little or too much. A large study published in 2021 found people in their 50s and 60s who don't get enough sleep are more likely to get dementia later in life./Some research also suggests dancing could be a powerful antidote to loss of brain function./A study in the New England Journal of Medicine involving 469 people over 75 found ""dancing was the only physical activity associated with a lower risk of dementia."" By stimulating both the mind and the body, dancing offers a two-pronged benefit: Along with engaging the brain, requiring memory, coordination and cognition, the physical activity of dancing can also lower the risk of cardiovascular disease./Some factors, however, have more to do with privilege and chance - such as low education levels, brain injuries, assault, air pollution and, in many cases, obesity. These risks are not so easily modified./Why detection of early symptoms and treatment are so important/Often, by the time patients begin to notice the impact of a neurodegenerative disease on their daily lives - memory loss and tremors, for example - the disease has been at work for many years and it's too late to reverse the damage. Brain changes such as the build up of proteins linked to Alzheimer's disease, for example, are known to start about 15 to 20 years before patients show cognitive impairments./That's why early detection is so important, Boccardi says, because this allows for treatment./The early stages of dementia tend to start with forgetfulness, losing track of time and getting lost in familiar places. Anxiety and depression can also serve as early indicators that something is not right, especially for younger patients./And although many people can experience these things without suffering from a serious illness, Boccardi advises to pay attention if you find yourself thinking ""oh, this is really not me"" and find it worrisome. The same goes for family members. ""If you notice relevant changes in behavior in family members that they might not notice themselves or might be hiding, that's a good time to get a medical check,"" she said./Whatever you do, don't ignore it, says Boccardi - including when someone has received a neurodegenerative diagnosis, as isolation and lack of treatment will only worsen the condition./""Fear and stigma around dementia keeps people from doing what you should actually do - keep up social interaction, keep doing things and being active, doing what you can do, which is often quite a lot.""/Published by HT Digital Content Services with permission from Hindustan Times. For any query with respect to this article or any other content requirement, please contact Editor at /<a href=""mailto:contentservices@htlive.com"">contentservices@htlive.com</a>"
