headline,body
The interplay between the pandemic and pollution,"New Delhi, July 17 -- Air quality was gradually gaining political salience in India over the lastfewyears,butthecoronavirus pandemic and the deepening economic recession may now change the speed, and possibly direction, of progress./As the country battles a public health crisis of staggering proportions, we must remind ourselves that we do not have the luxury of tackling air pollution at a later point. Air pollution is a risk factor that, based on current information, has a long-term mortalityandmorbidity burdengreaterthanCovid- 19, given the severity of pollution levels./It also increases the risk of infections such as Covid-19. Although restrictions during the lockdown mechanically led to temporary improvements in air quality, as economic activities resume, air pollution too will return to plague us./In the context of air quality management, our analysis reveals that the disruptions caused by the pandemic, and actions taken in response to these are likely to result in three sets of outcomes, each offering a different call to action: New opportunities to accelerate transitions, dilution of safeguards in theguiseofincentivisingeconomic recovery that need to be contested, and avenues for sustaining recent progress./The first set of outcomes present opportunities to set a new agenda, or provide an impetus to existing policy measures. These opportunities, when harnessed, will allow us to lock-in infrastructure or accelerate behavioural changes that are well-aligned with improved environmental and health outcomes, particularly air quality. We identified five such opportunities./One, providing increased, better-targeted subsidiesaspartofasocialprotection package to allow poor households to use LPG as their primary cooking fuel. This would be consistent with the three LPG cylindersincluded intheGaribKalyanYojana package. Two, sustaining the increased rate of shifting away from paddy cultivation in Punjab and Haryana due to labour constraints, and ensuring that the alternatives (for example,maize, cotton) are viable for farmers. Three, focusing the demand for vehicle scrappage policies towards the replacement of old, heavily polluting vehicles, especially trucks. Four, retiring old coal power plants so that newer or less polluting plants can meet a larger fraction of power demand, while likely easing the financial crisis in the sector. Finally, increased acceptability and experience with work-from-home and online meetings need to be sustained to reduce commute by private vehicles and taxis./In the second set lie potentially regressive outcomes, which need to be firmly contested./Some of these outcomes arise from the government's efforts to dilute environmental safeguards, formally or informally, while citing the need for urgent economic recovery and improving the ""ease of doing business"". For instance, the Draft Environmental Impact Assessment Notification 2020 that is currently under consideration will have massive implications for the country's air quality. It dilutes the process to obtain environmental clearance, reduces the categories of projects and activities that will have to undergo impact-assessment scrutiny, curtails public consultation processes significantly, and proposes procedures to deal with violations that are legallyuntenable,andwilleffectivelyallow environmental offences to be condoned at very little or no cost to the violator./Another example is the government's tacit support to power plants that have failed to comply with the 2015 emission standards by extending the deadlines. The health costsoftheirnon-compliancecannolonger be ignored, and the pandemic cannot become yet another basis for delaying compliance./Finally, the call for greater transparency in monitoring, inspection and enforcement data from the pollution control boards becomes more urgent to ensure dilutions in day-to-day regulation do not go unnoticed./In the third set are areas that we believe will not be directly impacted by the pandemic, but where we need to actively sustain the discourse, develop ideas and make progressonlonger-termsystemicimprovements./The framework of the National Clean Air Programme (NCAP) needs continued strengthening, in particular on developing uniform processes for identifying non-attainment cities and to track inter-year air quality improvements./ThefirstyearofNCAP(2019-20)washobbled by its modest budget. However, this year, the newly-allocated performancebased grants linked to air quality from the 15th Finance Commission (FC) substantially increases the resources available to the large cities - totalling ~4,400 crore to 42 urban agglomerations with million-plus populations. Effective utilisation of these funds needs significantly greater efforts by stateandmunicipalgovernmentstoengage with civil society in prioritising actions./Further, the grants need to be sustained over the 2021-26 period of the 15th FC, and need to shift - together with NCAP - towards managing air quality at the regional, ""airshed"" level. At the same time, investments in sustainable infrastructure, and improvements in public services that will lead to cleaner air will need to be undertaken in parallel with developing the knowledge base on sources and air quality monitoring./The pandemic has appropriately brought about an urgent response, given the scale of its effects. As we set in motion recoveryplans,wemustremember thatair pollution-linked deaths and disease must also be tackled with the urgency they deserve./Santosh Harish and Shibani Ghosh are fellows at the Centre for Policy Research (CPR), New Delhi. They have recently published a report titled ""Pursuing a clean air agenda during the Covid crisis"" The views expressed are personal/Published by HT Digital Content Services with permission from Hindustan Times. For any query with respect to this article or any other content requirement, please contact Editor at /<a href=""mailto:contentservices@htlive.com"">contentservices@htlive.com</a>"
MMR's air quality monitoring mechanism takes a hit as most stations go kaput,"India, July 23 -- The densely populated Mumbai Metropolitan Region's (MMR) air quality monitoring mechanism has taken a hit because of the raging coronavirus disease (Covid-19) outbreak coupled with several monitoring stations have been lying dysfunctional, data showed./Three air quality-monitoring stations, located at Malad, Colaba, and Navi Mumbai, have been dysfunctional for the past week under the System of Air Quality Weather Forecasting and Research (SAFAR)./While four stations under the Maharashtra Pollution Control Board (MPCB) at Borivali, Worli, Navi Mumbai (Nerul) and Dombivli have not been operational since June./The Borivali station has gone kaput since April 11./""The four stations have reported technical snags pertaining to internet connectivity and power failure. There is also an accessibility issue with the Borivali station because it is located inside the Sanjay Gandhi National Park. Though the data is not being regularly updated on the website, it is being meticulously collated,"" said VM Motghare, joint director (air quality), MPCB./SAFAR has been monitoring and forecasting air quality using real-time information from 10 stations in MMR -- the urban agglomeration around Mumbai -- since June 2015./While MPCB launched its air quality-monitoring stations across 15 locations in MMR last year./At present, the overall pollutant-measuring indicator --- air quality index (AQI) -- for Mumbai is done on the basis of an average of seven stations/-- Bhandup, Mazgaon, Borivli, Chembur, Worli, Bandra Kurla Complex (BKC), and Andheri -- for SAFAR and 11 stations for MPCB./MPCB data is used to tabulate annual average air quality information made available to the Centre's National Clean Air Program (NCAP), which was launched in January 2019./SAFAR researchers said all three monitoring stations are located near Covid-19 containment zones./""This is the first time we are monitoring air pollution data, when some of our stations are not functioning,' said Gufran Beig, project director, SAFAR./""We have a team of engineers, who regularly visit these stations to ensure that there are no technical snags. However, the frequency of their regular visits has vastly reduced because of the pandemic. Besides, restrictions are in place since many of these stations are located near or within containment zones. We are hoping that the data will be live again soon,"" he added./HT had reported on April 15 that there were data gaps in MPCB's real-time AQI data, when officials had said the state pollution control board was not listed as an essential service during the Covid-19 lockdown restrictions imposed by the Maharashtra government in end-March in a bid to contain the spread of the Covid-19 outbreak./""Three monitoring stations such as Borivali, Nerul, and Dombivali are located in containment zones, while the Worli station has reported technical glitches. There have been persistent issues with the station at Borivali. Work is in progress to resume the availability of real-time air quality data,"" said an MPCB official, requesting anonymity./Independent researchers have called for the installation of an automated facility for an uninterrupted supply of real-time air-quality data./""By definition, these stations don't need human intervention and they are designed to be operational 24x7. We need to ascertain the causes of these stations going offline and the specific technical snags that are deterrent to their smooth functioning,"" said Ronak Sutaria, an independent air quality expert./On Thursday, Mumbai's AQI was 50, which comes under SAFAR's ""good"" category./The corresponding count for MPCB was 54 or ""satisfactory"". SAFAR has predicted 47, or ""good"" for Friday./""Air quality in Mumbai is likely to oscillate between good and satisfactory level for the next week depending on how much rain the city receives. Pollution levels are likely to rise in end-July or early August, if there is a break-monsoon period,"" Beig said./Published by HT Digital Content Services with permission from Hindustan Times. For any query with respect to this article or any other content requirement, please contact Editor at /<a href=""mailto:contentservices@htlive.com"">contentservices@htlive.com</a>"
Air pollution cuts Indians' life expectancy by 5.2 years: Report,"New Delhi,, July 28 -- Pollution levels in India shave off 5.2 years from the life expectancy of the average Indian and it most acutely hits people living in the Indo-Gangetic plains, according to an assessment by the Energy Policy Institute at the University of Chicago, which also showed that the situation had slightly improved between 2016 and 2018./India is the second most-polluted country globally after Bangladesh, while Nepal, Singapore and Pakistan are the other top countries with dirty air. The authors use an air quality life index (AQLI), which takes particulate air pollution and determines the hit it has on life expectancy./According to the AQLI, India's yearly average particulate pollution concentration of 63.2 ug/m3 in 2018 reduced life expectancy of the average Indian by 5.2 years. The life expectancy lost in 2016 was 6.1 years when the particulate pollution - which is linked to diseases affecting the lungs and heart - was at 71ug/m3./Also read: The interplay between the pandemic and pollution | Analysis/In 2018, Lucknow's (the most polluted district in the country) residents were exposed to an average annual PM 2.5 concentrations of 114.6 micrograms per cubic metres which is likely to cut short life expectancy by 10.3 years compared./That makes Lucknow the most polluted district in the country followed by 13 other districts, all in Uttar Pradesh./The National Capital Territory of Delhi is the 15th most-polluted region in the country as per the analysis, which relies on satellite data. The average PM 2.5 concentration was 106 micrograms per cubic metres which can lead to loss of 9.4 life years compared to if Delhi had met the WHO guidelines for air quality./The analysis did not include figures from 2019 and 2020./The report, released in India, Pakistan and Bangladesh on Tuesday evening, showed air pollution problem that was severe in India in the late 90's only worsened further in recent years with an estimated life expectancy loss of 3.4 years in 1998, 4.8 years in 2010 and 6.1 years in 2016./China, however, stands out as a success story as per the data. Singapore, China and India were the three most polluted countries in 1998 with the Chinese losing 3.6 years of life to pollution but by 2018, China was the seventh most polluted and had improved its life expectancy by 1.3 years. Singapore has also improved./China declared a ""war against pollution"" in 2013 with some aggressive reforms. Since then, three-quarters of the world's reductions in pollution have come from China and it has reduced PM 2.5 pollution by nearly 40% during the period according to the analysis./""Though the threat of coronavirus is grave and deserves every bit of the attention it is receiving- perhaps more in some places-embracing the seriousness of air pollution with a similar vigour would allow billions of people around the world to lead longer and healthier lives,"" said Michael Greenstone, the Milton Friedman distinguished service professor in Economics and creator of the AQLI along with colleagues at the Energy Policy Institute at the University of Chicago (EPIC)./""The reality is, no shot in the arm will alleviate air pollution. The solution lies in robust public policy. The AQLI tells citizens and policymakers how particulate pollution is affecting them and their communities and can be used to measure the benefits of policies to reduce pollution.""/Over 20 years, India's annual PM 2.5 levels have increased by 42%, taking 1.8 years off the life of the average resident./A quarter of India's population is exposed to air pollution concentrations not recorded in any other country, with 248 million people in north India on track to lose more than 8 years of life expectancy if the same pollution levels persist./There is also emerging evidence that air pollution aggravates Covid-19 complications and increases mortality./""In northern Italy which is highly polluted covid 19 mortality was 12% compared to southern Italy where it was 4.5 %. There was also a study published by Harvard University which said even with a 1 microgram per cubic metre increase in PM 2.5, covid 19 mortality goes up but it has to be long term exposure to air pollution. These two are landmark studies. Even during the SARS epidemic in 2003 mortality was higher in polluted areas, even during the Spanish Flu in 1918 mortality was higher around coal plants. So, there is a clear link between air pollution and covid 19 mortality and morbidity. This is to do with how air pollution affects the airways and immune system of the lungs,"" said Dr GC Khilnani, PSRI institute of critical and pulmonary and critical and former and head of pulmonary medicine at AIIMS./Published by HT Digital Content Services with permission from Hindustan Times. For any query with respect to this article or any other content requirement, please contact Editor at /<a href=""mailto:contentservices@htlive.com"">contentservices@htlive.com</a>"
Indians' life expectancy cut 5.2 yrs by pollution,"New Delhi, July 29 -- Pollution levels in Indiashaveoff 5.2yearsfromthe life expectancy of the average Indian and it most acutely hits peoplelivingintheIndo-Gangetic plains, according to an assessment by the Energy Policy InstituteattheUniversityofChicago, whichalsoshowedthatthesituation had slightly improved between 2016 and 2018./India is the second most-polluted country globally after Bangladesh,while Nepal, Singapore and Pakistan are the other top countries with dirty air. The authors use an air quality life index (AQLI), which takes particulate air pollution and determines the hit it has on life expectancy. According to the AQLI,India'syearlyaverageparticulatepollution concentration of 63.2 ug/m3 in 2018 reduced life expectancyoftheaverageIndian by 5.2 years. The life expectancy lostin2016was6.1yearswhenthe particulate pollution - which is linked to diseases affecting the lungsandheart-wasat71ug/m3./In 2018, Lucknow's (the most polluted district in the country) residents were exposed to an average annual PM 2.5 concentrations of 114.6 micrograms per cubicmetreswhichislikelytocut shortlifeexpectancyby10.3years compared. ThatmakesLucknow the most polluted district in the country followed by 13 other districts, all in Uttar Pradesh./TheNationalCapitalTerritory ofDelhiisthe15thmost-polluted region in the country as per the analysis,whichreliesonsatellite data.TheaveragePM2.5concentration was 106 micrograms per cubic metres which can lead to lossof9.4lifeyearscomparedtoif Delhi had met the WHO guidelines for air quality./The analysis did not include figures from 2019 and 2020./The report, released in India, Pakistan and Bangladesh on Tuesdayevening,showedairpollutionproblemthatwasseverein India in the late 90's only worsened further in recent years withanestimatedlifeexpectancy loss of 3.4 years in 1998, 4.8 years in 2010 and 6.1 years in 2016./China,however,standsoutas a success story as per the data./Singapore,ChinaandIndiawere thethreemostpollutedcountries in1998withtheChineselosing3.6 years of life to pollution but by 2018,Chinawastheseventhmost pollutedandhadimproveditslife expectancy by 1.3 years. Singapore has also improved./Chinadeclareda""waragainst pollution"" in 2013 with some aggressive reforms. Since then, three-quarters of the world's reductions in pollution have come from China and it has reduced PM 2.5 pollution by nearly 40% during the period according to the analysis./""Thoughthe threat of coronavirusisgraveanddeservesevery bit of the attention it is receiving- perhaps more in some places- embracingtheseriousness ofairpollutionwithasimilarvigourwouldallowbillionsofpeople around the world to lead longer andhealthierlives,""saidMichael Greenstone, the Milton Friedman distinguished service professor in Economics and creator oftheAQLIalongwithcolleagues at the Energy Policy Institute at theUniversityofChicago(EPIC)./""The reality is, no shot in the arm will alleviate air pollution./Thesolutionliesinrobustpublic policy. The AQLI tells citizens and policymakers how particulate pollution is affecting them andtheircommunitiesandcanbe used to measure the benefits of policies to reduce pollution."" Over 20 years, India's annual PM 2.5 levels have increased by 42%,taking1.8yearsoffthelifeof theaverageresident. Aquarterof India's population is exposed to air pollution concentrations not recorded in any other country, with 248 million people in north Indiaontracktolosemorethan8 years of life expectancy if the same pollution levels persist./There is also emerging evidence that air pollution aggravatesCovid- 19complicationsand increases mortality./""In northern Italy which is highly polluted Covid 19 mortality was 12% compared to southernItalywhereitwas4.5%./There was also a study published by Harvard University which said even with a 1 microgram per cubic metre increase in PM 2.5, Covid 19 mortality goes up but it has to be long term exposure to airpollution.Thesetwoarelandmark studies. Even during the SARSepidemicin2003mortality was higher in polluted areas. So, there is a clear link between air pollution andCovid 19mortality and morbidity...,"" said Dr GC Khilnani, PSRI institute of critical and pulmonary and critical and former and head of pulmonary medicine at AIIMS./Published by HT Digital Content Services with permission from Hindustan Times. For any query with respect to this article or any other content requirement, please contact Editor at /<a href=""mailto:contentservices@htlive.com"">contentservices@htlive.com</a>"
Schools won't reopen till Covid is beaten: Arvind Kejriwal,"New Delhi,, Aug. 15 -- Delhi chief minister Arvind Kejriwal on Saturday said schools in the national Capital will not reopen until the Covid-19 situation is completely under control. The CM made the announcement in his address during the Delhi government's Independence Day celebrations, which were curtailed this year due to the pandemic and were held at the Secretariat at ITO instead of the Chhatrasal Stadium./Addressing cabinet ministers, legislators, officials and the seven corona warriors, who were special invitees at the Delhi government's Independence Day function, the chief minister talked about the 'Delhi Model' and emphasised how aggressive testing, home isolation and plasma therapy were the game-changers in the Capital's fight against Covid-19./""In June, many people had started leaving Delhi because Covid-19 had spread widely in the city. But in just a few weeks, the two crore people of Delhi controlled the situation with their resolve, hard work and dedication. Though the situation is much better than two months ago, we still have a long way to go. We have not won the battle yet,"" Kejriwal said during his Independence Day speech./He thanked all stakeholders, including the Central government, the corona warriors and various organisations./""When I meet parents, they all request only one thing-that schools should not reopen yet. We care for your children as much as you do. I want to assure all parents that we will not reopen schools in Delhi until we are fully convinced (about the city's Covid-19 situation),"" Kejriwal said./Unlike previous years when the Delhi government's independence day function was held at the Chhatrasal Stadium, this time, owing to the pandemic, it was organised at the Delhi secretariat at ITO. Fewer people were invited due to restriction on large gatherings./The chief minister also announced that from next week the Delhi government will start sending oxygen concentrators to the homes of Covid-19 patients even if they have recovered from the disease./""These days we are hearing about cases where a Covid-19 patient tests negative, is declared recovered and is discharged from the hospital. But, within hours or a day or two, suddenly the person's oxygen concentration decreases and the person dies. To prevent this, from next week we will be sending oxygen concentrators to all those who need it,"" he said./Kejriwal had on June 22 announced the same while launching the scheme of distributing pulse oximeters to all Covid-19 patients under home isolation. Officials said while distribution of pulse oximeters has started, the oxygen concentrator drive could not take off in full swing due to some ""technical issues""./While adding that the subsidies on water, electricity and bus rides for women will continue, he also talked about reviving the economy by consulting with traders and entrepreneurs./He also highlighted how the Delhi government managed to reduce air pollution, an annual crisis in Delhi during the winter months, and deaths caused by dengue and other mosquito borne diseases during the monsoon./The CM announced re-launching of Delhi government's '10 Hafte-10 Baje-10 Minute' (10 weeks-10'O clock-10 minutes) programme to check cases of dengue and other monsoon diseases. The drive was first launched in September last year. The campaign, Kejriwal said will be launched again from the first week of September during which people would be encouraged to inspect their homes for stagnant water to prevent breeding of mosquitoes./Before his formal speech, Kejriwal shared a video message in which he urged people to take three pledges. ""First, today take the pledge that neither will you give nor accept bribe. Second, pledge against pollution. Do not contribute to pollution - be it air, water or land. Third, keep your city and environment clean. Do not litter,"" he said./Talking about the many firsts which the Capital has seen during the pandemic, Kejriwal said Delhi was the first to introduce the home isolation model in India which further helped in scaling up testing. Another first was starting the plasma therapy through which more than 750 people have recovered, he said./""The Delhi government is the first government in the country to have reduced the price of diesel by Rs 8 straightaway. I think this will also affect the inflation rate and help push the economy forward. Our's is also the only government to announce an assistance of Rs 1 crore on the death of a Corona warrior. There is no monetary value attached to the lives of the people, they are invaluable to their families, but this gave the Corona warriors assurance that there is a government that takes care of them, and if they are working for the people of the country by risking their lives, the government is also working for them,"" the chief minister said./During the ceremony, the government honoured seven people which included an assistant superintendent and three head warders. The corona warriors included additional district magistrate (Central) Rajeev Singh Parihar, Rajiv Gandhi Super Specialty Hospital's senior medical officer Hirdesh Kumar, LNJP Hospital's nursing officer Sonu, police constable Pradeep Chauhan, CATS ambulance driver Tej Bahadur, Civil Defence volunteer Dina Nath Yadav and municipal sanitation worker Ashok Kumar./Published by HT Digital Content Services with permission from Hindustan Times. For any query with respect to this article or any other content requirement, please contact Editor at /<a href=""mailto:contentservices@htlive.com"">contentservices@htlive.com</a>"
