headline,body
"Clear blue skies, AQI at 45 bring some good news","New Delhi, March 29 -- Delhi woke up to clear blue skies yet again on Saturday, Day 4 of the 21-day lockout announced by the government to halt the spread of Covid-19./Clear blue skies have become the norm rather than the exception in the National Capital Region (NCR) around Delhi for the past week. Data, too, shows a sharp decline in pollution./Morning and evening peaks in the level of PM 2.5 (particulate matter 2.5, or fine, respirable pollution particles) have flattened out in the four days since the lockdown came into force, according to a new analysis by the Centre for Science and Environment (CSE). The air quality index for the Capital, according to the Central Pollution Control Board's 4pm bulletin was 45, which falls in the ""good"" zone -- rare in a city where a reading in the ""poor "" category is otherwise considered good. The reduction in nitrogen dioxide (NO2) concentrations is even more pronounced because the major source of NO2 emissions are vehicles, which have gone off the roads, and industries, which have been ordered to close to reduce the risk of infection./The hourly pollution trend in Delhi and in the neighbouring cities of Gurugram, Faridabad, Noida and Ghaziabad analysed by CSE used to be influenced by traffic peaks in the mornings and evenings, a factor hasn't been relevant in the past four days./For example, in Delhi the daily peak PM 2.5 concentrations has declined on a lockdown day by about 57% compared to a regular day and the peak on the ""Janta Curfew"" day (Sunday, March 22) dropped by about 24% compared to a regular day. The peak concentrations of NO2 dropped by 66% on a lockdown day compared to a regular day and by 32% on the people's curfew day. The so-called Janta Curfew was called for by Prime Minister Narendra Modi as a sort of a trial in social distancing and self-isolation. The lockdown was announced two days later./""This analysis brings out the pronounced effect of traffic on hourly pollution trend and on daily exposures to toxic vehicular pollution. With traffic minimised, hourly trends plummet. This is sharply evident in NO2 trends,"" CSE said in its analysis./The fact that the impact was comparatively lower on Janta Curfew may have had to do with its shorter duration of 14 hours, the study said. ""Subsequent lockdown is more rigorous and pertains to 24 hours with curfew rules in place,"" it said. There's also the cumulative effect to be taken into account./The main source of NO2 emissions is fuel combustion by vehicles and industries. NO2 is more reactive than PM 2.5, and being exposed to high NO2 emissions even for a short duration can aggravate respiratory disease particularly asthma, according to the US Environment Protection Agency./Globally, four million new child asthma cases are attributable to NO2 pollution a year; 64% of these occur in urban centres, according to a study published in Lancet Planetary Health./""This experience has helped us to understand the strong impact of traffic volume on hourly variability in pollution and exposure in cities. We are already making massive lifestyle adjustments to practice social distancing,"" said Anumita Roy Chowdhury, executive director, Centre for Science and Environment. ""Can this crisis-induced change throw up long-term solutions to traffic impact on air pollution? Collective community action during this pandemic can help us to reinvent longer term solutions to reduce our vulnerability to toxic risk.""/""Since every source of emissions is curtailed, air pollution levels have reduced drastically in Delhi-NCR. We are in agreement with CSE but we are also doing an analysis in-house,"" said VK Shukla, head of the air quality management division at CPCB. The Regional Weather Forecasting Centre (RCFW) in Delhi, meanwhile, released historical data for the maximum temperature recorded in April, which ranges from 39.6 degree Celsius in 1994 to 43.7 degrees Celsius in 2010./The impact of heat and humidity on the Sars-CoV-2 virus that causes Covid-19 is not clear./""Data analysis since 1992 shows maximum temperature over Delhi reaches 40 degree C during April 17 to 20. If temperature and humidity play a role in reduction of transmission of the virus, we will be able to see the trends in April. But things will be different if people use air conditioning indoors,"" said Kuldeep Shrivastava, head, RWFC./The average maximum temperature in March in Delhi is 29.6 degree C compared to 28 degree C recorded till now. But on most days in March this year, the maximum temperature has been 3 to 4 degree C below normal with only seven days when the maximum was 30 degree C or above. This is because of the unusually high number of western disturbances which affected the northwestern region this month. There have been six active western disturbances which brought rain, hail or snowfall to different parts of northwest India compared to an average of 2-3 typical for March. ""The westerlies are still impacting the Indian region. They are supposed to move northwards gradually in March. This is why we are seeing more western disturbances. Parts of Central India and south India are already recording 35 degree C. We can expect it to hit 35 degree C in north India in early April,"" said DS Pai, a scientist at the India Meteorological Department (IMD), Pune./Clear skies and less noise means that bird song can be heard clearly in many neighbourhoods of the capital. ""'I have had a lot of people asking me if bird song has increased. No, it has always been there particularly in this season. This is also the courting and nesting season for many birds -- sunbirds, barbets and doves. So they sing or call for long periods. People now have the time to pause, listen and take in the song. The lack of planes and cars also helps as planes and car horns are sources of noise pollution,"" said Neha Sinha, a Delhi-based conservation biologist./Published by HT Digital Content Services with permission from Hindustan Times. For any query with respect to this article or any other content requirement, please contact Editor at /<a href=""mailto:contentservices@htlive.com"">contentservices@htlive.com</a>"
"Coronavirus update: Clear blue skies in Delhi, AQI at 45 bring some good news","New Delhi, March 29 -- Delhi woke up to clear blue skies yet again on Saturday, Day 4 of the 21-day lockout announced by the government to halt the spread of Covid-19./Clear blue skies have become the norm rather than the exception in the National Capital Region (NCR) around Delhi for the past week. Data, too, shows a sharp decline in pollution./Morning and evening peaks in the level of PM 2.5 (particulate matter 2.5, or fine, respirable pollution particles) have flattened out in the four days since the lockdown came into force, according to a new analysis by the Centre for Science and Environment (CSE). The air quality index for the Capital, according to the Central Pollution Control Board's 4pm bulletin was 45, which falls in the ""good"" zone -- rare in a city where a reading in the ""poor "" category is otherwise considered good./The reduction in nitrogen dioxide (NO2) concentrations is even more pronounced because the major source of NO2 emissions are vehicles , which have gone off the roads, and industries, which have been ordered to close to reduce the risk of infection./The hourly pollution trend in Delhi and in the neighbouring cities of Gurugram, Faridabad, Noida and Ghaziabad analysed by CSE used to be influenced by traffic peaks in the mornings and evenings, a factor hasn't been relevant in the past four days./For example, in Delhi the daily peak PM 2.5 concentrations has declined on a lockdown day by about 57% compared to a regular day and the peak on the ""Janta Curfew"" day (Sunday, March 22) dropped by about 24% compared to a regular day. The peak concentrations of NO2 dropped by 66% on a lockdown day compared to a regular day and by 32% on the people's curfew day./The so-called Janta Curfew was called for by Prime Minister Narendra Modi as a sort of a trial in social distancing and self-isolation. The lockdown was announced two days later./""This analysis brings out the pronounced effect of traffic on hourly pollution trend and on daily exposures to toxic vehicular pollution. With traffic minimised, hourly trends plummet. This is sharply evident in NO2 trends,"" CSE said in its analysis./The fact that the impact was comparatively lower on Janta Curfew may have had to do with its shorter duration of 14 hours, the study said. ""Subsequent lockdown is more rigorous and pertains to 24 hours with curfew rules in place,"" it said. There's also the cumulative effect to be taken into account./The main source of NO2 emissions is fuel combustion by vehicles and industries. NO2 is more reactive than PM 2.5, and being exposed to high NO2 emissions even for a short duration can aggravate respiratory disease particularly asthma, according to the US Environment Protection Agency./Globally, four million new child asthma cases are attributable to NO2 pollution a year; 64% of these occur in urban centres, according to a study published in Lancet Planetary Health./""This experience has helped us to understand the strong impact of traffic volume on hourly variability in pollution and exposure in cities. We are already making massive lifestyle adjustments to practice social distancing,"" said Anumita Roy Chowdhury, executive director, Centre for Science and Environment. ""Can this crisis-induced change throw up long-term solutions to traffic impact on air pollution? Collective community action during this pandemic can help us to reinvent longer term solutions to reduce our vulnerability to toxic risk.""/""Since every source of emissions is curtailed, air pollution levels have reduced drastically in Delhi-NCR. We are in agreement with CSE but we are also doing an analysis in-house,"" said VK Shukla, head of the air quality management division at CPCB./The Regional Weather Forecasting Centre (RCFW) in Delhi, meanwhile, released historical data for the maximum temperature recorded in April, which ranges from 39.6 degree Celsius in 1994 to 43.7 degrees Celsius in 2010./The impact of heat and humidity on the Sars-CoV-2 virus that causes Covid-19 is not clear./""Data analysis since 1992 shows maximum temperature over Delhi reaches 40 degree C during April 17 to 20. If temperature and humidity play a role in reduction of transmission of the virus , we will be able to see the trends in April. But things will be different if people use air conditioning indoors,"" said Kuldeep Shrivastava, head, RWFC./The average maximum temperature in March in Delhi is 29.6 degree C compared to 28 degree C recorded till now. But on most days in March this year, the maximum temperature has been 3 to 4 degree C below normal with only seven days when the maximum was 30 degree C or above. This is because of the unusually high number of western disturbances which affected the northwestern region this month. There have been six active western disturbances which brought rain, hail or snowfall to different parts of northwest India compared to an average of 2-3 typical for March./""The westerlies are still impacting the Indian region. They are supposed to move northwards gradually in March. This is why we are seeing more western disturbances. Parts of Central India and south India are already recording 35 degree C. We can expect it to hit 35 degree C in north India in early April,"" said DS Pai, a scientist at the India Meteorological Department (IMD), Pune./Clear skies and less noise means that bird song can be heard clearly in many neighbourhoods of the capital. ""'I have had a lot of people asking me if bird song has increased. No, it has always been there particularly in this season. This is also the courting and nesting season for many birds -- sunbirds, barbets and doves. So they sing or call for long periods. People now have the time to pause, listen and take in the song. The lack of planes and cars also helps as planes and car horns are sources of noise pollution,"" said Neha Sinha, a Delhi-based conservation biologist./For PM 2.5 and NO2 concentration analysis following days have been considered by CSE:/* Regular: Average of March 18 and 19/* Lockdown: Average of March 25 and 26/* Janata Curfew: Average of March 22 March/Published by HT Digital Content Services with permission from Hindustan Times. For any query with respect to this article or any other content requirement, please contact Editor at /<a href=""mailto:contentservices@htlive.com"">contentservices@htlive.com</a>"
"Pollution down, sky clearer: Amateur astronomers have a good time","Kolkata, March 30 -- : Amateur astronomers in cities across India are making the best out of a bad situation to observe celestial objects -- stars, constellations and planets -- in skies that have become unusually clear because of reduced pollution after the all-India lockdown came into force on May 25 to stop the spread of the coronavirus (Covid-19)./The night skies, especially, have brightened with many more stars visible, according to astrophysicists in Kolkata who are monitoring celestial events with a telescope./""The stars, which were earlier only eight times brighter compared to the black sky in the background, have become at least 13 times brighter now compared to the black background. With the help of our telescopes we can now observe stars which were at least three times fainter earlier,"" said Sandip K Chakrabarti, director of Indian Centre for Space Physics (ICSP) and former head of the astrophysics and cosmology department at the SN Bose National Centre for Basic Sciences./HT reported on March 24 a general improvement in air quality across the world amid lockdowns to check the spread of Covid-19. The European Space Agency (ESA) has released satellite images showing a plunge in nitrogen dioxide (NO2) levels. In India, the government has cancelled flights and trains and taken public transport off the roads./""Constellations such as the Orion, Auriga, Gemini and Canis Minor have become much brighter now. One can see these constellations much clearly because of the drop in air pollution levels,"" said Basudev Bhattacharya, president ofthe Sky Watchers' Association in Kolkata./The concentration of aerosols that used to scatter light and create a dense haze have dropped because of the lockdown. An analysis by the Centre for Science and Environment in Delhi has revealed that morning and evening peaks in PM 2.5 (particulate matter 2.5, fine, respirable pollution particles) levels have flattened out./""As a result of this, several stars and planets have become much brighter. The Canopus star in the southern hemisphere is looking quite bright. Planets such as Jupiter, Mars and Saturn have become brighter and can be seen before dawn around 4 am. Venus is also looking brighter in the evening sky,"" said J Khemchandani, secretary of Ahmedabad's astronomy club./""The sky is now dotted with stars, many of which were earlier not visible. Earlier, only two objects from the deep sky were visible. But now I can see at least five including the Little Beehive star cluster, Messier 36, Messier 37 and Messier 38. These could be seen in the western sky in the evening. Earlier I could see only two to three stars of the Scorpio constellation. But now I can see the entire constellation. Even the pole star is shining brightly over the last one week or so,"" said Sneh Kesari, an amateur astronomer in Delhi./Published by HT Digital Content Services with permission from Hindustan Times. For any query with respect to this article or any other content requirement, please contact Editor at /<a href=""mailto:contentservices@htlive.com"">contentservices@htlive.com</a>"
Uran dump threatens safety of 3K residents; No alternatives amid Covid-19 lockdown say officials,"Mumbai, March 31 -- Amid nationwide lockdown due to coronavirus pandemic, a garbage dump in Uran has been on fire for the past 15 days, sending toxic fumes into the air and threatening mangrove forest and a gas pipeline in its vicinity./Over 3,000 affected Uran residents have been demanding the closure of the 13-year-old dump but district officials said even though an alternate site was identified, it was impossible to operate a new landfill amid the current lockdown scenario./The fire, cause of which is unknown, has now started spreading across mangrove forests, and is dangerously close to a gas pipeline that belongs to the Oil and Natural Gas Corporation Ltd (ONGC)./Environmentalists filed a fresh complaint before the Maharashtra government and Bombay high court (HC) appointed mangrove protection committee on Tuesday. In January, the HC committee had directed City Industrial Development Corporation (Cidco) and the Raigad collector to find an alternative site while revenue officials had booked the Uran Municipal Council (UMC) workers for environmental destruction./""We have been posting daily fire bulletins to all state and central agencies, including the Prime Minister's Office, pleading for immediate intervention before the situation gets worse,"" said BN Kumar, director, NatConnect Foundation. ""However, there has been no visible action.""/An ONGC official requesting anonymity said, ""The dump site is a ticking time bomb and poses a health risk. It can spread more infection during this crisis period. A temporary alternate arrangement needs to be made at the earliest.""/HT had reported in January that an alternative site had been identified and finalised at Navghar but it would take time to make it operational./Raigad collector Nidhi Choudhari said, ""The process of acquiring final no-objection certificates is already underway but owing to the lockdown everything is stalled. The process will take time while acquiring clearance from Cidco [landowners]. Meantime, all complaints are being swiftly addressed.""/Residents alleged that taking advantage of the lockdown, the UMC ignored their concerns while they suffer due to unchecked air pollution. ""To make matters worse, the civic body started spraying pesticides in heavy doses on the garbage being dumped,"" said Samir Ashrit, resident of Bori Pakhadi./Started in 2007, the two-hectare dumping ground is located between Bori Pakhadi and Hanuman Koliwada villages receives 3,000 kg of waste per day. A residential colony is located less than 100-m away from the dump on one end while dense mangrove cover on the other./Last Wednesday, a massive fire was doused by ONGC fire tenders as the police booked three unidentified persons for starting the fire./Awdhut Tawde, chief executive officer, UMC alleged there was foul play by local residents. ""We were told that one major fire was due to a short circuit but continuous small fires are being lit purposely. We are investigating this. To avoid any mishap, we are building a fence to cordon off the site from mangroves and the pipeline.""/Another resident Pritam Thakur said, ""We have been facing breathing problems due to the smoke billowing out of the burning plastic, rubber, tyres and other muck. After the UMC flattened the garbage, mangroves are now choking.""/Published by HT Digital Content Services with permission from Hindustan Times. For any query with respect to this article or any other content requirement, please contact Editor at /<a href=""mailto:contentservices@htlive.com"">contentservices@htlive.com</a>"
Scientists use lockdown to get data on unpolluted Delhi air,"Kolkata, April 1 -- The 21-day nationwide lockdown, coupled with favourable weather conditions, is not just giving Delhi its cleanest air possible, it is also allowing scientists to determine the city's baseline pollution levels -- for the very first time./With pollution sources brought down to a bare minimum, within and outside the National Capital Region, researchers from the Delhi Pollution Control Committee (DPCC), IIT Delhi, IIT Kanpur and other private organisations, have started gathering data to determine Delhi's baseline pollution levels, or the lowest pollution level Delhi can ever hope to achieve./""Even though baseline data is important to fight air pollution, it is hard to get. There is always some form of pollution in a city that skews the data. If we can determine the lowest achievable pollution levels, it would help us to prepare a road map and strategy to cut down on sources,"" said D Saha, former head of the CPCB's air quality lab./Prime Minister Narendra Modi announced the lockdown on March 25 to contain the spread of the coronavirus disease (Covid-19). Since then, factories, construction sites, and some other local sources that pollute Delhi have been totally shut, while vehicles on the roads have been at a bare minimum./""The city's air quality is at its best at the moment, and is unlikely to get better than this. All man-made pollution has come down to near-zero levels. Nothing is operating within a range of 300km, barring a few essential vehicles, and service providers such as power plants and oil refineries. This is a never-before opportunity to collect the city's baseline pollution data,"" said MP George, a scientist with DPCC./The 24-hour average Air Quality Index (AQI) of the last seven days has not crossed 100 on a single day. It dropped to 45 (good) on March 28, and has been hovering in the 50-100 (satisfactory) range for the rest of the past week. During the corresponding period in previous years, it remained much higher - often in the 200-250 range (poor). The AQI had crossed 300 (very poor) on March 25, 2016. In the winter, it frequently shoots up beyond 400 (severe)./""We hardly get such an opportunity when almost all major sources of pollution are stopped in one go. We plan to start work on preparing baseline pollution level for Delhi very soon with the data that is being collected during the lockdown period,"" said Mukesh Sharma, a professor of civil engineering from IIT Kanpur, whose team prepared the Capital's first source apportionment chart in 2016./A 2018 study by The Energy Resources Institute (Teri) and Automotive Research Association of India (Arai) had shown that during winters 36% pollution is generated within Delhi. Around 34% comes from areas within the NCR and 18% comes from northwest India (beyond NCR). At least 13% of Delhi's pollution was coming from outside India. Real-time source apportionment of air pollution has been a problem in Delhi, and the state government is working on a project with Washington University to fill the gap./""The shutdown is not limited to a particular sector like industry or vehicles. Neither is it a city-level shutdown. It is a pan-India shutdown, so chances of pollution coming from outside has also been minimised. We are gathering data as this an opportunity that Delhi will not get in years to come,"" said Sagnik Dey, associate professor at the Centre for Atmospheric Sciences, and coordinator of Cerca at IIT Delhi./State pollution control board officials from Haryana and Punjab confirmed that summer stubble burning (when farmers clear their fields for the next crop) is not happening at present, which also contributes heavily to the city's pollution./Now add to this good weather - strong winds, occasional sharp showers, and sunlight. The India Meteorological Department (IMD)'s Safdurjung observatory, which is taken to be a representative of Delhi, received 109.6mm rain in March 2020. This is the highest rainfall in the month of March since 1901. In 2015, Safdarjung received around 97.5mm rain. With moist soil there is hardly any dust in the air, say experts./""Delhi, along with other parts of north-west India, received good rain because of more western disturbances this month. Over the past one week, north westerly winds with a speed of 15-20km per hour are blowing,"" said Kuldeep Srivastava, the head of IMD's regional weather forecasting centre in Delhi./Though the yearly average PM2.5 level in Delhi usually remains two to three times higher than WHO permissible limits at all times, in the last one week, the levels of both PM2.5 and PM10 have remained well within the daily permissible limits of 60ug/m3 and 100ug/m3 respectively./Such levels are usually seen only after heavy showers during the monsoon. In the winter, PM2.5 and PM10 breach their respective severe+ marks of 300ug/m3 and 500ug/m3./Published by HT Digital Content Services with permission from Hindustan Times. For any query with respect to this article or any other content requirement, please contact Editor at /<a href=""mailto:contentservices@htlive.com"">contentservices@htlive.com</a>"
