headline,body
Pandemic sets back Delhi's infra projects by six months,"New Delhi, May 10 -- Major infrastructure projects in the city would be delayed by at least five to six months due to the ongoing Covid crisis, hampering government efforts to streamline traffic flow at major junctions in the city and making roads safer for pedestrians./Even though construction work has begun at some places after a long hiatus in view of the national lockdown to arrest the spread of Sars-Cov-2, funding and labour remain pertinent problems before the contractors. Last week, the government had relaxed norms but still several restrictions remain regarding social distancing and management of labour at the sites./Construction on key projects across the capital had been in limbo for the past nearly six months. In November, all construction activity in Delhi was banned in view of rising air pollution. It was completely lifted on February 14, but within almost a month, it was again halted on March 25 due to the nationwide corona lockdown./With thousands of labourers returning home and the Delhi government making it clear that it will release funds on priority only for Covid-related works, the construction work is expected to take a lot of time to pick up pace, officials associated with several projects said./S Velmurugan, senior principal scientist, traffic engineering and safety division, Central Road Research Institute (CRRI), said, ""Such long delays will not only delay freedom from crippling traffic jams but also escalate project cost. Projects such as Ashram underpass and Barapullah-3 are of utmost importance as they aim to decongest traffic bottlenecks at Ashram, Ring Road, ITO,"" he said./A look at five key infra projects that have been hit by intermittent delays./road tunnel/The PWD is constructing this Rs 777-crore project, which entails construction of a 1.2-km-long tunnel and six underpasses to ease travel to India Gate and parts of central Delhi from different corners of the city especially from east Delhi, Noida and Ghaziabad./""The June deadline is to be extended by around three months. Big exhaust fans, which are used to maintain air circulation in the tunnel by throwing smoke emanating from vehicles out of the tunnel, were to be procured from Germany but due to lockdown the process could not be started,"" a PWD official said./Some of the key projects are:/Ashram underpass/It is one of the most awaited projects of the city because the underpass can help decongest of the most busiest stretches across Delhi. The project entails construction of a 750-metre-long underpass along Mathura Road at busy Ashram crossing. The project also include extension of existing Ashram flyover on the Ring Road up to the beginning of DND Flyway. According to PWD officials, only around five percent construction work of the underpass has been completed while the construction of flyover extension is yet to start./""Preparatory works such as site marking, site survey and utility identification was completed. But we could not start construction work in full swing as the we could not get required traffic diversion due to protests at Shaheen Bagh. Because of protests, the road leading to Noida was closed so entire traffic was moving through Ashram only. Later, the construction work was stalled due to coronavirus outbreak,"" a PWD official said on the condition of anonymity./The official added that now they have asked the concessionaire to resume construction activities on the site./Barapullah Phase-3/The elevated corridor aims to provide seamless connectivity between Mayur Vihar-I and Sarai Kale Khan, where it will meet the existing Barapullah-I elevated corridor, making the nearly 9.5km journey to AIIMS signal free. In September 2019, the government had cleared the way to acquire two patches of land which had stalled the progress for four years./""However, land acquisition could not begin because of model code of conduct earlier and later due to coronavirus lockdown,"" a senior PWD official said on the condition of anonymity./Published by HT Digital Content Services with permission from Hindustan Times. For any query with respect to this article or any other content requirement, please contact Editor at /<a href=""mailto:contentservices@htlive.com"">contentservices@htlive.com</a>"
India losing almost a million under-5 children annually: Study,"New Delhi, May 12 -- Even as the under 5 mortality rate (U5MR) in India has reduced by almost 50% in the past two decades, the country is still losing at least a million children annually before they reach their fifth birthday./Of these, half a million children die within 28 days of being born (neonatal mortality) primarily due to lower respiratory tract infection, pre-term birth and diarrhoeal diseases, show recent papers published in The Lancet./""U5MR in India reduced by 49% from 83 in 2000 to 42 per 1000 live births in 2017, and neonatal mortality rate (NMR) reduced by 38% from 38 to 23 per 1000 live births during this period. There were 1.04 million under-5 deaths in India in 2017, of which 0.57 million were neonatal deaths, down from 2.24 million under-5 deaths including 1.02 million neonatal deaths in 2000,"" says the study published on Tuesday./Air pollution is also found to have killed about 9% of the under-5 children in 2017 when data for the papers was collated./The two papers on child survival are published under the India State-Level Disease Burden Initiative, and have the first comprehensive estimates of district-level trends of child mortality in India from 2000./""It is not like we have not made any gains in the past 20 years. We have. In fact, neonatal mortality rate has reduced by 38% during these years and same goes for under-5 mortality rate that has seen nearly 50% reduction. The government has been focusing a lot on maternal and child care, and we are seeing results,"" said Dr Rakhi Dandona, Public Health Foundation of India, one of the lead authors of the study./""However, what this study also shows is that India now needs to have an area-specific plan in place to reduce child deaths as no two states have the same problem and that is why the solution that worked in one state may not work in another. The study has in detail mentioned the risks and other issues that individual states face, and solutions will have to be created accordingly,"" she added./Although the child mortality and child growth failure indicators have improved substantially across India from 2000 to 2017, the inequality between districts has increased within many states, and there are wide variations between the districts of India./""There is a silver lining to finding variations within states as it assures that the government is willing to work and has found appropriate solutions to problems they face at the local level, and one district improving exceedingly well means there are workable solutions that can be implemented in other districts, and because it's the same state, could show similar results,"" she said./Uttar Pradesh and Bihar continue to lag behind. The highest number of under-5 deaths in 2017 was in Uttar Pradesh (312,800 which included 165,800 neonatal deaths) followed by Bihar (141,500 which included 75,300 neonatal deaths)./The NMR is a bigger concern for India as almost 60% districts need higher NMR reduction to individually meet the global Sustainable Development Goals (SDGs) targets. The SDGs are a collection of 17 global goals designed to be a blueprint to achieve a better and more sustainable future for all. The SDGs were set in 2015 by the United Nations General Assembly, and intended to be achieved by 2030./As per the global SDG target, NMR has to be brought down to 12 per 1000 live births universally by 2030. India's current NMR remains around 23 per 1000 live births./""Given the inequalities in the burden and reductions in neonatal mortality across Indian districts, a more granular approach at the district level to determine the strategies for improving newborn survival is needed. Without doubt, continuum of care has to be the pivot around which newborn and child survival strategies must revolve but to homogenize all continuum of care strategies and move them all in tandem is a challenge given the varied implementation capacities of states and districts. We must continue to strive to saturate the continuum of care strategies not only in quantity but also in quality. But in regions with high mortality burden, prioritised interventions should be the focus in the short term along with the holistic continuum of care interventions,"" said Dr Siddartha Ramji, professor of pediatrics and neonatology, Maulana Azad Medical College, New Delhi./The top three causes of neonatal mortality continue to remain preterm birth, birth asphyxia (suffocation) and trauma, and lower respiratory infections, followed by congenital birth defects./The top three causes of under-5 mortality have been lower respiratory infections, preterm birth, and diarrhoeal diseases, followed by birth asphyxia and trauma./Experts said nutrition for prospective mothers is crucial. ""The nutritional status of young girls is very important as they are going to be future mothers and they need adequate nourishment to avoid complications later on during pregnancy. If not during adolescence, they should at least start taking balanced meals once they get married. It helps to have a well-nourished body before one conceives. As we have seen, by the time women know they are pregnant, and access medical care, it is already about 10 weeks, and by then the cells of the baby have formed. Chances of complications are high in malnourished pregnant woman and the newborn is likely to be malnourished too,"" said Dr Hemalatha R, director, National Institute of Nutrition./Published by HT Digital Content Services with permission from Hindustan Times. For any query with respect to this article or any other content requirement, please contact Editor at /<a href=""mailto:contentservices@htlive.com"">contentservices@htlive.com</a>"
Lockdown spells cleaner air with stubble burning at lowest in 5 yrs,"India, May 16 -- The heavily polluted Indo-Gangetic plains have recorded the lowest agriculture residue burning this year since 2016, satellite images from US space agency NASA have shown./Researchers and government officials said of the several reasons behind the decline in the springtime farm fire count could be the nationwide lockdown after the outbreak of Covid-19./""Springtime fire activities (mostly agricultural) over the Indo-Gangetic Plain have been the lowest this year in comparison to the last five years during the Covid-19-led lockdown period,"" Hiren Jethva, a researcher from Universities Space Research Association at the NASA Goddard Space Flight Center, tweeted on Saturday./Although the National Capital Region gets engulfed in smoke from stubble burning during the winter season, particularly in the villages of Haryana and Punjab, rabi crop residues are also burnt during this time of the year across north India. Air pollution is, however, much lower during summer because of favourable meteorological conditions such as strong winds./Graphs and data tweeted by Jethva showed that while in 2016 the cumulative fire count between April 15 and May 15 was around 70,000, in 2020 the figure has come down to around 10,000 during the same period across various north and central Indian states located in the plains. In 2019, the fire count registered a rise, the data shows./Top officials from the state pollution control boards of Punjab and Haryana confirmed that there has been a sharp drop in stubble burning incidents this year till date./""In 2019 there were around 5,768 such incidents in Haryana till May 15. In 2020 we have recorded around 2,430 incidents. The lockdown effect could be one reason. A clearer picture will emerge when the harvest is completed by the end of May and we take the final survey,"" said S Narayanan, member secretary of the Haryana Pollution Control Board./""We have seen the NASA maps and analysed fire counts in the National Capital Region. There is definitely a decline in such incidents. The restrictions during the all-India lockdown and the shortage of labour could be the reasons,"" said Anumita Roy Chowdhury executive director (research and advocacy) at the Centre for Science and Environment in New Delhi./Though Jethva suggested lower crop volumes could be an additional factor for the decline in stubble burning, government officials said the harvest has been good this year./The reasons notwithstanding, the fall in air pollution levels should come as welcome news. As HT has reported earlier, SARS-CoV-2, the virus that causes Covid-19, can cling to air pollutants. Tests conducted in Italy have found the same. Also, air pollution is likely to be a major risk factor for coronavirus disease mortality, scientists have concluded./""There has been a definite decline in the number of fire incidents. The reasons behind this need to be verified -- whether it is because of the shortage of labour, whether crop yield is low this time or some other reason. This could provide some vital inputs for future planning,"" said Sagnik Dey, coordinator of the Center of Excellence for Research on Clean Air (CERCA) and associate professor at the Centre for Atmospheric Sciences (CAS) at the Indian Institute of Technology in Delhi./Published by HT Digital Content Services with permission from Hindustan Times. For any query with respect to this article or any other content requirement, please contact Editor at /<a href=""mailto:contentservices@htlive.com"">contentservices@htlive.com</a>"
"Lockdown made Delhi's poor poorer, but led to behavioural change, say researchers","India, May 16 -- Mask usage in Delhi's slum clusters quadrupled, frequent hand-washing became nearly universal and time spent indoors doubled compared to the pre-Covid-19 period, according to a working paper on behavioural change and job loss during the lockdown./Nine out of 10 respondents reported they weren't smoking but it hasn't been assessed whether most of them are non-smokers or quit smoking because of the Covid-19 crisis./The findings of the working paper, by researchers at the Energy Policy Institute of the University of Chicago and the University of British Columbia, are based on a survey of 1,392 respondents in Delhi's slum clusters engaged in different professions, including construction workers, drivers, salaried workers, skilled labourers, domestic workers, and street vendors./The impact of the lockdown on their income and employment has been unprecedented, the researchers found./Their weekly income dropped by 57% on an average, as working days were reduced by 73%. By early May, weekly income had fallen to zero for nine out of 10 of the respondents. Around 35% of the sample reported accessing Delhi government's food assistance programme./The Delhi government set up more than 500 assistance centres across the city to provide food (rice and dal) to those who needed it. These centres appear to have been well placed, as the average distance between individuals in the sample and the nearest government assistance centre is only 640 metres, researchers found./The same team of researchers were studying the impact of air pollution on residents in slum clusters for the past 1.5 years, which is why they had pre-Covid-19 data for preventive measures such as wearing masks./During the first week of November last year, the Delhi government distributed five million masks to help people defend themselves against PM 2.5 (fine, respirable pollution particles), concentrations of which often surpassed 300 micrograms per cubic metres, which is 30 times higher than the WHO standard./Researchers found mask usage had increased in the weeks following the government's distribution of masks but it did not reach 35% of the sample. In contrast, it has become nearly universal during the Covid-19./""If we want to understand what came out of the lockdown, one potential benefit is behaviour change. But we have to see if people can continue this for at least a couple of years till a vaccine or treatment is available,"" said Ken Lee, executive director of the Energy Policy Institute at the University of Chicago in India (EPIC India) and the lead author of the study../""The impact of the lockdown on people's incomes has been massive. About 35% of the sample reported accessing food assistance, which is quite high because you would assume that many will not need food assistance. Our sample mainly consisted of people who earned on average Rs 3,000 a week. But this highlights that food assistance mitigated a crisis. The Delhi government should scale up this scheme.""/The paper found these behavioural changes were mainly driven by extreme fear and widespread media coverage of the Covid-19 pandemic./Researchers used Facebook mobility data to find that intra-city movement dropped by 80%, immediately following the Janata curfew till May./Compliance with public health directives will decide how cities can gradually emerge out of lockdowns./""Future decisions to implement extreme social distancing mandates will involve complex trade-offs between the costs of higher infection rates in a world that remains open, and the economic and non-economic costs in one that is periodically closed. A key factor influencing this trade-off is the extent to which people follow the public health directives,"" the paper concluded./Dileep Mavlankar, director of the Indian Institute of Public Health in Gandhi Nagar, said: ""Behaviour change cannot be sustained with hunger, so that needs to be addressed. Also, most workplaces like shops and restaurants do not provide toilet or other facilities to staff./""Work places have to provide masks, water and soap for hand-washing. Alcohol is very expensive. Also, in behavioural science, there is the ABC theory which stand for antecedents, belief and consequences. So the behaviour change needs to be reinforced through consequences like congratulating the person for wearing a mask and hand-washing or negative feedback for not doing so.""/Banita Paik, a domestic worker who lives in Tughlakabad village, which is a containment zone, said, ""All of us (family of four) bought masks from a medical store immediately after the lockdown began. We are washing hands regularly and not interacting as much with neighbours, but loss of income is a huge concern, even more than Covid-19 right now.""/Published by HT Digital Content Services with permission from Hindustan Times. For any query with respect to this article or any other content requirement, please contact Editor at /<a href=""mailto:contentservices@htlive.com"">contentservices@htlive.com</a>"
Covid has left Delhi dwellers poorer: Report,"New Delhi, May 17 -- A new working paper on behavioural change and job loss during the lockdown necessitated by the coronavirus disease (Covid-19) in Delhi has shown that mask usage quadrupled, frequent hand-washing became nearly universal and time spent indoors doubled compared to pre-Covid-19 days in Delhi's slum clusters./The working paper, by researchers at the Energy Policy Institute at the University of Chicago and the University of British Columbia, surveyed 1,392 respondents including construction workers, drivers, salaried workers, skilled labourers, domestic workers and street vendors. The impact of the lockdown on their income and employment was unprecedented in the slum clusters of the Capital, the researchers found./The respondents' weekly incomes dropped by 57% on average, as the working days reduced by 73%, the research showed. By early-May, the weekly income fell to zero for every nine out of 10 surveyed people. Around 35% of them reported accessing the Delhi government's food assistance programme./The Delhi government has set up at least 500 assistance centres across the city to provide access to food. These centres appear to have been well-placed, as the average distance between the individuals in the sample and the nearest government assistance centre was about 640 metres, researchers found./The same team of researchers was carrying out a study on the impact of air pollution on residents in the slum clusters for the past one and a half years, which is why they had pre-Covid 19 data available for preventive measures such as the use of masks./Banita Paik, a domestic help who lives in Tughlakabad village, a Covid-19 containment zone, said: ""All of us (family of four) bought masks immediately after lockdown from a medical store. We are washing hands regularly and not interacting as much with neighbours but loss of income is a huge concern, even more than Covid-19 right now.""/During the first week of November last year, the Delhi government distributed five million masks to its residents to help people defend themselves against PM2.5 (fine pollution particles) concentrations, which often surpassed 300 micrograms per cubic metres, 30 times higher than the standard limit prescribed by the World Health Organization. The researchers found that the mask usage increased in the weeks following the government distribution of masks but it did not reach 35% of the sample. In contrast, it has become nearly universal during the pandemic./""If we want to understand what came out of the lockdown, one potential benefit is behaviour change. But we have to see if people can continue this for at least a couple of years till a vaccine or treatment is available. The impact of the lockdown on people's incomes has been massive. About 35% of the sample reported accessing food assistance which is quite large because you would assume that many will not need food assistance. Our sample mainly consisted of people who earned on average Rs 3,000 a week. But this highlights that food assistance mitigated a crisis. The Delhi government should scale up this scheme,"" said Dr Ken Lee, executive director of the Energy Policy Institute at the University of Chicago in India (EPIC India) and the lead author of the study./Published by HT Digital Content Services with permission from Hindustan Times. For any query with respect to this article or any other content requirement, please contact Editor at /<a href=""mailto:contentservices@htlive.com"">contentservices@htlive.com</a>"
Lockdown helps city breathe easy,"Mumbai, May 23 -- Researchers have found that the average concentration of most pollutants in the city's air fell during the first three phases of the lockdown (from March 25 to May 18). An analysis of pollutant data available from the monitoring stations of the Central Pollution Control Board (CPCB), done by Urbanemissions.info, found that the levels of five out of six pollutants were lower in the last two months, as compared to pre-lockdown levels./Urbanemissions.info, an air pollution research group, studied the concentration of particulate matter (PM2.5, PM10), nitrogen dioxide (NO2), sulphur dioxide (SO2), ozone (O3), and carbon monoxide (CO) over the 54 days of lockdown, divided into three phases. The first phase of the lockdown was from March 25 to April 14; the second, from April 15 to May 3; and the third, from May 4 to May 17. Levels were compared with a 30-day average (February 20 to March 22) during the pre-lockdown period. While levels for most pollutants dipped, SO2 saw a spike during lockdown./Average levels of PM2.5 - breathable particulate matter of 2.5 micron size or smaller - fell from 45 microgrammes per cubic metre (ug/m3) during pre-lockdown to 27.8 ug/m3 during the first phase and then to 23.3 ug/m3 and 22.6 ug/m3 in second and third phases respectively. A similar trend was observed for CO and O3. The most substantial decline was witnessed for NO2 - produced by burning of coal, oil, and emissions from vehicle - which fell from pre-lockdown levels of 37.5 ug/m3 to 9.8 ug/m3 during the first phase; 7.3 ug/m3 in the second; and rose to 9.8 ug/m3 in the third./Sarath Guttikunda, founder and director, Urbanemissions.info, said, ""In Mumbai, most of the traffic was down, which followed up with reduction in dust resuspension. Emissions from the construction sector were not there while residential open waste burning was limited. Light industry operations too were not there while migration of most low-income groups resulted in reduced biofuel emissions from cooking.""/However, the levels of SO2 - a colourless gas with pungent odour and taste that causes respiratory diseases such as asthma, bronchitis and emphysema - spiked during the lockdown. While it fell from 15.4 ug/m3 pre-lockdown to 12.5 ug/m3 during the first phase, a surge was seen during the second (24.6 ug/m3) and third phases (36.2 ug/m3). A marginal spike in PM10 (larger, coarser particles) was also witnessed during the third phase of the lockdown./Published by HT Digital Content Services with permission from Hindustan Times. For any query with respect to this article or any other content requirement, please contact Editor at /<a href=""mailto:contentservices@htlive.com"">contentservices@htlive.com</a>"
