headline,body
96% Indians breathe hazardous air: Study,"Mumbai/New Delhi, May 24 -- At least 200 million in India live in extreme poverty and are exposed to dangerous levels of air pollution, a recent study by World Bank experts estimates, also projecting the country to account for close to 47% of the 2.8 billion people exposed to hazardous quality air./The report offers the first estimates of how many people are exposed to bad air based on the World Health Organization's new thresholds released last year. The thresholds identify concentration of ultra-fine PM2.5 particles above 5microgram per cubic metre of air (ug/m3) as unsafe and 35ug/m3 as hazardous - exposure to hazardous air is linked with an over 24% increase in mortality rate./In absolute terms, 1.33 billion (96%) of India's estimated 1.39 billion people breathe hazardous air, the report said. Of these, ""over 202 million"" people were those that lived on a daily wage of less than $1.9 ( Rs.145) -- or in extreme poverty./Most of the world does not meet the 'safe' standard of the WHO, with 96.4% of the global population exposed to air with a PM2.5 concentration above 5ug/m3./But it is the hazardous level exposure, most of which is in people in middle income countries like India and China, that is more dangerous. And among these, the extreme poor are most at risk./""For them, the same air pollution level is likely to imply more severe health risks than for higher income households. Among low-income population groups, high proportions of physical and outdoor labour mean that they are faced with heightened exposure and intake of pollutants. Constraints in terms of the accessibility, availability and quality of health care provision further increase air pollution-related mortality among poor people,"" said the report, a policy research working paper -- separate from official reports of the World Bank./Experts in India concurred. ""This is the double burden for public health. The poorer population is more vulnerable due to lower level of nutrition and health. They have a range of underlying diseases that enhances their risk. They also have a higher exposure to toxic air pollution because they reside in areas where air pollution control is very weak. So, a combination of factors increases their exposure and makes them more vulnerable to health impacts,"" said Anumita Roy Chowdhury, executive director, Centre for Science and Environment./Therefore, Roy Chowdhury added, ""an environmental justice framework is being discussed for air pollution control to reduce the disproportionately high risk for the poor""./While the report did not go into indoor air pollution, a second expert flagged it as another significant risk. ""Not having access to cleaner fuels increases the exposure of poor people to hazardous air pollution. The Ujjwala scheme is there but we know that a majority of rural families are not able to afford refuelling cost and are continuing to depend on freely available solid biomass fuels,"" said Sunil Dahiya, an analyst with the Centre for Research on Energy and Clean Air./Published by HT Digital Content Services with permission from Hindustan Times. For any query with respect to this article or any other content requirement, please contact Editor at /<a href=""mailto:contentservices@htlive.com"">contentservices@htlive.com</a>"
Planet politics in the era of climate crisis,"India, May 24 -- Ever since recorded history, human beings have taken the planet for granted. While droughts and fires might affect one region, it was assumed that life on earth was much the same year after year. That's no longer true in multiple ways, as the pandemic is showing us today and the climate crisis will show us again and again at much more regular intervals, in an irreversible way./March 2022 was the hottest March on record in India. Many parts of India will become uninhabitable if average global temperatures increase by 2 degrees Celsius, which is very likely if business continues as usual. The climate crisis is an existential threat of a kind we have never experienced as a species. We have had an extractive relationship with the earth and have not given back at all. We need to create a system which leaves space for the earth to regenerate on its own so that it can continue to nurture future generations. Inter-generational equity can only be ensured if nature is looked after in every aspect of natural resources--land, water, forests and the communities' relationship towards all of these./To take the example of water, the United Nations has estimated that more than five billion people will be affected by water scarcity by 2050. This is already evident in India which is heavily dependent on agriculture. According to the World Meteorological Organization (WMO) in 2021, India is at the topmost hotspot of terrestrial water storage loss (TWS), having lost TWS at a rate of three to four cm each year, the highest loss recorded after Antarctica and Greenland. If this situation prevails, India will continue to face extreme water stress./To address these concerns, we need a new politics, a planetary politics that takes the flows of carbon into account in the formulation of policy at every level: District, state and country. The second thing is to make use of new technologies, both of the usual energy saving devices kind but also local innovations such as grassroot practices drawn from our own traditions which can meet the need for growth without affecting the environment and the resource base of communities./All of these interventions, however, need a baseline of measurement for whatever can't be measured or evaluated for efficiency and performance. Consider the issue of air pollution. While it's true that air pollution causes ill health and death, the causal relation is poorly established and even more poorly communicated. Our goal should be to make the dangers of air pollution clear to people in local languages; that it can kill them or increase their vulnerability to other health issues. Once that message is sent out, the people themselves will act on the issue. We saw that communication in the case of the pandemic. As a result, everyone, including people in the remotest villages were stringent in applying regulations because they believed that the disease was going to kill them otherwise. In the absence of that communication, causal relationships are hard to establish and communicate when we discuss environmental issues and the harmful effects are likely to manifest themselves after a few years by which time it's will be too late to rectify them. The absence of data platforms that help establish causation is hurting our capacity to be sustainable and to make visible progress on our climate commitments./Therefore, we need an accounting system of capturing and measuring carbon data for all human activities. We are all familiar with financial balance sheets with their sources and their applications. What if the same thing is done for carbon? Once we are able to do that, every company should be able to produce along with their financial balance sheet their carbon balance sheet also. When we file income tax returns, we should file carbon tax returns. Once we have such an accounting system, we can set targets, make predictions about future emissions reductions and track our progress against those goals. Once such a platform comes into play, we will have the opportunity to reimagine the entire economy, including new technologies and new forms of collective action./Carbon politics will not only help us meet our commitment to becoming net-zero by 2070, it will also help us create new livelihoods and new forms of organising our economy and society. Everyone understands Gross Domestic Product growth and more recently, alternative measures such as Gross National Happiness are also becoming popular. By making transparent the carbon footprint of human activities, we open up the possibilities of new forms of public discourse and an alignment between development and ecological sustainability./India's future tied to the planet's future and we have the opportunity to enact policies and create infrastructure that will make us a world leader in climate management. If we manage to do so while also fulfilling the aspirations of our young population we will have achieved an enviable outcome. We are at the threshold of a profoundly transformed society, in which the earth is no longer the passive background against which human dramas are played but an active agent in influencing the future of human civilisation./Can India take the lead in this transformation?/(The article has been authored by Amar Patnaik is a Member of Parliament, Rajya Sabha, from Odisha)/Published by HT Digital Content Services with permission from Hindustan Times. For any query with respect to this article or any other content requirement, please contact Editor at /<a href=""mailto:contentservices@htlive.com"">contentservices@htlive.com</a>"
Asthma in kids: Know the symptoms and how the lung disease affects children,"India, May 29 -- Asthma can impact people of all age groups including children. If you child is coughing, wheezing, finding it difficult to breath, play outdoors, or sleep at night, you must immediately take your little one to their pediatrician. The recent Global Burden of Disease (GBD, 1990-2019) estimated the total burden of disease in India as 34.3 million, accounting for 13.09% of the global burden. It also attributed those 13.2 thousand deaths were due to asthma, three times higher compared to the global proportion of burden. (Also read: Asthma Awareness Month: What to do in case of an asthma attack; steps to follow)/Though asthma is the most common chronic disease among children, doctors usually can't make a diagnosis until children are older, by about age 4 or 5./""Young kids are more at risk for wheezing as their airways are very small. When they get a cold or other respiratory tract infection, these already small passages swell and fill with mucus much more easily than an older child's or an adult's. This can cause wheezing, coughing, and other symptoms that people with asthma do,"" says Dr Ankur Rajvanshi Consultant Neonatologist & Pediatrician, Cloudnine Group of Hospitals, Whitefield, Bengaluru./What is asthma and what are its symptoms/Asthma is a common chronic (long-term) lung disease in which the lungs' bronchial tubes, or airways, become inflamed. When the air passages in the lungs become narrow due to inflammation and tightening of the muscles around the small airways, it causes asthma symptoms: cough, wheeze, shortness of breath and chest tightness./Causes and triggers of asthma/The exact cause is unknown, although it tends to run in families, suggesting a genetic component. Exposure to allergens also triggers symptoms. The main triggers include pollen, air pollutants, smoke, foods, respiratory infections, and medications./How to manage asthma in kids/Monitoring and Assessment: Asthma symptoms frequently change over time. So regular visits with the healthcare provider who manages your child's asthma are necessary. It is important to schedule visits at least every three months, more often if things are not going well./Education: It is crucial for parents of children with asthma to understand the disease and how it is treated. This education may be provided by the pediatrician, a respiratory therapist or an asthma educator, but it is crucial that someone does it. Parents need to know and understand how to administer medications, which inhalers to use and when to use them and how to recognize worsening symptoms and visit ER as required./Controlling environmental and comorbid conditions: Properly addressing any comorbid conditions as well as removing potential triggers from the child's environment play a huge role in improving asthma. Worldwide, India has one of the highest concentrations of air pollution caused by biomass, fossil fuels, and vehicular exhausts and the use of mosquito coils, incense and dhoop sticks is an important cause of indoor pollution. By making a few changes sometimes a child can go from needing one or more medications to being medication-free./Medication: Most kids with asthma need to take medicines. Some are daily medicines (called long-term control medicines) to help keep airways from getting irritated. Others are used only during a flare-up to help open the airways (quick-relief medicines)./Most medicines call for the use of a nebulizer or inhaler to help get medicine into the lungs. The doctor will tell you which medicines your child needs and how to take them. Inhalers and orally administered medications aren't addictive. Make sure your child gets a yearly flu vaccine. If kids with asthma contact flu they're at risk for flare-ups and developing a more serious illness./""It's important to tell the doctor about any family history of allergies, asthma, eczema, and sinus problems. This information and careful monitoring of your child over time will help the doctor decide if the symptoms are due to asthma or another problem. The primary goal for children with asthma it to allow kids to be just like the other kids. Allow them to play soccer and keep up with their peers. They should be able to sleep at night without waking up coughing. And a simple cold should not land them in the hospital,"" says Dr Ankur Rajvanshi./Does asthma last forever?/""One of the most common questions parents have when a child is diagnosed with asthma is whether asthma medication will be a lifelong necessity. The simple answer is that we do not know. There is no way to know if your child will outgrow his symptoms. Do children that outgrow asthma still have the disease? No one is sure. They certainly are at risk to develop symptoms again in the future, but until then enjoy living asthma-free,"" concludes Dr Rajvanshi/Published by HT Digital Content Services with permission from Hindustan Times. For any query with respect to this article or any other content requirement, please contact Editor at /<a href=""mailto:contentservices@htlive.com"">contentservices@htlive.com</a>"
Recovering from the effects of air pollution: Expert shares insights,"Delhi, June 1 -- The air quality of the country keeps dropping by the day. The industrialisation and the change in people's lifestyle have created more booming pollution. Around 100 percent of the country, in the present era, breathes in air that falls short of the quality standards. Speaking to HT Lifestyle, Gagan Dhawan, Founder and CEO, The New Me - a series of books and kits that urges people to shift to a healthy lifestyle, said, ""Out of the world's 10 most polluted cities, 3 are from India. Air quality directly impacts our eyes, nose, throat, and lungs. In such a scenario, it is pivotal to take enough preventive measures to reverse the harm.""/Gagan Dhawan further noted down the prevention measures that can be taken in order to recover from the effects of the pollution. Take a look:/Air quality index: It is important to check the air quality index before stepping out of the house. In cities, the air quality index usual peaks during early morning and afternoon. For exercise, Gagan Dhawan recommended that we should choose lush green areas with more trees than main roads. In case of not being able to avoid polluted areas, a N95 respirator should be used at all times./Indoor pollution: We always think that pollution is outside and our homes are safe haven free from pollution. But sometimes, indoor pollution can be a health hazard. Purifiers and humidifiers can be installed at homes in order to keep it free from pollution. Active and passive smoking inside the home should be discouraged and avoided as much as possible./Diet shifts: Watching what we eat can help us in combating the effects of pollution. ""Detoxifying foods like ginger, citrus fruits and Tulsi can act as protective agents. Jaggery helps the body flush out toxins from the respiratory tract. A diet rich in vitamin D is anti-inflammatory that can help boost immunity levels and support the body's natural healing processes. In addition, vitamin D has protective properties against respiratory tract infections. Also, taking steam regularly can cleanse the entire respiratory path,"" said Gagan Dhawan./Exercise: Exercising regularly helps the body to fight chronic illnesses. Aerobic exercises helps the body to enhance the oxygen levels in the bloodstream, rejuvenate the organs and reverse the effects of pollution. Exercises such as running, swimming, stretching, cycling and jogging also helps in boosting the overall immunity of the body./Published by HT Digital Content Services with permission from Hindustan Times. For any query with respect to this article or any other content requirement, please contact Editor at /<a href=""mailto:contentservices@htlive.com"">contentservices@htlive.com</a>"
World Environment Day: 5 ways climate change is affecting your health,"Delhi, June 3 -- Climate change is real. And it is not just affecting our planet in unimaginable ways. At present, it is one of the single biggest threats facing humanity. Apart from soaring temperatures, rising sea levels and an increase in the number and intensity of extreme weather events, it also negatively impacts social and environmental determinants of health, including clean air, safe drinking water, sufficient food, health facilities and secure shelter./While climate change has a different impact on people's health depending on their age, gender, geography, and socioeconomic status, that doesn't mean it isn't severe. Moreover, vulnerable and disadvantaged sections in this group are women, children, ethnic minorities, poor communities, migrants or displaced people, the older population, and those with underlying health conditions. According to a report by World Health Organisation, between 2030 and 2050, climate change is expected to cause approximately 2,50,000 additional deaths per year from malnutrition, malaria, diarrhoea and heat stress. (Also Read: World Environment Day 2022: Lifestyle tips to contribute to sustainability in small swaps)/So, on this World Environment Day, we decided to list down a few ways climate change has an effect on your health. Scroll ahead to know more./Heat-Related Illness: Our bodies can efficiently adapt to the local climates. However, when the temperature shifts above or below those norms rapidly, it has a negative impact on our health. Studies show that extreme temperatures can lead to an increase in deaths and mild to severe illnesses. These include heat cramps, heat exhaustion, heatstroke, hyperthermia from extreme heat, cardiovascular disease, respiratory disease, and diabetes-related conditions./Respiratory Illness: Increasing air pollution levels have become the cause and aggravating factor of many respiratory diseases, some of them being chronic. The main diseases of concern are asthma, rhinosinusitis, chronic obstructive pulmonary disease (COPD) and respiratory tract infections./Water-borne Diseases: Water scarcity or flooding because of harsh weather conditions is already a concerning issue in many parts of the world. Additionally, diseases caused by pathogen transmitted through water also creates a fundamental threat to human health and well-being. Some of these diseases include diarrhoea, neurological disorders, liver damage, fever and other flu-like symptoms./Mental And Psychological Health: Trauma from surviving extreme weather events, like floods, droughts, cyclones, heat waves and more, could lead to mental health issues like anxiety and depression. Many people who survive or lose loved ones in such extreme conditions can have lifelong Post-traumatic stress disorder (PTSD)./Malnutrition: Severe weather conditions, like floods or heat waves, have a direct impact on crop production. Crop declines could lead to undernutrition, hunger, and higher food prices. Additionally, a World Food Programme report says that by 2050 climate change could increase the risk of hunger and malnutrition by 20 per cent./Published by HT Digital Content Services with permission from Hindustan Times. For any query with respect to this article or any other content requirement, please contact Editor at /<a href=""mailto:contentservices@htlive.com"">contentservices@htlive.com</a>"
