headline,body
Civic Sanskriti: Historical core city of Pune needs an election push for devp,"India, July 20 -- PUNE Pune's core city, like many historical cities built before motorcycles and cars were invented, has many people- and environment-friendly features. The street network with small block sizes makes it easy to walk around./Despite the density, you find sitting platforms, locally known as paars, around peepal and banyan trees that provide quiet spaces to relax. You can enjoy a chai and misal and watch the bustle of commercial activity and modernity amid heritage./The core city also has heritage temples and ghats, traditional occupations of Kumbhars (potters), Tambats (brass and copper workers) at Tambat Ali, bamboo artisans at Burud Ali. Tulshi Baug is still a popular shopping street selling specialised household products. Such precincts have a character that no other place in Pune has./Unfortunately, new developments in the last few decades are erasing the core city's unique fabric. The hustle-bustle has turned into congestion. People avoid visiting the core city for shopping for traditional items like saris and jewellery./According to Sujit Patwardhan, founder Trustee of Parisar, ""There are broadly two visions for the core area's future. One that sees it as no different from the rest of the city, and the other, that values the historic and cultural qualities that need to be preserved.""/There is an even more serious consequence. The Indian Institute of Tropical Meteorology has recently published its study of air pollutants in Pune. Dr Gufran Beig, Principal Lead Author of the report cautions, ""The Emissions Inventory study shows a very high level of emission in Pune's core city. Pune's high-altitude location helps in slower conversion of emissions to pollutants as compared to plain areas. However, looking at the high emission level and rate of increase, the time is not far when the advantage of being high altitude would be lost after emissions cross a tipping point and Pune will also witness high air pollution. Transport is the source of over 45% of emissions of most toxic PM2.5. Better to act now to reduce emissions./Tiny pollutant particles enter the lungs, causing respiratory illnesses. Some particles are small enough to pass through the lungs into the bloodstream affecting the brain, heart and kidneys. Children, pregnant women, older people, those with cardiovascular ailments are at greater risk. Air pollution is also known to increase the severity of the Covid-19 disease./Pune Municipal Corporation and Traffic Police must take note of the IITM Emissions Inventory and take urgent steps to reduce air pollution in the core city./Fortunately, the PMC, with great foresight, has already got a few different plans - the Comprehensive Mobility Plan, Bicycle Plan, Parking Policy, Pune Streets Programme, and Urban Street Design Guidelines. Initiatives introducing minibuses and electric vehicles have been in the news recently./Imagine the attractive, calmer, and healthier environment the core city could have with these provisions implemented in true letter and spirit:/Attractive street design/Beautiful designs for about 25 km of core city streets were prepared under the Pune Streets Programme with footpaths, vending zones, rickshaw stands, and easy bus movement. In addition, a walking plaza, greenery and neatly arranged street vending zones were designed reflecting the unique character of Laxmi Road./Architect Prasanna Desai and PVP College Architecture students had conceptualized an ""open-air mall"" design for Laxmi Road. If traffic-clogged roads can be freed up, people can enjoy the core city ambience, its cultural activities, restaurants, and of course, shopping!/We can learn from similar projects at Chandni Chowk and Karol Bagh in Delhi, which are more crowded than Pune's core city. Amsterdam, London, Paris, Stockholm and many others have decongested inner-city areas to improve liveability and economy./Shuttles/Shuttle services with CNG or electric minibuses or share-rickshaws would help cut the noise and air pollution. Shuttles would ease mobility within the core city and connect to the metro, major bus stops, and parking lots./Traffic re-routing/The Comprehensive Mobility Plan recommended an inner ring road of sorts by streamlining traffic movement along JM Road, Shastri Road, Shankar Sheth Road, Nehru Road. As a result, traffic that is not destined for the core city need not enter it but can go around. Traffic re-routing and restricted timings for vehicle movement would be a boon for residents in the Peth areas to reduce vehicular pollution./Parking management/Vehicles parked on the road eat up one or two lanes of precious road space, making bus movement, cycling and even walking difficult./Studies show that most of the parked vehicles are of shop employees, leaving very little for customers. Pay-n-park can ensure that long-term parking is shifted to parking lots and on-street parking is utilized efficiently./Paid parking facilities exist in and near the core city. With free parking available on the road, they are not much used. In some parking lots, other businesses have come up! This situation should be corrected as recommended in the CMP./With good bus connectivity, shuttles and cycle-safe roads in place, people coming to the core area every day for work could leave their bike or car behind. It is an adjustment people will have to make not to increase pollution and cause health problems for themselves and others./All we need is for PMC to implement these projects already envisaged in city plans. Public deliberations among residents, businesses, institutions, the wider public and PMC are needed so that proposals are well-understood, tried out and fine-tuned for the public's needs./Lockdown losses, urgent health concerns, and the longer-term need for heritage-sensitive modernization call for authentic leadership from elected officials and the administration. Such a project to heal, nurture and celebrate Pune's historical core city must find a place in election manifestos./Published by HT Digital Content Services with permission from Hindustan Times. For any query with respect to this article or any other content requirement, please contact Editor at /<a href=""mailto:contentservices@htlive.com"">contentservices@htlive.com</a>"
HC issues notice to Chandigarh MC over hazards of Dadumajra dump,"Chandigarh, July 21 -- The Punjab and Haryana high court on Tuesday issued a notice to the municipal corporation, acting on a public interest litigation (PIL) filed by a Sector-27 resident seeking an end to the air pollution suffered by the people of Dadumajra and surrounding areas./The notice has been issued to the Chandigarh MC for November 26./The PIL filed by Amit Sharma seeks directions to the MC and other state authorities to ensure an end to the air pollution, unbearable stench, and the frequent fires that release toxins in the air, and to address the various health issues being faced by over 50,000 people in Dadumajra and around./Through the petition, Sharma has also sought directions to the MC to follow the Solid Waste Management Rules, 2016, to reduce the quantum of garbage dumped at Dadumajra./The petitioner has also urged the high court to order an inquiry/probe into the MC's failure to follow the directions of the National Green Tribunal on waste management and processing. ""Why were environmental laws flouted, and what is the outcome of the crores of taxpayers' money spent on study tours for waste management?"" the petition has asked./107% more cases of pneumonia in Dadumajra/The petitioner stated that Dadumajra/Dhanas had 107% more cases of pneumonia in 2020 as compared to all the other colonies in Chandigarh./The petitioner pointed out that the ""wretched quality of air and life in the area is further aggravated by the frequent toxic fires in the mountain of garbage that is only getting higher by the day. With the MC able to process a mere 13.36% of the waste dumped here last year, and only 16.09% from January to May in 2021, the problem of unprocessed garbage is threatening to swamp the Dadumajra area""./""It is also leading to increased incidents of fire in the dump that the office of the medical officer of health (MOH) is neither able to prevent nor explain. The fire in March this year lasted a week and covered the entire city in a haze, hindering visibility and causing respiratory issues among people in the vicinity,"" said the petition./The petitioner accused the MOH of ""willfully failing"" to manage the waste, the fires, and the health of the people in the area./Published by HT Digital Content Services with permission from Hindustan Times. For any query with respect to this article or any other content requirement, please contact Editor at /<a href=""mailto:contentservices@htlive.com"">contentservices@htlive.com</a>"
"'India, China most vulnerable to joint risks of climate change, air pollution'","India, July 22 -- India and China are among the world's top five countries that are most vulnerable to climate change and air pollution with the capacity to deal with the risks, a first of its kind research assessing the combined risks of air pollution and climate change, said on Thursday./The world's two fastest developing economies with 2.5 billion plus people have witnessed a spurt in particulate matter induced air pollution levels in the past two decades and have seen high risks due to climate change induced extreme rainfall, frequent cyclones and heat waves in recent past, the study says./""Deaths resulting from toxic pollution are highest where the distribution of toxic pollution is greatest and, critically, also where the impacts of climate change pose the greatest risk,"" the study, Global distribution and coincidence of pollution, climate impacts, and health risk in the Anthropocene, said, in a specific reference to India and China./For more than 30 years, the scientists on the UN's Intergovernmental Panel on Climate Change (IPCC) have assessed impacts of human induced climate change whereas bodies such as World Health Organisation have focused on health impacts of rising air pollution globally./Scientists at the University of Notre Dame found a ""strong and statistically significant"" link between the two environmental hazards and said the countries which are at most risk of climate change are also the countries with highest risks of toxic pollution./A vital difference between climate change and air pollution is that greenhouse gases that cause global warming are considered non-toxic whereas air pollutants such as particulate matter or nitrogen dioxide are toxic./""It is not surprising to find that these risks are highly correlated, but this study provides the data and analysis to inform policy, data and analysis that were previously lacking,"" associate professor of Political Science at the university Debra Javeline said, in a statement./To make the study useful for policymakers, the authors ranked 177 countries on ""Target"", a measure that combined a country's climate impact risk, toxic pollution risk and its potential readiness to mitigate these risks. Most countries such as India and China, have high air pollution and green house gas (GHG) emissions. China is the world's leading total GHG emitter and India is on track to join it at the top and they are two top ranked countries to emit toxic air pollution./Based on these criteria, the study ranked Singapore, Rwanda, China, India, Solomon Islands, Bhutan, Botswana, Georgia, the Republic of Korea and Thailand as top 10 countries. ""The top one-third of countries at risk of toxic pollution and climate impacts represent more than two-thirds of the world's population, highlighting the magnitude of the problem and unequal distribution of environmental risk,"" researchers wrote in the paper published in peer-reviewed scientific journal PLOS One./Among those countries appearing at the bottom of the list are Equatorial Guinea, Iraq, Jordan, Central African Republic and Venezuela. ""These (bottom of the table) nations are most likely to have outstanding governance issues that currently stand in the way of effectively addressing pollution and climate change,"" the study said./On India and China, the two largest countries, together representing over 2.5 billion people, the study said they have relatively high Proportion Mortality ranks --- India ranked 5th and China 13th with 23.5% and 17.9% of annual deaths associated with toxic pollution, equalling 2.3 and 1.9 million premature deaths annually, respectively./The study also pointed out that the two countries have come up with national pollution reduction policies to reduce pollution deaths. In the case of China, it said, its National Plan on Air Pollution led to 40% reduction in pollution levels./""The improved air quality resulted in significant corresponding reductions in respiratory disease and cardiovascular disease mortality rates,"" the study said, adding that there is strong potential for co-benefits from efforts focused on China and India in risk reduction for neighbouring countries and other countries at-risk of climate change more broadly./Anumita Roy Chowdhary of Centre for Science and Environment said the study interestingly provides broad parameters linking air pollution and climate change and provides insight on how tackling both with singular policy instruments can be co-beneficial. ""We know that reducing air pollution helps in managing green house gas emissions and vice-versa. The study, however, analyses the capability of 180 countries to deal with twin environmental problems,"" she said./University's postdoctoral research associate Drew (Richard) Marcantonio said the idea of ranking (Target) is to highlight where action can be taken to reduce risk to human health and whether it can be done through incentives or sanctions. ""A range of measures can be used to promote risk reduction such as trade incentives..., or other policy and regulatory enforcement mechanisms,"" the study said, adding that it provides moral reflection to determine what actions should be taken and who should take them./Published by HT Digital Content Services with permission from Hindustan Times. For any query with respect to this article or any other content requirement, please contact Editor at /<a href=""mailto:contentservices@htlive.com"">contentservices@htlive.com</a>"
"India, China most vulnerable to climate crisis, pollution","India, July 23 -- India and China are among the five countries most vulnerable to climate change and air pollution, a first- of-its-kind research assessing the combined risks of the two factors said on Thursday./The world's two fastest developing economies have witnessed a spurt in particulate matter induced air pollution levels in the past two decades and a simultaneous increase in frequency of extreme weather events such as extreme rainfall, frequent cyclones and heat waves ./On Wednesday, extreme rainfall over the week had flooded many parts of Henan province in central China, leaving 33 persons dead. Several other regions of China have faced flooding this week even as north America is witnessing extreme heat wave./""Deaths resulting from toxic pollution are highest where the distribution of toxic pollution is greatest and, critically, also where the impacts of climate change pose the greatest risk,"" the study, titled Global Distribution and Coincidence of Pollution, Climate Impacts, and Health Risk in the Anthropocene, said, in a specific reference to India and China./For at least 30 years, the scientists on the UN's Intergovernmental Panel on Climate Change (IPCC) have assessed the impact of human induced climate change even as bodies such as the World Health Organisation have focused on the health impact of rising air pollution globally./Scientists at University of Notre Dame found a ""strong and statistically significant"" link between the two hazards and said the countries which are at most risk from climate change are also the countries with highest risk from toxic pollution./A vital difference between climate change and air pollution is that green house gases that causes global warming are considered non-toxic whereas air pollutants such as particular matter or nitrogen dioxide are toxic./""It is not surprising to find that these risks are highly correlated, but this study provides the data and analysis to inform policy, data and analysis that were previously lacking,"" Debra Javeline, an associate professor of political science at the university said in a statement./To make the study useful for policymakers, the authors ranked 177 countries on ""Target"", a measure that combined a country's climate impact risk, toxic pollution risk and its potential readiness to mitigate these risks. China is the world's leading total GHG emitter and India is on track to join it at the top and they are the two top ranked countries in terms of toxic air pollution./Based on these criteria, the study ranked Singapore, Rwanda, China, India, Solomon Islands, Bhutan, Botswana, Georgia, the Republic of Korea and Thailand as the top 10 countries at risk from the two factors combined. ""The top one-third of countries at risk of toxic pollution and climate impacts represent more than two-thirds of the world's population, highlighting the magnitude of the problem and unequal distribution of environmental risk,"" researchers wrote in the paper published on peer-reviewed scientific journal PLOS One./On India and China, the two largest countries, with a combined population of over 2.5 billion people, the study said they have relatively high Proportion Mortality ranks --- India ranked 5th and China 13th with 23.5% and 17.9% of annual deaths associated with toxic pollution, equaling 2.3 and 1.9 million premature deaths annually, respectively./The study also pointed out that the two countries have come up with national pollution reduction policies to reduce pollution deaths. In case of China, it said, its National Plan on Air Pollution led to 40% reduction in pollution levels./""The improved air quality resulted in significant corresponding reductions in respiratory disease and cardiovascular disease mortality rates,"" the study said./he paper also said that by mitigating toxic pollution in large countries with high populations such as China and India, neighbouring countries will also benefit./Anumita Roy Chowdhary of Centre for Science and Environment said the study provides broad parameters linking air pollution and climate change and insights on how tackling both with singular policy instrument can be co-beneficial. ""We know that reducing air pollution helps in managing green house gas emissions and vice-versa. The study, however, analyses the capability of 180 countries to deal with twin environmental problems,"" she said./Notre Dame University's postdoctoral research associate Drew (Richard) Marcantonio said the idea of ranking (Target) is to highlight where action can be taken to reduce risks to human health and whether it can be done through incentives or sanctions. ""A range of measures can be used to promote risk reduction such as trade incentives, be they negative or positive incentives, or other policy and regulatory enforcement mechanisms.""/BOX: Ranking/Top five: Singapore, Rawada, China, India, Solomon Islands/Published by HT Digital Content Services with permission from Hindustan Times. For any query with respect to this article or any other content requirement, please contact Editor at /<a href=""mailto:contentservices@htlive.com"">contentservices@htlive.com</a>"
System to give Delhi precise data on air pollution sources,"India, July 23 -- This year, a new system is likely to begin pinpointing the precise sources of air pollution in Delhi, which can potentially help authorities turn their attention to specific triggers, according to the people behind the project./The Decision Support System (DSS), a pollution tracking model developed by the scientists at the Indian Institute of Tropical Meteorology (IITM), Pune, aims to identify the contribution of known sources, such as vehicle tailpipe emissions, road dust, and farm fires, in real time./The system will plug into existing networks of air quality monitors, and leverage tagging of pollution sources - including details of where they are - to determine previously unknown details about Delhi's air./Sachin Ghude, in-charge of IITM's air quality early warning system and the head of the DSS project, and Gaurav Govardhan, who has developed DSS, said that this will be the first real time pollution source monitoring system to be used for Delhi./""Currently, we are conducting trials to further advance the accuracy of this source monitoring model. Our aim is that it starts producing realtime data by October this year, when the stubble burning season starts,"" Ghude said./Explaining how the model will work, Ghude said each pollution source in Delhi has been tagged with details of how much pollutants they contribute in Delhi's air in real time./""We have tagged each pollution source in Delhi. With this, at any given time we will be able to know which pollution sources are acting up and how much are they contributing. We will also be assessing where these sources are located,"" Ghude said. This, for instance, will help determine if the air is bad due to traffic or because of smoke from farm fires at a particular time, he said./Every year, from October to November, fumes from crop residue set alight by farmers in Punjab, Haryana and Uttar Pradesh engulf the national capital and its surrounding areas, making the air hazardous to breathe. This has required the Capital to issue restrictions on construction work and halve the number of private cars on the roads via the odd-even system./The problem becomes acute during and in the run-up to winter, when winds die down and pollutants settle closer to the city's surface, invariably manifesting as a brown haze./Despite mitigation measures that have intensified over the past five years, the region has made little improvement in being able to control the problem. In March this year, a report by Swiss technology company IQAir ranked Delhi as the world's most polluted capital in the year 2020./Last year, Delhi recorded 92 ""severe"" and ""very poor"" air quality days during winter, compared to 80 in 2019./Last year, the central government formed the Commission for Air Quality Management (CAQM) in Delhi and adjoining areas to tackle the problem and create a unified mechanism. But the measure made little difference and the body was disbanded earlier this year./The most significant movements in understanding Delhi's pollution problem came in 2016, when a source apportionment study was conducted by IIT-Kanpur and in 2018, in a study by The Energy Resources Institute (TERI) to identify major pollution contributors./But these were still not dynamic. IITM scientists said eight pollution sources identified by TERI in a report in 2018 have been tagged and contributions of these will be monitored./The model will also identify pollution sources from 19 districts across NCR./""This model was developed on the request of CAQM but since that has seized to exist, the developments highlighted through our system will be monitored by Central Pollution Control Board (CPCB). Realtime data will be available for policy makers as well as the public. They can keep a tab on it through our existing air quality early warning system,"" Ghude said./A senior CPCB official said the body is trying to improve the mechanism of identifying the pollution sources in Delhi-NCR so that a holistic winter action plan can be executed based on these inputs. ""It is a little early to comment on this from our end, but we are getting the best minds on-board so that the action against pollution sources can be quick and effective during winter season. We are experimenting with different technologies to achieve this,"" the official said./Published by HT Digital Content Services with permission from Hindustan Times. For any query with respect to this article or any other content requirement, please contact Editor at /<a href=""mailto:contentservices@htlive.com"">contentservices@htlive.com</a>"
