headline,body
"November woes begin: Delhi AQI enters red zone, climbing","New Delhi, Nov. 3 -- Pollution levels in the Capital entered the red zone on Tuesday and weather experts warned it will only get worse, potentially deteriorating to the ""severe"" category from ""very poor"" if the ban on use of firecrackers is flouted./The air quality index (AQI) was 303, according to the 4pm bulletin, breaching the threshold from poor to very poor for the first time this season. Over the next couple of days, wind directions are likely to change in a way that they bring in smoke from farm fires that have recently been raging in parts of Punjab and Haryana./An analysis by a government forecasting body on Wednesday said these two factors alone are enough to keep pollution levels in the upper ""very poor"" range - the AQI is likely to be in the high 300s in that case - as long as people do not burst any firecrackers during Diwali on Thursday./But if people burn even half the amount of firecrackers they collectively did in 2019, the AQI will slip into the severe category, the forecast by System of Air Quality and Weather Forecasting and Research (SAFAR) said./""We have identified three factors which could play a role around Diwali - stubble burning, which could touch a peak of around 4,000 fires and a share load of 40% on November 5, calm local winds over Delhi, and the third is how many firecrackers are burst. If no firecrackers are burst, Delhi's air will be very poor, but even if some firecrackers are added, the air could be pushed to the 'severe' range,"" said Gufran Beig, founder and project director at SAFAR./The analysis added that the ""AQI is predicted to enter into the severe category from the night of November 4 (Thursday) onwards and will remain severe until November 5. It is predicted to improve slightly in November but will fluctuate between higher end of very poor to the severe range""./Environment minister Gopal Rai said the Delhi government has given directions to increase vigilance across the city to check the sale, purchase and burning of firecrackers. Rai said till Tuesday, 12,957-kg of firecrackers had been seized by the Delhi Police and 32 people have been booked since October 27./""A special vigilance campaign would be run in the border area of Delhi so that illegally, there is no purchase, sale, movement, and storage of firecrackers anywhere. In this context, instructions have been issued to Delhi Police and SDM on behalf of DPCC today,"" said Rai./The last time Delhi's AQI slipped into the ""very poor"" zone was on June 9, when the AQI was 305 following the onset of strong, dust-carrying winds blowing into Delhi from the desert in Rajasthan./But winter pollution is a more stubborn problem due to a perfect storm of factors: the typical meteorological conditions characterised by low temperatures and calm winds prevent local pollutants from dust, smoke and tailpipe emissions to be dispersed and farm fires in Punjab and Haryana bring in ultra-fine particles that originated as smoke./The first half of November is particularly bad every year - in 2020, the month had nine days of severe category air pollution, of which six days were at a stretch between November 5 and 11./Sharing satellite images from the National Aeronautics and Space Administration (Nasa), Pawan Gupta, a research scientist at the Goddard Earth Sciences Technology and Research (GESTAR), Universities Space Research Association, said a thick layer of smoke and dust was seen in Delhi and parts of north India on Tuesday morning./Ashim Mitra from the satellite division of the India Meteorological Department also said that dense haze was captured via satellite images on Tuesday morning. He said that forecasts suggest that the air quality in Delhi, Punjab, and parts of Uttar Pradesh is likely to deteriorate further between November 5 and November 6./A SAFAR analysis of the day's pollution suggested Tuesday's deterioration was primarily due to local pollution sources and weather conditions in Delhi. The share of pollutants from farm fires was 6% but it would shoot up to 20-40% between November 4 and 6./Indian Institute of Tropical Meteorology (IITM) Pune's Decision Support System, too, indicated that the share of stubble fire in Delhi's pollution is expected to peak to around 55% by November 6./But there may also be some silver lining. Mahesh Palawat, vice-president (meteorology and climate change), said that an increase in wind speed is forecast from November 5. ""While there might not be a major impact but it will still help the city from entering the severe AQI zone,"" he said./Published by HT Digital Content Services with permission from Hindustan Times. For any query with respect to this article or any other content requirement, please contact Editor at /<a href=""mailto:contentservices@htlive.com"">contentservices@htlive.com</a>"
"Patna, Muzaffarpur record 'poor' air quality before Diwali","PATNA, Nov. 3 -- The capital city Patna and Muzaffarpur recorded 'poor' air quality while Gaya recorded 'moderate' air quality on Wednesday, a day before Diwali./Health experts believed this Diwali is particularly sensitive in terms of air pollution as those who have recovered from Covid-19 are prone to lungs and respiratory illness, if they inhale toxic smoke./As per the bulletin issued by the Central Pollution Control Board, the overall air quality index (AQI) of Patna, based on five monitoring stations across the city, stood at 239 which was classified as poor/Of the five air monitoring stations in Patna, Rajbanshi Nagar, Samanpura and Shikarpur-based stations, which recorded 'poor' air quality with an index value of 273, 277 and 228 respectively. Two stations at Samanpura and Danapur recorded 'moderate' AQI where the index value stood around 200./Similarly, the overall AQI of Muzaffarpur stood at 244 which marked 'poor' air quality while Gaya recorded 'satisfactory' air quality with a 71 index value./Bihar State Pollution Control Board (BSPCB) has imposed a complete ban on bursting firecrackers in four cities including Patna, Muzaffarpur, Gaya and Vaishali./BSPCB's chairman Ashok Ghosh appealed to the residents to avoid bursting firecrackers given public health safety./""We need to be sensitive and careful this Diwali as toxic pollutants may put Covid-19 recovered people at high health risk and respiratory distress"", he emphasised./He said, ""Diwali is a festival of lights, not firecrackers. The majority of crackers are manufactured using heavy metals like arsenic, barium, cadmium, nickel and tin which emit hazardous smoke harmful to the lungs. Loud crackers produce high decibel noise which is harmful to the ears over a long exposure.""/Ghosh said the board also carried out an awareness drive at schools and public places for sensitizing children and the public for not bursting firecrackers./Last year, Patna recorded 'moderate' air quality on pre-Diwali day with an index value of 190./City-based pulmonologist Dr Vikas Kumar, said, ""Covid-19 recovered people and patients suffering from respiratory ailment are at high risk if they come in contact with toxic smoke. During fireworks, they should stay indoors and wear face masks for avoiding contact with hazardous pollutants. Long exposure to loud noise and toxicants may cause breathlessness, severe headache and high heart rate.""/Published by HT Digital Content Services with permission from Hindustan Times. For any query with respect to this article or any other content requirement, please contact Editor at /<a href=""mailto:contentservices@htlive.com"">contentservices@htlive.com</a>"
Diwali 2021: How to take care of cancer patients during Diwali,"India, Nov. 3 -- While Diwali is the festival of lights and spreading joy and cheer, the elevated levels of air and noise pollution could be troublesome for some people including cancer patients. Diwali time fills our hearts with a lot of happiness, but one must make sure to safeguard the health of cancer patients who are in our family or among friends./Our eating and resting routine goes for a toss in the hectic week of Diwali. It is however important for cancer patients to eat healthy and timely meals and take their medication on time to avoid any health trouble. Care must also be exercised when it comes to consuming unhealthy processed snacks and desserts./""Cancer patients should adhere to healthy eating habits as suggested by the experts. Indulging in sweets, desserts, and namkeens is a strict no no. Include all the essential nutrients in the diet. Say No to junk, oily, and processed foods. Drink a lot of water to stay energized throughout the day,"" says Padmshri Dr. Ramakant Deshpande, Oncosurgeon & Chairman of ACI Cumballa Hill Hospital./In the times of pandemic, special care must be taken by those suffering from cancer to keep infections at bay./""People suffering from cancer need to wear masks even at home, avoid crowded places, have proper ventilation at home, maintain a safe distance from people, avoid visitors at home and do not be around sick people, wash their hands from time to time,"" says Dr Deshpande. He also recommends a good night's sleep./Diwali evening witnesses increase in noise and air pollution levels and it is advised to keep the vulnerable group safe from it./""People with cancer need to wear earplugs if the sound of crackers is too high. Avoid going in the place where one is bursting firecrackers. Keep the windows and doors close while people are bursting firecrackers outside,"" says Dr Deshpande./One must take out time for the loved ones who are suffering from this deadly disease during festival time and keep them engaged with television programmes, movies or music so that they don't feel neglected./Published by HT Digital Content Services with permission from Hindustan Times. For any query with respect to this article or any other content requirement, please contact Editor at /<a href=""mailto:contentservices@htlive.com"">contentservices@htlive.com</a>"
Farm fires till Nov 2 half of those reported last year: CAQM,"India, Nov. 3 -- The incidents of farm fires in parts of Punjab, Haryana, Uttar Pradesh, Rajasthan and Delhi reported between September 15 and November 2, just about halved this year compared to the same period last year, according to the data provided by the Commission for Air Quality Management in Delhi-NCR and adjoining areas (CAQM)./The data shows that 21,364 stubble burning instances were reported between the period this year compared to 43,918 fires -- a drop of 51.35%. Correspondingly, the contribution of farm fires to the overall pollution in Delhi has stayed up to 20% this year so far, even though experts have warned that it may see a spike soon./If the CAQM data is juxtaposed with the average air quality data provided by the Central Pollution Control Board (CPCB), it can be seen that Delhi's AQI has stayed mostly in the moderate and satisfactory zone between September 15 and October 26. To be sure, this included three poor air days on 16, 17 and 20 October; and an unprecedented good air day on October 18. However, since October 27, the air quality stayed in poor or very poor zone./Farm fires are a major contributor of the particulate pollutants to Delhi's air during the winters when thousands of farmers across Punjab, Haryana and Uttar Pradesh set the stubble on fire after harvesting the paddy./""To curb and abate air pollution from stubble burning, the commission has prepared a detailed framework and pursuant to that, action plans have been finalised by the government of Punjab, NCR state governments and the government of Delhi,"" the CAQM said on Wednesday./The commission also pointed out that this season, the major hot spots of paddy residue burning in the state of Punjab were Tarn Taran, Amritsar, Firozpur, Patiala, Ludhiana and Kapurthala. In Haryana, maximum stubble fires were reported from Kaithal, Karnal, Kurukshetra, Fatehabad, Ambala and Jind./""This season, 8,575 fields where stubble burning was reported, have so far been inspected by the state enforcement agencies and officials of the respective states and environmental compensation (EC) of about Rs. 58,05,000 has been imposed on violators,"" the statement by CAQM said./It added, ""Concerted efforts are being taken by the state governments, departments and various other stakeholders towards better in-situ management of crop residue through the use of CRM (crop residue management) machinery, PUSA bio-decomposers and facilitating various options for ex-situ utilization of paddy straw, besides large number of IEC (information, education and communication) activities, educational campaigns, awareness camps and publicity through print, electronic and social media.""/The CAQM said that the air quality in Delhi was comparatively better this time compared to last year. ""The hazy layer is fog and not smog as is being mistaken. There is comparatively less smoke and pollution share in the air now,"" the statement said./Environment experts said that while the efforts of the commission and the government agencies were in the right direction, it was also important to note that this year because of a late monsoon withdrawal the stubble fires started late and the spike has only started from October-end./""Between September 1 and November 2, over 18,747 and 4,842 farm fires were spotted in Punjab and Haryana. Yesterday (Tuesday) alone, more than 2,500 farm fires were reported in Punjab and Haryana. As we are in peak stubble burning window, fires are likely to go up to 3000-4000 per day in the coming days. While the current share of stubble burning on Delhi's particulate levels is less than 10%, it is expected to reach 35-45% on November 5 on account of northwesterly winds,"" LS Kurinji, programme associate, Council on Energy, Environment and Water (CEEW)./She added, ""Furthermore, since Diwali coincides with the peak stubble burning window this year, forecasts suggest that the additional load from firecrackers could further deteriorate the air quality in Delhi NCR. Taking cues from these forecasts, cities in the Indo-Gangetic Plain should execute pre-emptive measures controlling emissions from local sources in advance to avert severe air quality conditions.""/Published by HT Digital Content Services with permission from Hindustan Times. For any query with respect to this article or any other content requirement, please contact Editor at /<a href=""mailto:contentservices@htlive.com"">contentservices@htlive.com</a>"
"Crackers or not, air quality in Delhi likely to continue downward slide: IMD","India, Nov. 3 -- Slow winds, a change in the wind direction, drop in temperatures and high humidity -- weather conditions conducive for slow dispersal of pollutants -- will ensure very poor air quality in Delhi on the occasion of Diwali on Thursday even if people do not burst firecrackers, weather scientists have said./According to India Meteorological Department (IMD), from Thursday, the wind direction will change to northwesterly which will bring more particulate pollutants from the farm fires in Punjab and Haryana. On Wednesday, the overall contribution of a total of 3,271 stubble fires to the pollution in Delhi was recorded at 8%. According to System of Air Quality and Weather Forecasting and Research (Safar), a forecasting body under the Union ministry of earth science, this contribution may go up to 40% on Thursday./RK Jenamani, scientist at IMD, said temperatures are currently staying near normal, and will remain in the same range for the next few days, but calm wind conditions are expected on both November 4 and 5. There will be high humidity too./Jenamani, however, predicted that things may improve Friday night onwards. ""Relief is likely only from the night of November 5 and the morning of November 6 onwards. Wind speeds will pick up and touch 30 km/hr and help disperse pollutants,"" Jenamani said./On Wednesday, ahead of Diwali, a meeting of the sub-committee on the Graded Response Action Plan (Grap) was also held during the day, with experts warning of air quality deteriorating to the higher end of the 'very poor' category between November 4 and 6. However, no fresh directions were issued./Tanushree Ganguly, programme lead at the Council on Energy, Environment and Water (CEEW), said forecasts by Safar, Urban emissions and Delhi's new air quality decision support system (developed by IITM) all suggest air quality will be in the higher end of the 'very poor' category on Diwali, even if crackers were not used./""If people burst firecrackers, we may see 'severe' air -- levels of air pollution which especially impact the health of children, elderly, and those with existing health problems. Delhi's forecasting systems have a clear message for all of us. If we want to protect the health of our family and neighbours, we must refrain from using firecrackers,"" said Ganguly./According to the Central Pollution Control Board (CPCB) data, air quality in Delhi last month remained uncharacteristically decent till October 26. However, from October 27, the air quality stayed in the poor zone till November 1. On November 2, the city recorded AQI in the very poor zone for the first time since the last 146 days. On November 3, the air stayed in the same zone, indicating it may worsen further./To be sure, the Delhi government has imposed a complete ban on sale, storage and use of firecrackers with teams being formed to ensure that people do not violate the rules on Diwali./On the eve of Diwali on Wednesday, Delhi environment minister Gopal Rai urged the citizens to shun firecrackers, asked political parties not to link cracker bursting with religious traditions and appealed to the Centre to issue and advisory to the neighbouring states of Punjab, Haryana and Uttar Pradesh to stop stubble burning./Polluted Diwali, a norm/CPCB data shows Delhi recorded its most polluted Diwali day in 2016, when the AQI touched 431 (severe) on October 31. In 2020, despite a complete ban on firecrackers, an AQI of 414 (severe) on Diwali day made it the second most polluted Diwali in the last six years. Last year, Diwali was celebrated on November 14./Around the festival, the impact of smoke from farm stubble burning is usually at its peak, the effect of which is amplified by the low temperatures and emissions from firecrackers./Over the last two years, weather has come to Delhi's rescue during Diwali. While pollution levels have spiked on Diwali night and the day after, strong winds and rain have helped disperse the cracker smoke./In 2020, despite recording the worst pollution spike on and post-Diwali because of an increase in cracker bursting, heavy rain and strong winds the day after, helped clear the pollution levels in the city. On November 14, Diwali day, the AQI hit 414. A day later, it increased further to 435. But by November 17, the AQI had improved to 171./""A western disturbance crossed the national capital on Diwali night last year, which led to an increase in the wind speeds. Though the impact was not seen immediately in the next day's data because it is a 24-hour average, the AQI in the next few days reached the moderate level,"" a senior Met official said./In 2019 too, high wind speeds helped disperse the cracker emissions quicker than it had in 2018, environment experts pointed out. That year, Diwali was celebrated on October 27./""The dispersion of pollutants was as fast as the build-up. This is because of the stronger winds compared to 2018 ,"" an analysis by Centre for Science and Environment (CSE) that year said./While there was a complete ban on firecrackers last year, only green crackers were allowed in 2018 and 2019 - with violations being reported in both years./Published by HT Digital Content Services with permission from Hindustan Times. For any query with respect to this article or any other content requirement, please contact Editor at /<a href=""mailto:contentservices@htlive.com"">contentservices@htlive.com</a>"
Air pollution: All round failure,"India, Nov. 5 -- The Delhi government's complete ban on the sale and bursting of firecrackers, including green crackers, on Diwali, went up in smoke on Thursday, with citizens refusing to abide by the government order. The situation was not significantly different in the other states of the National Capital Region (NCR), despite near similar bans on the sale and bursting of crackers. And this year, like in many preceding ones, the administrations of states such as Punjab and Haryana have been loath to crack down on stubble-burning by farmers, who continue to flout orders banning the practice, sending noxious fumes towards NCR./The impact of such irresponsible behaviour on the Delhi-NCR's air quality was immediate. According to the Central Pollution Control Board (CPCB), the 24-hour average concentration of lung-damaging PM2.5 in Delhi-NCR shot up from 243 micrograms per cubic metre at 6 pm on Thursday to 410 micrograms per cubic metre at 9 am on Friday, around seven times the safe limit of 60 micrograms per cubic metre. The PM10 levels crossed the 500 micrograms per cubic metre mark about 5 am on Friday. Delhi's neighbouring cities of Faridabad (454), Greater Noida (410), Ghaziabad (438), Gurgaon (473), and Noida (456) also recorded severe air quality on Friday morning. An Air Quality Index between zero and 50 is considered good, 51 and 100 satisfactory, 101 and 200 moderate, 201 and 300 poor, 301 and 400 very poor, and 401 and 500 severe. Air quality experts have been warning that emissions from firecrackers and farm fires, if unchecked, could exacerbate already unfavourable meteorological conditions - including slow winds and below-normal temperatures. This year, a delayed monsoon, farm fires have peaked around Diwali. And firecracker bans have proved ineffective./Delhi was the most polluted capital city in the world in 2020 for the third consecutive year, according to the World Air Quality Report, 2020. It is clear that despite people being fined (for farm fires) or booked (for smuggling firecrackers), the political class and administrative machinery (including the police) have no capacity or intention to implement such bans in letter and spirit. And farmers and those celebrating Diwali with fireworks have simply refused to listen to reason. The Central and state governments now need to rethink what went wrong, and come up with a unified strategy for containing air pollution, including the Diwali spike./Published by HT Digital Content Services with permission from Hindustan Times. For any query with respect to this article or any other content requirement, please contact Editor at /<a href=""mailto:contentservices@htlive.com"">contentservices@htlive.com</a>"
"Delhi pollution: AIIMS director warns against severe cases of Covid, worsening lung ailments","India, Nov. 5 -- The director of All India Institute of Medical Sciences (AIIMS), New Delhi, Randeep Guleria, on Saturday cautioned against severe cases of Covid-19 due to rising air pollution as the national capital's air quality reached dangerous levels. Urging people to wear masks to protect themselves from both Covid and pollution, Guleria said bad air can also have a major impact on respiratory health, especially on people with lung diseases and asthma./""Pollution can lead to more severe cases of Covid. Should wear a mask as it will help in protection from both Covid-19 and pollution. It has a huge effect on respiratory health especially on people with lung diseases, asthma as their disease worsens,"" he was quoted as saying by news agency ANI./The AIIMS director also talked about the World Health Organisation's (WHO) emergency use listing of Covaxin calling it a ""proud moment for our country"". ""We've got approval for a made in India vaccine. Earlier India was a vaccine manufacturing hub but in the last 18 months, we've shown that we can do a lot of high-quality research also,"" Guleria said./Delhi witnessed a record rise in air quality index (AQI), which rose to 462, on Friday evening, the highest since 2016. The ruling Aam Aadmi Party (AAP) blamed opposition parties, including the Bharatiya Janata Party (BJP), for encouraging people to burst crackers despite a blanket ban being put in place by the government./Delhi environment minister Gopal Rai also accused Opposition parties of giving a ""religious colour"" to the issue of a cracker ban. Chief minister Arvind Kejriwal had earlier urged people to not burst firecrackers till January 1./The BJP, however, hit back at AAP, alleging that Delhi's pollution levels were in the ""hazardous zone"" before Diwali and the current predicament is not due to bursting firecrackers./""Delhi's AQI was in a hazardous zone even before the crackers came out. Anyone suggesting otherwise is trying to make Arvind Kejriwal look good, who has unleashed a diabolical campaign to dissuade Delhiites from bursting crackers. Poor air quality is a result of anything BUT Diwali,"" BJP's national IT in-charge Amit Malviya wrote in a tweet on Friday./Air quality in the national capital was expected to drop rapidly as stubble burning in the neighbouring states coincided with Diwali. Around 9pm on Thursday the national capital's AQI dropped to 'severe' for the first time this year./An analysis done by Hindustan Times suggested that air quality will marginally improve from Sunday evening and fluctuate within the 'very poor' range. It also found firecrackers to be the major contributing factor in deterioration of air quality in Delhi./Published by HT Digital Content Services with permission from Hindustan Times. For any query with respect to this article or any other content requirement, please contact Editor at /<a href=""mailto:contentservices@htlive.com"">contentservices@htlive.com</a>"
