headline,body
"World Heart Day 2021: Know all about the date, history, significance and theme","Delhi, Sept. 28 -- As per the World Heart Federation, World Heart Day is important as cardiovascular disease (CVD) remains the world's number one killer, resulting in 18.6 million deaths a year. Covid-19 has only been more heartbreaking for this figure as it has made 520 million people living with CVD, more vulnerable to developing severe forms of the coronavirus./Smoking, diabetes, high blood pressure, obesity, air pollution and less common conditions like Chagas disease and cardiac amyloidosis are all causes of cardiovascular disease. Hence, it is important to look after our heart by eating a healthy diet, saying no to tobacco and getting plenty of exercise./Remember, missing medical appointments, lack of contact with family and friends or reduced physical exercise can lead to CVD. So, don't let Covid-19 stop you from attending your regular check-ups especially if you have underlying health conditions like heart disease, heart failure, diabetes, high blood pressure or obesity./Date:/To increase public awareness of cardiovascular diseases, their prevention and their global impact, World Heart Day is observed and celebrated annually on September 29./History:/World Health Day was first founded in 1999 with the World Heart Federation (WHF) collaborating with the World Health Organisation (WHO). The idea of an annual event was conceived by Antoni Bayes de Luna, the president of WHF from 1997-2011. Originally, World Heart Day was observed on the last Sunday of September, with the first celebration taking place on September 24, 2000./Significance:/According to the World Heart Federation, ""World Heart Day informs people around the globe that CVD, including heart disease and stroke, is the world's leading cause of death claiming 18.6 million lives each year, and highlights the actions that individuals can take to prevent and control CVD. It aims to drive action to educate people that by controlling risk factors such as tobacco use, unhealthy diet and physical inactivity, at least 80% of premature deaths from heart disease and stroke could be avoided.""/Theme:/This year, the theme of World Heart Day is ""Use Heart to Connect"". The idea is to find different and innovative ways to connect people to heart health, especially in lower resource areas and communities by ""using your knowledge, compassion and influence to make sure you, your loved ones and the communities you're part of have the best chance to live heart-healthy lives. It's about connecting with our own hearts, making sure we're fuelling and nurturing them as best we can, and using the power of digital to connect every heart, everywhere.""/Published by HT Digital Content Services with permission from Hindustan Times. For any query with respect to this article or any other content requirement, please contact Editor at /<a href=""mailto:contentservices@htlive.com"">contentservices@htlive.com</a>"
"World Heart Day: Rise in heart attacks among under-50s, say doctors","India, Sept. 29 -- Doctors and experts have pointed to a worrisome trend on the occasion of World Heart Day celebrated on September 29. They have warned against an increasing number of young people (below 50 years of age) being diagnosed with heart issues. While developing blockages in arteries is natural above 50 years of age, people below 50 years of age developing blockages has become a cause for concern today./Food habits like eating packaged and baked foods containing palm oil, lack of exercise, stress, air pollution etc. are contributing to the early onset of heart-related diseases, doctors said./Dr Sujit Sawadatkar, interventional cardiologist from Noble hospital, said that almost 50% of the heart patients that visit him are youngsters. ""When I say youngsters, I mean people who are less than 50 years old. This is a worrisome trend that we are seeing. Building up fats, cholesterol and other substances in and on the artery walls is natural in the 50+ age group. But witnessing heart issues before 50 years of age is the contribution of certain factors,"" he said./Dr Sawadatkar said that most of the packaged food industry uses palm oil. ""You take bakery items, icing on cakes, chocolates, or any other packaged food, it has cheap alternatives to healthy oil options and that is not good for heart health. High content of saturated fatty acids and cheap alternatives to healthy oil is damaging to heart health. Also, the younger generation is following a sedentary lifestyle with no proper exercise routine. Factors like stress and air pollution are also contributing in a big way to the early onset of heart diseases. Rampant use of some supplements also has a negative impact on the heart.""/Sharing greater insights, Dr Benny Jose, consultant and interventional cardiologist at Jupiter hospital said that heart attacks among youth are on the rise due to lifestyle issues. ""A sedentary lifestyle is a major cause for the younger population getting more heart attacks. And this includes food habits. But a person should focus on having a culture of exercise in their daily routine. And with this, healthy food is also important. Risk factors like diabetes, hypertension should not be neglected as these conditions can cause irreversible damage to vascular health,"" Dr Jose said./Published by HT Digital Content Services with permission from Hindustan Times. For any query with respect to this article or any other content requirement, please contact Editor at /<a href=""mailto:contentservices@htlive.com"">contentservices@htlive.com</a>"
Electric buses spark hope for sustainable transport in Bengaluru city,"India, Oct. 1 -- Bengaluru/The Karnataka government on Thursday received the first of its planned 90 electric buses to ply as Bengaluru Metro feeder service, a move that is seen as part of the larger initiative to introduce more sustainable technologies to bring down pollution in the public transport sector./""Our government is dedicated to ensure people get the best transport facilities. In addition, electric buses are being introduced in larger numbers to protect the environment. Request all people to make best use of this transport facility and also help reduce traffic congestion,"" B Sriramulu, Karnataka's minister for transport and scheduled tribe (ST) welfare said in a post on Twitter on Thursday./The Bengaluru Smart City Ltd. will provide financial assistance of Rs.50 crore for the operation of 90 electric buses and an incentive of Rs.50 lakh per bus have been provided to the bidder, Bengaluru Metropolitan Transport Corporation (BMTC) said, adding an additional Rs.5 crore is set aside to set up charging infrastructure./""The tender has been finalised and letter of award has been issued to M/s. NTPC Vypar Vidyut Nigam at GCC rate of Rs.51.67/ km with electricity for 180 assured km for a period of 10 years. The buses have a seating capacity of 34 persons and can operate 120 kms on a single charge,"" the BMTC said in a statement on Thursday./People aware of the developments said the buses would begin in a phase-wise manner from next month when the government will flag off these services. The 90 buses will be operate in Yeswanthpura, KR Puram and Kengeri./The EV (electric vehicle) initiative in the intra-city bus services is part of a larger plan of the state government to introduce more eco-friendly commute options for the public in a city that has seen its quality of air and water deteriorate in recent years, amplified by the intensifying construction and road repair works./Experts said that ever since the Covid-19 pandemic-induced lockdown were lifted, the AQI (air quality index) has oscillated more sharply than before, HT reported on June 25./In the 13 monitoring stations across Bengaluru, only one station near Mysuru Road had a rating of 'good' in the AQI index in August while most others were 'satisfactory' while two were in 'moderate' category, according to the Karnataka state Pollution Control Board (KSPCB) data./Bengaluru has 9.4 million vehicles and pollution caused by them is the biggest reason for the deteriorating AQI in the city and its over 12 million residents./The KSPCB claims have been contested be experts in the past as most of the monitoring stations are placed away from high-density roads and tucked away near lakes and open spaces that lead to inaccurate findings./""If they acknowledge the problem then there has to be an intervention, action, followed by more work which they don't want to do,"" Madhusudhan Anand, chief technical officer at, Ambee, a Bengaluru-based startup that works to find solutions for air pollution earlier told HT./For instance, the air monitoring centre in BTM Layout, one of the most congested localities in Bengaluru, is placed around a canopy of trees near Madiwala lake, away from the main road, which is unlikely to capture the true extent of the pollution./According to KSPCB, in its revised action plan for the control of air pollution in Bengaluru, the city's AQI -- a metric of daily air quality -- has fallen from 107.1 in 2014-15 to 88.1 in 2018-19, which shows a decreasing trend in the five-year annual average./This data has been disputed even by elected representatives, apart from scientists and experts on the subject./A 41-point action plan to mitigate air pollution, introduced by the state government, includes the implementation of LPG and bio-fuels, promoting battery operated vehicles, effective disposal of construction debris and operations of the metro among other measures to decrease the harmful pollutants entering the air./Electric vehicles are a way forward but the lack of infrastructure and government support has led to hesitancy among the public who still prefer vehicles that use fossil fuels./On September 15, Prime Minister Narendra Modi-led Union cabinet approved a $3.5-billion incentive scheme aimed at boosting electric and hydrogen fuel powered vehicles production in the country./But the difference between announcing a policy and implementing it has been the biggest challenge in cities like Benglauru, experts said./The government has set a target of one charging station in a 3km radius grid in Bengaluru, as part of its 2017 EV Policy./Companies like Ola, Uber, Bounce, Vogo and several others are looking at increasing EVs in their respective fleets to bring down capital and operational expenditure for service providers, reduce cost per km for users and help bring down pollution by keeping out smoke-emitting gasoline vehicles off the road. But none of this has come with government support and has been an investment of the private sector, according to people familiar with the matter./Ola is investing Rs.2,400 crore to set up a two-million per annum EV plant in Tamil Nadu. The Karnataka government earlier this year approved investments of Rs.22,419 crore in three different proposals involving EV and lithium-ion battery manufacturing that has the potential to create nearly 5,000 new jobs. But these projects are yet to see any traction on the ground./Published by HT Digital Content Services with permission from Hindustan Times. For any query with respect to this article or any other content requirement, please contact Editor at /<a href=""mailto:contentservices@htlive.com"">contentservices@htlive.com</a>"
Kejriwal unveils plan to combat winter pollution,"New Delhi, Oct. 5 -- The national capital has drawn up an action plan to tackle the severe air pollution in the winter months, chief minister Arvind Kejriwal said on Monday, announcing alternatives to stubble burning, measures to control road dust and vehicular emissions, and urging governments of neighbouring National Capital Region (NCR) states to adopt similar steps./As part of its 10-point plan, the Delhi government will help spraying a bio-decomposer -- developed by Indian Agricultural Research Institute (ICAR -- also known as Pusa Institute) -- which converts paddy stubble into manure without burning, in rural areas in the Capital. The burning of farm residue in Punjab, Haryana and western Uttar Pradesh ahead of sowing the winter crop releases large amounts of smoke, leading to an annual air emergency in the NCR. Kejriwal said these states must use the bio-decomposer as well./Except November, December and January, Delhi's air quality is usually under control, Kejriwal said. ""But this will change in a few days because the Centre and the neighbouring state governments have not done anything to prevent stubble burning in the region,"" he added. ""This will lead to Delhi's air quality deteriorating in the coming days.""/Besides steps to prevent stubble burning, authorities in Delhi will ensure dust from construction sites is kept to a minimum. There will be increased vigilance to keep vehicular emissions in check, the CM said./The action plan details steps such as forming pollution-monitoring teams and increased checks at hot spots. The government has formed 75 teams to ensure dust control at construction sites, 250 teams to prevent open burning of waste and leaves, and nearly 500 teams to ensure all vehicles comply with pollution under control rules. No diesel vehicles older than 10 years and petrol vehicles older than 15 years will be allowed to ply./The action plan has also identified 64 congestion-prone stretches in the Capital, where long traffic snarls resulted in a spike in pollution levels./Delhi environment minister Gopal Rai early last month promised the city will have a detailed winter action plan. To formulate it, multiple agencies such as the municipal corporations, the public works department, and Delhi traffic police, were asked to submit their proposals to manage air pollution./The winter action plan will be implemented in tandem with the Supreme Court-mandated Graded Response Action Plan (Grap)./""The Grap measures will be enforced strictly this season across Delhi NCR. The Commission for Air Quality Management (CAQM) will be the overarching body that will monitor the situation and will call in the measures listed under the Grap,"" Union environment minister Bhupender Yadav said./Delhi is on the right track in its strategy to control air pollution, but it needs concerted efforts to show results, an expert said./""In addition to the sources that the winter action plan tackles, the government should also ensure that Delhi's urban poor have access to alternatives to using biomass for their space heating requirements,"" said Tanushree Ganguly, programme lead at Council on Energy, Environment and Water, a think tank. ""One way could be through the creation of clean and warm night shelters.""/""Given that Delhi now has a functional decision support system to pinpoint sources of pollution, the government should ensure that insights provided by it are used to plan and roll out actions in advance to prevent severe air quality levels in the city,"" Ganguly said./Anumita Roychowdhury, executive director (research and advocacy), said that such focus on pollution will help Delhi bring down winter season emissions but there needs to be year-long action for noteworthy results. ""The focus areas that the government has laid out are on-point, but we have discussed this before that Delhi needs action. We will have to ensure that not only do agencies in Delhi work but even other states in the region work together to find a lasting solution for the pollution problems,"" Roychowdhury said./Air pollution has been a stubborn crisis for the Capital and adjoining areas. Meteorological parameters typical for pre-winter months, when wind speed slows down and colder, heavier air drifts settles closer to ground-level, stops tailpipe emissions, road and construction dust, and industrial gases from dispersing./To add to it, smoke from farm fires in Punjab and Haryana catches the north-westerly winds to reach Delhi and other NCR towns, where they push the air quality index into dangerous levels./Published by HT Digital Content Services with permission from Hindustan Times. For any query with respect to this article or any other content requirement, please contact Editor at /<a href=""mailto:contentservices@htlive.com"">contentservices@htlive.com</a>"
"150 pollution hotspots identified in Delhi, govt will closely monitor them: Environment minister Rai","New Delhi, Oct. 5 -- Delhi environment minister Gopal Rai said on Tuesday that his Aam Aadmi Party (AAP) led government has identified 150 pollution hotspots in the national capital based on the complaints received on the 'Green Delhi' application. Rai said that these pollution hotspots will be closely monitored and preventive action will be taken with the help of concerned departments and officials./Chief minister Arvind Kejriwal launched the Green Delhi application in October last year, to enable people to file complaints about the pollution of anti-pollution norms in Delhi. The government had also set up the 'Green War Room' last year itself to monitor and coordinate anti-pollution efforts./Speaking at the launch of the Green Delhi application's IOS version, environment minister Gopal Rai said on Tuesday that over 23,000 of the total 27,000 complaints received on the application have been resolved. The majority of the complaints were related to the Delhi Development Authority (DDA), municipal corporations and the Public Works Department (PWD), Rai added./The environment minister also said the Delhi government has strengthened the Green War Room, which is the most crucial component in the national capital's anti-pollution campaign. The war room ensures stringent enforcement of guidelines to check dust pollution at construction and demolition sites, ready-mix concrete plants, and garbage burning. It is one of the measures of the government's action plan to combat air pollution and will remain operational 24x7 from October to February./Previously, the Central Pollution Control Board and the Delhi Pollution Control Authority had earlier identified 13 pollution hotspots including those in Rohini, Punjabi Bagh, R K Puram./Chief minister Kejriwal on Monday released a 10-point winter action plan to fight pollution in Delhi which includes a total ban on firecrackers, strengthening of the anti-dust campaign, installing smoke towers, monitoring stubble burning among others./Published by HT Digital Content Services with permission from Hindustan Times. For any query with respect to this article or any other content requirement, please contact Editor at /<a href=""mailto:contentservices@htlive.com"">contentservices@htlive.com</a>"
Chandigarh: Resident of southern sectors meet UT adviser,"Chandigarh, Oct. 6 -- Voice of Housing Societies (VOHS), which represents various housing societies in Sectors 48, 49, 50 and 51, met UT adviser Dharam Pal on Tuesday regarding the issues they are facing./VOHS convener MN Shukla said, ""Issues like conversion from leasehold to freehold, stamp duty, unearned increase and completion certificate were discussed.""/Shukla said that the adviser discussed the issues in detail with them and has marked their representation to the UT finance secretary. ""The adviser has assured us that in case the issue remains unresolved, he will hold a joint meeting to find a solution to our issues.""/The society had on Sunday held a meeting in Sector 49 with the representatives of various societies and discussed these issues with the upcoming municipal corporation (MC) elections in mind./MORE NEWS IN BRIEFS/PO held in 2009 cheating case/The proclaimed offenders and summon staff of Chandigarh Police arrested a PO who had been absconding in a cheating case registered in 2009. He has been identified as Jagmohan Kumar, a resident of Ropar. He was booked in a in November 2009 at Sector 17 police station and declared a PO by the district court in November 2010. He will be produced before the court on Wednesday./Citizens' body urges health min to take up issue of air pollution/Members of Clean Air Punjab have written to Punjab deputy chief minister OP Soni, who also heads the health ministry, urging him to take up the issue of air pollution prominently. The citizens' body also urged the health minister to direct all urban local bodies to issue timely health advisories publicly and alert citizens on ""bad air"" days, which will help save vulnerable groups from severe health impacts of air pollution./Third counselling for class 11 students from today/The UT education department will organise the third counselling for admission to Class 11 in government schools from October 6 to 12. The application form can be downloaded on /<a href=""http://www.chdeducation.gov.in"">www.chdeducation.gov.in</a>/ and submit it on /<a href=""mailto:admissionxiut@gmail.com"">admissionxiut@gmail.com</a>/ No List of allotment of seats will be uploaded online on October 16 on the department website./Aayushi card launched for cancer patient/Municipal commissioner Kamal Kumar Garg launched the ""Aayushi card"" for cancer patients at Ivy Hospital in Mohali on Tuesday. He said this card would help the patients get check-ups on time. He added that we must follow a healthy lifestyle to prevent the disease./UT cop bags bronze in bodybuilding c'ship/Inspector Baldev Kumar of Chandigarh Police has won a bronze medal at the 12th WBPF World Bodybuilding and Physique Sports Championship, 2021, held at Tashkent, Uzbekistan. Director general of police (DGP) Praveer Ranjan took to twitter to congratulate the winner./PU engineering students demand return to campus/Final-year masters of engineering (ME) students of Panjab University's University Institute of Engineering and Technology (UIET) and University Institute of Chemical Engineering Technology (UICET) have written to the dean students' welfare (DSW) asking that they are allowed to return to campus. They have said that the varsity has allowed final year students from other departments to return to campus, but neglected engineering students, who are in need of laboratories and hostel accommodation as much as others./Executive body of AAP women's wing constituted/Aam Aadmi Party (AAP) Chandigarh announced a new executive body of the women's wing on Tuesday. Anita Sharma has been appointed president, Kamta Dameja as vice-president, Kamlesh Chaudhary as general secretary and Mamta Kainth as secretary. Senior AAP leaders congratulated the new office bearers./Published by HT Digital Content Services with permission from Hindustan Times. For any query with respect to this article or any other content requirement, please contact Editor at /<a href=""mailto:contentservices@htlive.com"">contentservices@htlive.com</a>"
