headline,body
5 anti-smog guns to be installed in Ludhiana city,"Ludhiana, Sept. 3 -- At a time when the rising pollution is taking a toll on the health of the public in the industrial hub of the state, anti-smog guns will be installed in the city to bring down the pollution levels./In a first-of-its-kind initiative, five anti-smog guns have been purchased by the Municipal Corporation (MC) at a cost of Rs.85 lakh under the National Clean Air Programme (NCAP)./Civic body officials claim that the Ludhiana Municipal Corporation (MC) is the first to introduce anti-smog guns in the state and the project is expected to bring huge relief to the residents especially when stubble burning is witnessed in the state./The authorities have received the delivery of five machines which have now been kept at MC's workshop and trials will be conducted in the next week./An anti-smog gun is a device to combat air pollution which will spray atomised water to settle the dust and other suspended particles in the atmosphere. The MC officials stated that the guns can spray water up to a height of 100 meters to settle dust particles and PM 2.5./The officials stated that the guns can be transported to any part of the city using tractors and the machines will be operated with the help of a generator./One of the senior MC officials stated that the MC had tested the anti-smog guns in February last year, following which a proposal was made to install these in the city. Now five anti-smog guns have been purchased for the city and a trial will be held in the presence of senior officials next week./Ludhiana is one of the nine non-attainment cities in Punjab according to the NCAP norms, which means it has over a five-year period not consistently met the National Ambient Air Quality Standards (NAAQS) for harmful PM 10 (particulate matter that is 10 microns or less in diameter), PM 2.5 or NO2 (nitrogen dioxide)./PM 2.5, a prominent pollutant in the air, is produced by burning, construction works and vehicles. It is small in size due to which it can get directly absorbed into the bloodstream, and can cause asthma, lung cancer and even heart disease./Published by HT Digital Content Services with permission from Hindustan Times. For any query with respect to this article or any other content requirement, please contact Editor at /<a href=""mailto:contentservices@htlive.com"">contentservices@htlive.com</a>"
"Startup Mantra: Tapping hidden treasures from agro waste, crop residue","India, Sept. 3 -- While you get to read this story today, Govinda Hari Sonawane, an aspiring-entrepreneur from Nimbhora village of Raver tehsil in Jalgaon district of Maharashtra - about 1,100 kilometres from Delhi - is awaiting a call to get his startup shortlisted for incubation in IIT Delhi./Govinda has made a portable machine named ""BioChar"" that converts agricultural waste and crop residues into valuable products like bio-incense sticks, paper plates and ""vegan leather"". Interestingly, the machine does not require any kind of external source like electricity for its operation. Govinda's startup ""Agri Waste Pvt Ltd"" is helping farmers earn additional income from agri-waste; reduce air and soil pollution due to burning of this waste; and create employment and income opportunities in rural areas and for small-scale entrepreneurs./Hard lessons/Govinda comes from an economically-stressful background. He completed his schooling and college education in Jalgaon itself, while his father did furniture work to sustain the family. Govinda did his MSc Electronics from Kavayitri Bahinabai Chaudhari North Maharashtra University, Jalgaon, and later moved to Talegaon Dabhade in Pune for a job./Govinda said, ""I worked in the company till 2014-end and returned to my village. I was looking for options when the thought of starting my own business came to my mind. I had the experience of making CFL bulbs and decided to do something in a related field. I began with CFL bulb assembly and mobile charger circuit business. I took a loan of Rs.5 lakh under the PM Employment Guarantee Scheme in March 2015 for this business./""However, a few months later, I ran into losses. The bulb performance guarantee provisions were not sustainable and hence all profit and the capital invested was lost. It was a hard lesson learnt, but I did not lose hope. I realised that the non-functional bulbs will have either the tube or circuit in good condition and thought of repairing such faulty bulbs and resell it. I used to collect such non-working bulbs, repair it and resell it. I did this business for about two years till I repaid the loan amount in 2019.""/Pivot/While touring for the bulb business, Govinda spotted opportunities to diversify and start new business of incense sticks (agarbatti). Since many small and big players are already set in this market, Govinda was in search of having some product-differentiation./""I had presented an idea of making incense sticks from flowers and based on this I was hoping to get incubated under the Start-up India Scheme at the North Maharashtra University. My mentor Manveen Chaddha persuaded me to do more research on this business. A few startups were already doing some work in agri-waste processing and I went through the patents and IP rights,"" he said./""While watching videos of some machines on an online platform, I realised that either electricity or huge amount of wood or charcoal is required for the machines to produce incense sticks. I visited one such unit at Nagpur and they told me that the machine costs around Rs.10 lakh. So, I started researching about the machine and its design. Short of money and resources, I took a 200-litre capacity drum and made a prototype. It was designed in such a way that no electricity was needed to operate it and any kind of waste, including dry leaves of plants, would be turned into charcoal in a few hours. The machine was a success and I invited my mentor to check it,"" Govinda said./Resistance/Initially, Govinda's family opposed his business. However, his wife Manisha not only supported, but also decided to share responsibilities in his enterprise./Govinda said, ""While touring for the bulb business, I used to meet many shop owners in and around my village. Their acquaintance helped me get initial traction for the incense sticks business. But I was wary of suffering financial loss while doing business. It also happened that due to incomplete documentation, an award remuneration of Rs.85,000 from KCIIL Incubators (North Maharashtra University, Jalgaon) was delayed. Hence, I did not register the company nor did I seek funding from any external investor. In fact, no one from my family or village had ever heard of funding or venture capital and they could not believe that a person or institution can actually help monetarily to do business. Later, I received another award worth Rs.75,000 from MIT ADT University in Pune and also the first award amount. That's when my family started believing in my entrepreneurial spirit, and now, they completely support me.""/Prototype to final product/The prototype to final product journey has been a long one for Govinda. During the Covid lockdowns in 2020, Govinda's business flourished because other companies were unable to provide their products in villages. But in 2021, during the second wave of coronavirus infection, Govinda and his entire family was affected and hospitalised./""Business took a hit for about six months due to Covid. Whatever gains we made in 2020 were wiped out in 2021, but we did not lose hope. We started again with the same zeal and are still running. The company was incorporated in February 2022. The prototype was made with just Rs.9,000. With certain design changes, we were able to make the final product in March-2022 at a cost of just Rs.90,000,"" recalls Govinda./BioChar: How it works/Govinda's BioChar is a low-cost product designed for rural entrepreneurs and farmers to generate additional income and employment opportunities./For readers convenience, Govinda explained how the machine works. ""Typically corn cobs (bhutta) and cotton stalks (cotton crop waste) are either thrown away or burnt by farmers. Industries looking for biofuels are interested in larger farms (5 acre or more) and hence small farmers (less land holdings) are ignored by them. This is the raw material that is required to put into BioChar machine./If the raw material is put into the machine and ignited it will burn into ash. So, we need to control the oxygen levels and keep it at lower levels. We also need to keep the smoke in control. For that, we have put a filter and the carbon particles help achieve higher temperatures in the range of 800-900-degrees Celsius. Corn cobs usually take 90 minutes to turn into charcoal while dry leaves of plants or cotton stalks take less time. Cotton stalks are chopped to 4-5-inch size which helps to input more raw material at any given time. Once the charcoal is ready, the flame is reduced and charcoal blocks are removed from the lower side of the machine,"" Govinda said./Feedback/Govinda started making use of social media to create awareness about his BioChar machine and agri-waste recycling. Elated over the response, Govinda shared that he is receiving calls from across India about the machine and its applications./""One such caller gave me an idea to tweak the design to process paper plates as raw material. Another such variation we are working on is for processing turmeric. The machine flame can be used to heat water required for turmeric processing. This new design of our machine would cost up to Rs.2.5 lakh but it will help farmers get their dry turmeric product in just few hours instead of weeks,"" he said./Govinda said, ""I am often asked by investors if we are going to sell our machines (B2B model) or the products derived from it (B2C or D2C model). In our case, if the customer doesn't understand the charcoal production process, then the model would fail. Hence, we have not gone into it. Instead, we have focussed on the B2B2C model wherein we sell the incense sticks produced at our unit to small shop owners who in turn sell it to the end consumers. Since big shop owners demand credit, we are not targeting them now. We may even give franchises in future. We are receiving a lot of interest from various groups, including farmer self-help groups.""/No ecommerce/Ecommerce business lures everyone, but Govinda has a different take on it. ""Attractive packaging is very expensive and most small businesses fail due to these additional costs. Since there are variety of products, we can't make heavy investments in such activities. With local packaging and unfavourable return policies, small entrepreneurs end up with less margins on products sold through ecommerce websites. Besides, they have to also advertise on those platforms to improve their ranking. Considering all these factors, we have decided to stay away from ecommerce platforms at least in the near term.""/Future plans/Agri Waste Solutions plans to expand its operations and target urban population for its product consumption as well. Govinda said, ""We are a team of four members at present. We are continuously researching about the newer possibilities with our machine design. One such effort is towards building a product which can use the carbon particles to drive pumps used by farmers at their farms.""/Recognition/Cofounder Manisha Sonawane selected in top 6 of 800 women in Maharashtra for MSINs empowering programme of Startup Nexus America/Selected for NSRCEL women startup program at IIMB, a CSE initiative by Kotak Mahindra Bank/Received prestigious Late Pankaj Mahajan Krushi Sadhana Award 2022 by Krushi Vigyan Kendra, Pal at the hands of MLA Shirish Madhukarrao Chaudhari for introducing best practices in waste management technologies at grassroots level./Socio-economic impact/Generated employment for four self-help group women and planning to create more jobs by empowering women/Fight climate change by transforming massive amounts of waste biomass into marketable products around the world./Increase farmers income by creating a market for crop residues./Biochar improves water and fertiliser holding capacity in the soil, which provide essential nutrients to crop and promote plant growth. Prevents soil erosion, air pollution and deforestation/Biochar's low cost, small scale and portable technology can be deployed in remote farms and can convert crop residues into sellable profitable bio-products./Eliminate more than 95 per cent of smoke compared to open biomass burning or biomass induced wildfires./Published by HT Digital Content Services with permission from Hindustan Times. For any query with respect to this article or any other content requirement, please contact Editor at /<a href=""mailto:contentservices@htlive.com"">contentservices@htlive.com</a>"
Reasons your eyeballs feel like they are on fire,"Delhi, Sept. 4 -- Burning eyes are not a pleasant feeling as the sensation can often be accompanied by other symptoms including eye pain, itching, discharge or watery eyes. Burning eyes can have several possible causes, ranging from the simple to the complex and frequently, burning eyes are caused by unavoidable environmental influences, such as strong winds or high pollen counts but similar sensations can be symptoms of a more serious eye problem that requires medical attention./In an interview with HT Lifestyle, Dr Parikshit Gogate, Associate Professor, Department of Ophthalmology at Dr DY Patil Medical College, Hospital and Research Centre, revealed, ""The eye has a natural moisturizing and cleansing mechanism. This gets disturbed when the eyes are used excessively, leading to a condition called as dry eye. It's usually common after people turn 40 or 50 years but is being increasingly seen in younger age group however, the good news is that most of the causes of burning eyes are mild and won't affect your eyes much but if the burning sensation doesn't go away, it could be a serious problem worth the doctor's attention.""/He listed the causes of dry eyes as:/1. Hot and dry weather - It may lead to eye allergies and dry eye syndrome/2. Dusty conditions - The wet layer of tears that coats your eye, your tear film, can become encrusted with tiny, solid particles from smoke, dust, and air pollution./3. Staring at screens for long time - Brightness or glare that reflects from our screens leads to eye strain/4. Air Pollution - Pollutants are a major contributor to dry eyes and eye allergies./5. Dry air in air crafts, places with de-humidifiers/6. Use of anti allergic agents, beta blockers commonly used for heart diseases, hypertension, other medication./7. Rheumatoid arthritis and related conditions./Dr Shazia Shafi, Senior Consultant at Sharp Sight Eye Hospitals, explained, ""Eye allergies, also called ""allergic conjunctivitis,"" occur when irritating substances get into the eye. Also, your eyes may burn due to many different reasons including the weather, allergens, and even diseases."" She shared that some of the most common causes of the eye allergies include:/1. Blepharitis - Blepharitis is an eye condition in which the eyelids get inflamed or infected as a result of irritants, bacteria, or even parasites. With this condition, your eyelids will be swollen with the eyes being dry and itchy and with a burning feeling. The base of the eyes will have some greasy discharge in the form of oily flakes./2. Dry eye - Dry eye disease is an eye condition that occurs when your tears aren't able to provide adequate lubrication for your eyes. It occurs also when your eyes do not make the right type of tears or tear film./3. Allergies - Eye allergies that can trigger eye burns include pollen, mites, smoke, and dust. Besides eye discomfort, you may also experience other allergy symptoms such as sneezing, runny nose, watery eyes, cough, and a sore throat./4. Snow blindness - Overexposure to ultraviolet (UV) rays from the sun may cause sunburn to your eyes. It may also lead to eye burns, redness, sensitivity to light, headaches, blurred vision, and temporary vision loss./5. Ocular rosacea - Ocular rosacea is a common condition that causes inflammation around the eyes, and eye burning, itching, and redness. A blocked eyelid gland or eyelash mites can lead to Ocular rosacea. This condition can occur in people with rosacea of the skin, and in those who do not./6. Conjunctivitis - Conjunctivitis is an inflammation of the conjunctiva, the thin layer of clear tissue covering the white part of the eye. This disease is generally caused by a viral or bacterial infection./7. Eye fatigue - If your eyes burn after looking at a digital screen, you could be eye strain. Other symptoms which may include are double vision, watery eyes, dry eyes, and sensitivity to light./Even if none of these additional symptoms occur, you should contact your eye doctor if your eyes continue to burn for more than a few days. If you feel like your eyes are generating heat which leads to discomfort, frequent blinking, rubbing of eyes or blurred vision, do visit your nearby Ophthalmologist to get immediate help. When diagnosed and treated in time, your eyes will start feeling better and longtime damage can be prevented./Published by HT Digital Content Services with permission from Hindustan Times. For any query with respect to this article or any other content requirement, please contact Editor at /<a href=""mailto:contentservices@htlive.com"">contentservices@htlive.com</a>"
"Delhi, Punjab may jointly pay incentive for stubble","Chandigarh, Sept. 10 -- The governments of Punjab and Delhi are working on finalising a monetary incentive for farmers if they do not burn their paddy residue after harvesting, a top official said on Friday, after the Union government turned down their request to chip in with funds./As a result of the Centre's decision, the incentive, which was initially set at Rs.2,500 per acre, is likely to come down to Rs.1,000 per acre. The scheme will be crucial for attempts to discourage farmers from burning crop residue after harvest, an easy way for them to clear fields but a method that sends up clouds of smoke that trigger the world's worst air pollution crisis in much of North India./""We had sought a support of Rs.1,125 crore from the Union government in the total outlay of Rs.1,875 crore while Rs.375 crore each was to be contributed by Punjab and Delhi governments. Now, we have received a communication from the ministry of agriculture that our proposal has been rejected,"" said Punjab chief secretary VK Janjua./The chief secretary added that the states are still trying to work out the incentive, which could be now come down to Rs.1,000 per acre. The Punjab government has kept an allocation of Rs.200 crore in its budget this year to check stubble burning./HT reported in July that the two state government - both now controlled by the Aam Aadmi Party (AAP) -- had written to the Centre seeking for it to chip in with Rs.1,500 per acre as incentive to help end farm fires./The Union agriculture ministry did not immediately respond to requests for a comment on Friday./Officials in the Delhi government too did not share details on how they planned to incentivise farmers to not burn the residue./But officials, who asked not to be named, said they have already begun preparations to spray a bio-decomposer solution free of cost across Basmati and non-Basmati fields in Delhi. The solution, developed by the Indian Agricultural Research Institute (IARI) in Pusa, decomposes paddy straw naturally within 15-30 days, thereby removing the need for it to be burnt./Delhi's environment and development minister Gopal Rai had on Thursday chaired a review meeting to assess preparation for the same, with the agriculture department had asked to get farmers in Delhi to fill a form at the earliest to identify fields that need to be sprayed./Stubble burning and finding a solution to it is one of the 15-key-focus areas identified by the Delhi government, based on which it will be preparing its winter action plan for air pollution./But the most pressing issue appears to be convincing farmers in Punjab to give up the practice./During the kharif season, paddy is sown over close to three million hectares in Punjab. The state produces roughly 18.5 million tonne of paddy crop residue every year. Of this, 49% is managed in-situ (mixing the residue in the soil) and ex-situ (used as fuel) methods, while the rest is set ablaze./Most farmers burn the residue because it is a quick and cheap way to clear the fields for the sowing of rabi season wheat crop, for which the window is often very short./The result is that Delhi and its surrounding areas report hazardous levels of air pollution./An official in Punjab's agriculture department, who was part of the meetings with central officials, said: ""The agriculture ministry has rejected our proposal citing that Rs.275 crore have already been sanctioned for supplying subsidised machines for in-situ management of paddy straw"". With the allocated funds, 32,100 more subsidised machines will be supplied to the farmers./In the past four seasons, at least 90,000 machines have been supplied to farmers in Punjab, with the Centre releasing Rs.269 crore, Rs.273 crore, Rs.272 crore and Rs.331 crore in 2018, 2019, 2020 and 2021, respectively./The previous Congress government in the state had sought Rs.100 per quintal as incentive from the Centre to check stubble burning in 2019./All these grants, however, have failed to bring down the raging farm fires./Janjua added that in the upcoming kharif harvest the focus would be on optimum use of machines for in-situ management of paddy stubble. ""We will make sure all machines are put to best use and arrangements are being made to tack these machines by a GPS system,"" he said./""I have no hope from any government. The Centre has backtracked and very soon, the Punjab and Delhi governments will also put a lid on the scheme,"" said Bharatiya Kisan Union president Balbir Singh Rajewal./(With inputs from HTC in Delhi)/Published by HT Digital Content Services with permission from Hindustan Times. For any query with respect to this article or any other content requirement, please contact Editor at /<a href=""mailto:contentservices@htlive.com"">contentservices@htlive.com</a>"
"delhi and punjab may jointly pay Rs.1,000 per acre as stubble incentive","Chandigarh, Sept. 10 -- The governments of Punjab and Delhi are working on finalising a monetary incentive for farmers if they do not burn their paddy residue after harvesting, a top official said on Friday, after the Union government turned down their request to chip in with funds. As a result of the Centre's decision, the incentive, which was initially set at Rs.2,500 per acre, is likely to come down to Rs.1,000 per acre. The scheme will be crucial for attempts to discourage farmers from burning crop residue after harvest that sends up clouds of smoke which trigger the world's worst air pollution crisis in much of north India.P8/Published by HT Digital Content Services with permission from Hindustan Times. For any query with respect to this article or any other content requirement, please contact Editor at /<a href=""mailto:contentservices@htlive.com"">contentservices@htlive.com</a>"
