headline,body
'Shot of smoke for Delhi': Nasa photo shows how farm fires added to pollution,"India, Nov. 19 -- American space agency Nasa has shared images of farm fires, which have led to spike in the levels of air pollution in Delhi. The image depicts hotpots with small red dots. The entire area around the national capital is seen with high levels of air pollution./The images were taken by Visible Infrared Imaging Radiometer Suite (VIIRS) on the Suomi NPP satellite on November 11, Nasa informed on its blog./""Looking at the size of the plume on November 11 and the population density in this area, I would say that a conservative estimate is that at least 22 million people were affected by smoke on this one day,"" said Pawan Gupta, a Universities Space Research Association (USRA) scientist at Nasa's Marshall Space Flight Centre./It further said that fires in northern Pakistan could also have contributed some of the smoke./Delhi's air quality continues to remain in the 'very poor' category for the sixth consecutive day on Friday, according to the System of Air Quality & Weather Forecasting & Research (SAFAR)./However, the overall Air Quality Index reduced from 362 on Thursday to 332 today./According to the SAFAR bulletin, Delhi's AQI will remain the same for the next two days./An AQI between zero and 50 is considered 'good', 51 and 100 'satisfactory', 101 and 200 'moderate', 201 and 300 'poor', 301 and 400 'very poor', and 401 and 500 'severe'./The entry of trucks in Delhi except those carrying essential commodities has been stopped till November 21./Published by HT Digital Content Services with permission from Hindustan Times. For any query with respect to this article or any other content requirement, please contact Editor at /<a href=""mailto:contentservices@htlive.com"">contentservices@htlive.com</a>"
Delhi air may improve as wind speed picks up: IMD,"India, Nov. 20 -- After nearly 20 days of breathing hazardous air this month, Delhi's air quality is set to improve marginally from November 21, India Meteorological Department (IMD) scientists said Friday./Central Pollution Control Board (CPCB) data shows that Delhi's overall Air Quality Index (AQI) reading on Friday was 380, categorised as ""very poor"". While this was a few points higher than Thursday's 347, also considered ""very poor"" on CPCB's AQI scale, forecasters said they expect wind speed to improve from Sunday, facilitating the dispersion of pollutants./An AQI reading between 201 and 300 is considered ""poor"", 301 and 400 ""very poor"", and 401 and 500 ""severe""./""While the winds will continue to blow from the northwest, the speed will pick up and this will help disperse the accumulated pollutants. We are hoping that after November 21, the AQI will come down to the 'poor' range,"" said VK Soni, head of IMD's environment and research centre./Soni explained that another factor for the improvement of air quality during the weekend is the reduction in the stubble fire count in the neighbouring states of Punjab and Haryana./Union ministry of earth science' air quality monitoring centre, System of Air Quality and Weather Forecasting and Research (Safar), said that on Friday, 1,077 fires were recorded in both the states, which contributed to 3% of the Capital's PM2.5 (ultrafine particulate matter with diameter less than 2.5 micrometres) levels. According to experts, PM2.5 is the dominant pollutant in the region./Meanwhile, the temperature in Delhi remained in the normal range. Forecasters said that while the city usually sees at least three or four western disturbances in the month of November, this year it has not experienced an active western disturbance since October 24./A western disturbance refers to an area of ""disturbed"" or reduced air pressure, moving from the west to the east, carrying with it moisture associated with rainfall, snowfall and fog in northern India./On Friday, the maximum temperature recorded at the Safdarjung weather station, which is the official marker for the city, was 25.9 degrees Celsius, two degrees below normal for this time of the year. The minimum temperature was 10.9 degrees Celsius, a notch below normal./""If we experience a western disturbance, the temperature will see a drastic drop,"" said Mahesh Palawat, vice-president (meteorology and climate change), Skymet Weather Services./River of smoke/On Friday, American space agency Nasa on Friday shared several satellite images (that were taken on November 11) of farm fires-- which have led to a spike in the levels of air pollution in Delhi -- spreading all the way across the Indo-Gangetic plains as a thick plume of smoke. In the images, the Capital is almost completely shrouded by the smoke, which continues well beyond Agra, with Nasa indicating this is likely to have affected over 22 million people in a single day./The images were taken by Visible Infrared Imaging Radiometer Suite (VIIRS) on the Suomi NPP satellite on November 11, Nasa informed on its blog./""Looking at the size of the plume on November 11 and the population density in this area, I would say that a conservative estimate is that at least 22 million people were affected by smoke on this one day,"" said Pawan Gupta, a Universities Space Research Association (USRA) scientist at Nasa's Marshall Space Flight Center./Delhi's air quality was in the ""severe"" category on November 11, with AQI of 411, with the government forecasting body Safar pegging the share of farm fire contribution to Delhi's PM 2.5 to be 26% that day./According to Safar, while the contribution from farm fires has reduced, the local wind speed is calm, thereby trapping pollutants. ""Local surface winds are low at the moment with moderate ventilation of near surface pollutants. From Sunday onwards, surface winds are likely to be strong resulting in effective dispersion that improves air quality,"" it said./In the blog, Nasa scientists said while lingering monsoon rain kept fire activity low for a few weeks longer than usual, elevated fire activity was observed in November. They added that fires in northern Pakistan also likely contributed to some of the smoke on November 11./According to experts, meteorological conditions and other factors can also contribute to hazy skies, with dust from the Thar desert contributing to the haze on November 12, 2021, a separate image shared by the space agency showed./Hiren Jethva, an USRA scientist based at Nasa's Goddard Space Flight Center, who uses measures of ""greenness,"" or Normalized Difference Vegetation Index (NDVI) to anticipate fire activity each year, said this summer has seen one of the largest NDVI values in the last 20 years, based on which he had predicted this season to record a fairly high fire count. The data he uses comes from the Moderate Resolution Imaging Spectroradiometer (MODIS) on Nasa's Aqua satellite./""I had predicted this would be one of the most active fire seasons on record, and that is exactly what we have seen,"" said Jethva. ""We still have a few weeks of burning to go, but already Aqua MODIS has detected more than 17,000 hotspots in Punjab and Haryana-making this the most active fire season on record.""/Data from the last decade shows stubble burning is generally at its most active between October 15 and November 15, with a drop in activity seen from the third week of November onwards. LS Kurinji, Programme Associate at the Council on Energy, Environment and Water (CEEW), says after a late spike in the number of farm fires this year, numbers have started dropping again with less than 1,000 fire counts recorded in the last two days./""Previously, scientific reports indicated that it takes 14-22 hours for smoke from Punjab and Haryana to reach Delhi under favourable meteorological conditions. Data from Safar indicates that on days when winds blew from the northwest, the contribution of stubble burning to Delhi's PM2.5 level was in the range of 20-50% this year,"" she explained./Published by HT Digital Content Services with permission from Hindustan Times. For any query with respect to this article or any other content requirement, please contact Editor at /<a href=""mailto:contentservices@htlive.com"">contentservices@htlive.com</a>"
Men's style and grooming by Yatan Ahluwalia: Stay protected,"India, Nov. 20 -- Decoding the lead look/Hair: Short and faded on the sides, longer in the centre and top. Textured and swept onto one side./Brows: Well-shaped and defined./Face: Clean shaved with a four-hour stubble./Lips: Clean, wet, and luscious./Body: Very well-defined abs, bulky arms. Moisturised body to keep it smooth, soft, and supple./Others: Cut sleeve, thin, light, and warm vest jacket from Uniqlo, fitted sports lowers./The Problems/Pollution takes away all the natural oil and oxygen from your skin, hair and scalp. A layer of dust and toxins gets formed over the skin which congests and blocks the pores leading to skin breakouts and making the skin tone dull, and the surface look dry./Chemical pollutants disrupt the normal balances of the skin and scalp, leading to problems like dryness, sensitivity, rashes, acne, irritation or allergic reactions./Air pollution leads to premature greying of hair, dry scalp and the build-up of pollution on the scalp, which can lead to hair follicle damage, causing issues such as dandruff and irritation, and consequently lead to hair loss. Toxic air can enter our blood stream and obstruct hair growth. It also makes the scalp become inflamed and your hair to become brittle./The solutions/Hair/Oil up: Pay special attention to your hair. Restore the hairs moisture levels, which gets depleted. Oil your hair more often. Normally once a week is must, but in these conditions twice or even thrice is better./Shampoo daily: Continue to follow your regular shampooing regime. Ideally shampoo your hair every day, just before bedtime so your hair and scalp can breathe and stays clean while you sleep./Use a conditioner: Toxic and cold air can result in unwanted hair fall. It is therefore important to indulge in some deep conditioning treatments that add moisture to the hair, especially if you have hair with a very rough or dry texture. Use an effective conditioner after your shampoo. Remember, both the shampoo and conditioner must always be of the same brand./Prevention is better than cure:/1.Applying a light hair oil daily, especially if you are stepping out will coat your hair and scalp and can be washed off at when you are back indoors./2.Wearing a cap or bandana outdoor will protect your hair. Ensure this covers your hair and head all around. For the sake of good hygiene, change your headgear daily./Skin/Surface cleaning: Us a natural face wash twice or thrice daily. Apply an alcohol-free toner or pure rose water to clean the build-up of toxins, pollution, and excessive oil on the skin. Use a minimum of thrice a week, if not daily. Scrub once weekly to exfoliate and remove dead, dry and flaky skin. All three regimes need to be done and one does not substitute the need for doing the other./Deep pore cleaning: Apply a mud or clay-based face masque twice a week. Make a smooth paste, using water and spread out evenly on the face and neck. Allow the mask to dry and work into the skin for about fifteen minutes, then rinse well. Masks have the inherent quality to go into the pores of the skin and perform an effective deep cleaning action, which not only prevents the accumulation of pollutants but also makes you look fresher./Make your lips more kissable: Chap stick and lip balm are essential for men, both for protecting your lips from harsh winter winds and the effects of smoking and toxic air. Biting and licking your lips only makes them worse. Use only at night and never during the day./Body: Don't expose the skin to very hot water, as this will further deplete the skin of its natural oil and moisture. A warm shower should suffice. Ensure to use an effective and heavy-duty body lotion or moisturiser generously all over the body. This will leave your skin feeling smooth to touch. It will also coat your skin and prevent pollution and toxins in the air from getting absorbed into it./Hydrate: To prevent dry or flaky skin, you need to moisturise and nourish your skin. As they can attract dust, dirt particles and soak up the sun, moisturisers should as a rule, always be used on a clean face at night. As cold winds can make the skin look weather beaten, ensure to keep your skin well hydrated./Quick fixes:/1.Keep Washing: Make sure to wash the surface dirt from your face as often in a day as possible./2.Cover up: Try and limit your skins exposure to the environment. Embrace long sleeve tops, turtlenecks, full length lowers and a wide face mask to cover as much of your face as possible./Ten Products to Use/1.The hot + cool air purifier by Dyson/This is by far the most powerful and stylish air purifier available. It has an inbuilt heater which will effectively warm the room but will not dry or deplete the natural moisture levels of your skin and hair, like other conventional forms of heating do. Clean air isn't a luxury, but an essential and this effective purifier delivers just that by capturing 99.95% of pollutants, dust, allergens and even viruses. My recommendation as the best solution to ensure minimum exposure to the harmful effects of toxins in your immediate surroundings. Ideal not just for your lungs, but also your skin and hair./2.Face masks by Kayos/The Gold mask contains 24k gold with silk amino acids, collagen and vitamin E to reduce appearance of blackheads. The detoxifying dead sea mud mask helps you exfoliate and detoxify dead skin. The Himalayan scrub, made with Himalayan salt, removes dead skin cells, excess dirt, oils, and other impurities from the surface of your skin. It draws out unwanted toxins, dirt, pollution, and bacteria from your pores. The range is suitable for all skin types./3.The Kumkumadi Thailam by Ozone Signature/This incredible night serum contains organic and natural herbs and should be used daily before bed on clean skin. The ancient and time-tested Ayurvedic formulation contains saffron and reduces pigmentation, dark spots and reduces the size of the pores, thus blocking exposure to pollutants. Ideal for skin that is weather beaten, dry, or damaged. Extremely effective for men over 30./4.Essential oils by Atulya Herbals/The power and benefits of aromatherapy are good not just for your mind but also your skin, hair, and body. Sandalwood has a moisturising effect and improves texture and skin tone. Lavender manages acne and inflammation, Jasmine nourishes hair, Tea Tree Oil is anti-bacterial and reduces blemishes and skin rashes while Rose protects from infections and fades away scars. The range pure and natural. Use directly or mix with any base oil. For other wellness benefits, add a few drops to water in a diffuser./5.Derma roller by The Man Company/Activate your scalp or beard with this safe to use Derma Roller. This hand-held device is designed with a titanium finish. It creates micro-punctures on the surface of your hair and beard to bring sleeping follicles back to life. The micro needles penetrate deep enough to boost growth, increase blood circulation and supply collagen to efficiently improve hair health. Use with caution twice weekly. Helps deal with patchiness, slow hair growth and hair fall troubles./6.Rose water by The Natural Wash/This pure rose water has been extracted by steam distillation. It is multi-purpose as it can be used as a natural face toner or facial mist. Helps remove dust, pollution, toxins and build-up of oil from the skins surface. Soothes the skin and calms acne and blemishes. Suitable for all skin types./7.The plant based range by Arata/The shampoo soothes the hair while the body wash cleans pollutants and toxins. The body lotion infuses the skin with shea, cocoa, mango and kokum butter. The Hempocado (Hemp & Avocado) oil is formulated to nourish dry and damaged hair, while strengthening your roots, and stimulating growth. The Green Tea face serum is a light, antioxidant-rich serum that enhances your skin's elasticity, boosts vitamins A, C, and E, and prevents oxidative damage. The entire product range is plant based, vegan and makes use of all-natural extracts with no chemical additives, dyes or preservatives. The products smell good and leave your hair and skin feeling even better./8.Body Butters by The Body Shop/This range of intensely creamy vegan body butters leave dry skin feeling softer, smoother and intensely nourished with a 96 hour moisture lock in period. The butters are absorbed easily into the skin and don't feel greasy or sticky thereafter. Available in an assortments of variants but my picks are the Shea Butter or Argan Oil formulations. Use after a shower or just before bedtime./9.The bath set by Kimirca/This set is infused in the notes of Jasmine and Gardenia. Contains Ginkgo Biloba and White Tea Extract which has anti-inflammatory and antibacterial properties, promotes healthy youthful skin and helps improve skin elasticity. Aloe vera prevents dry flaky skin and keeps the texture healthy and soft and Vitamin E that has anti oxidizing properties, deeply hydrates and moisturizes the skin and makes it supple. Suitable for all skin types. Use daily. Both products smell and feel divine./10.The head-to-toe care combo from The Ayurveda Experience/This nine-product combo includes a face mask for cleansing and glow, a soap-free face wash that keeps the skin oil and dirt free without stripping it of moisture, a potent hair oil that controls hair fall, repairs damage, and promotes shine, an aromatic Ayurvedic body oil and an Ayurvedic bath salt that gently purifies, exfoliates, and hydrates the skin all at once. This Ayurvedic self-care combo brings the wisdom of ancient Ayurveda in a modern form and is suited for all age groups./The author is an image, style and grooming consultant and trainer./From HT Brunch, November 21, 2021/Follow us on twitter.com/HTBrunch/Connect with us on facebook.com/hindustantimesbrunch/Published by HT Digital Content Services with permission from Hindustan Times. For any query with respect to this article or any other content requirement, please contact Editor at /<a href=""mailto:contentservices@htlive.com"">contentservices@htlive.com</a>"
Prioritise your pulmonary health,"India, Nov. 21 -- Diwali revelry coupled with the onset of winters spells trouble for city dwellers. Every year, the air pollution levels, especially in Delhi, the National Capital Region (NCR) and other large cities, plummet to hazardous levels owing to bursting of firecrackers, crop burning, and vehicular pollution./The lungs are one of the most important organs that get affected by their/exposure to environmental agents. ""With winter conditions setting in, the dust and particulate material from vehicular pollution and smoke from crackers have caused smog-like conditions. We have seen a significant spike in people reporting respiratory problems in such weather and environmental conditions. Common complaints include cough and breathlessness,"" says Dr Shuchin Bajaj, Founder Director, Ujala Cygnus Group of Hospitals./Factors affecting lung health/Air pollution definitely interferes with lung defences, thus resulting in the development of pulmonary diseases, such as exacerbation of chronic obstructive pulmonary disease, allergies and asthma./""With the winter setting in and Diwali season , we have seen an appreciable reduction in the temperature and increase in the ambient pollution level. These pollutants essentially when inhaled by the person cause respiratory symptoms such as increased cough, breathlessness, sputum production and wheezing,"" opines Dr. Arunesh Kumar, Senior Consultant & Head of Department of pulmonology at Paras hospital , Gurgaon./""People who have a history of respiratory disease such as asthma, COPD, interstitial lung disease, notice that their symptoms start deteriorating,"" he adds./""Spending a few minutes in such air may cause conjunctivitis, shortness of breath along with headache, sleepiness and reduced alertness, nausea, vomiting and abdominal pain,"" says Dr Akshay Budharaja, Pulmonologist, Aakash Healthcare./Importance of Respiratory Health/Lungs are important. Period. They help us breathe and are necessary to sustain life on earth. Each cell in the body needs oxygen to live and survive./""Our respiratory system assists our bodies in absorbing oxygen from the air so that our organs can function properly. It is critical because it removes waste gases such as carbon dioxide from our blood, provides protection to our airways from harmful substances, delivers oxygen to our cells, and most importantly helps us in the inhaling and exhaling process,"" says Nevin Kishore Head of Bronchology & Senior Consultant - Respiratory Medicine Max Hospital, Gurugram/Ways to improve lung health/It is imperative to take care of your lungs at this moment in time. ""Breathing exercises, yoga, Pranayam, swimming and all other exercises which can improve your lung function and are beneficial for lung health,"" says Dr Kishore./""Avoid early morning and late evening walks as concentration of pollutants is highest during this period. Schools should avoid outdoor assemblies, sports activities and other physical activities in the early morning hours,"" suggests Dr Budharaja/Prioritize cleaning of rooms used for sleeping and use air purifiers, and seal windows to prevent outdoor pollutants coming inside. Use plants like Aloe Vera and Ivy inside the home for purifying the air./""Do not smoke to prevent aggravated lung diseases - inhaling polluted air is equivalent to smoking 50 cigarettes a day,"" says Dr Budharaja/Avoid driving personal cars, scooters and other motorized vehicles and opt for shared rides or public transportation to work. This will prevent adding to the existing high levels of pollution./""Mask is very important during this time because it will give you dual protection against COVID virus as well as pollutants. Keep your doors and windows closed during extreme pollution levels,"" shares Dr Kumar./Following a nutrient-rich diet, can help protect your lungs and even reduce lung damage. Include beets and beet greens, peppers, apples, pumpkin, turmeric, red cabbage, barley and lentils in your diet./Published by HT Digital Content Services with permission from Hindustan Times. For any query with respect to this article or any other content requirement, please contact Editor at /<a href=""mailto:contentservices@htlive.com"">contentservices@htlive.com</a>"
"Delhi's air quality in 'very poor' category, in some areas it's 'severe'","New Delhi, Nov. 21 -- Delhi's overall air quality continued to remain in the ""very poor"" category even as several areas of the national capital registered severe Air Quality Index (AQI), which affects healthy people and seriously impacts those with existing diseases. According to the Central Pollution Control Board (CPCB), AQI in Anand Vihar, Jahangirpuri, Mundka, RK Puram, Rohini and Vivek Vihar was 401 and 500, which is categorised as ""severe""./Authorities have forecast that AQI in Delhi is likely to improve significantly from Sunday owing to relatively strong winds./On Saturday morning, the AQI in the national capital was recorded at 377 in the morning and 374 in the evening-slightly better on Friday at 370-according to the CPCB. The AQI in the Capital's neighbouring areas of Ghaziabad (346), Gurgaon (348), Noida (357), Greater Noida (320) and Faridabad (347) was also recorded in the ""very poor"" category./An AQI between zero and 50 is considered ""good"", 51 and 100 ""satisfactory"", 101 and 200 ""moderate"", 201 and 300 ""poor"", 301 and 400 ""very poor"", and 401 and 500 ""severe""./In yet another measure to control the rising air pollution, the Delhi Disaster Management Authority (DDMA) has allowed commuters to stand and travel on Metro trains and buses to let more people use the city's public transport systems instead of private vehicles./The DDMA said in its order that 30 standing passengers will be allowed in each Metro train coach. The maximum number of passengers allowed to travel standing will be 50 per cent of the seating capacity in Delhi Transport Corporation (DTC) and Cluster buses, it added./Metro trains and buses in Delhi were, so far, allowed to run only with full seating capacity to reduce crowding to check the spread of Covid-19./To control air pollution, the Delhi government has also announced a ban on the entry of trucks carrying non-essential items into the city and the closure of schools and colleges till further orders./The government has also ordered that all its employees with work from home for the government departments and construction and demolition work has been banned till November 21./Published by HT Digital Content Services with permission from Hindustan Times. For any query with respect to this article or any other content requirement, please contact Editor at /<a href=""mailto:contentservices@htlive.com"">contentservices@htlive.com</a>"
