headline,body
HSPCB demands action report in four days,"Gurgaon, Nov. 8 -- Nothing wakes up state agencies like an emergency, and so it was on Tuesday when the Haryana State Pollution Control Board (HSPCB) told all departments and authorities concerned to submit within four days a report on action taken./""On Tuesday, we asked all civic bodies to submit within four days what action they have taken so far to combat air pollution in the city. Once we receive the plan, we will review it and further action plan will be framed out of it,"" JB Sharma, regional officer, HSPCB, said./City's air quality has been deteriorating since Diwali. On October 11, the Environment Pollution (Prevention and Control) Authority (EPCA) had asked all stakeholders to implement a graded response action plan (GRAP) in all districts of NCR to combat air pollution./On October 31, again, the HSPCB had told the Municipal Corporation of Gurgaon (MCG), Haryana Urban Development Authority (HUDA), resident welfare associations (RWAS), traffic police to submit the details of action taken by the authorities./The MCG and NHAI sprinkled water at on-going road project sites and covered them with cloth to keep construction dust from flying. The civic body and state pollution control board also formed teams that checked garbage burning in neighbourhoods, and clamped down on polluting industries and factories./Despite these measures the city's air quality has been worsened in the past few days. The air quality index (AQI) recorded by Central Pollution Control Board (CPCB) jumped to 368 on Tuesday against 331 on Monday./Experts attribute the worsening air quality to low wind speed of 0.66 m/s, dip in temperature and stubble burning across Delhi-ncr. The smog create by stubble burning in neighbouring Punjab resulted in the death of four people in a road accident on Monday./Experts were of opinion that the condition of air quality can improve only if the government and residents work together to bring in changes./""The smoke from waste burning and diesel generators mix with fog to make the air toxic. The wind flow is low and is adding to the problem,"" Shakti Singh, environmental engineer at HSPCB, said./Nagarro CEO Manas Fuloria, who is also chairperson of NASSCOM'S regional council for Haryana, said, ""The diesel autos and gen-sets should be banned in Gurgaon.""/Published by HT Digital Content Services with permission from HT Gurgaon. For any query with respect to this article or any other content requirement, please contact Editor at /<a href=""mailto:content.services@htlive.com"">content.services@htlive.com</a>"
"Delhi air pollution Live: Schools closed till Sunday, Arvind Kejriwal writes to CMs of Punjab, Haryana","India, Nov. 8 -- Delhi shut all primary schools on Wednesday as pollution hit 70 times the World Health Organisation's safe level, prompting doctors in the capital city to warn of a public health emergency./Dense grey smog shrouded the roads of the world's most polluted capital, where many pedestrians and bikers wore masks or covered their mouths with handkerchiefs and scarves./15:27pm: Doctors on Wednesday issued a health advisory asking people to avoid outdoor activities like jogging and cycling as high levels of air pollution in Delhi and NCR can cause chronic lung and heart diseases and also affect the health of expectant mothers./The smog that has enveloped the region for the past two days can cause allergies or aggravate already existing allergies and decrease lung immunity, according to tips shared by Fortis Healthcare./15:00pm: Earlier in the day, environment minister Harsh Vardhan said in a message on social network Twitter: ""Every possible step required to tackle the situation has been already identified, and the need of the hour is to put them into action.""/Using the hashtag ""#DelhiSmog"", Vardhan urged the state authorities to rein in pollution, even if that meant deploying helicopters to spray jets of water across the capital./1:15pm: ""Delhi's air quality is getting worse. In this situation, there can be no compromise on children's health,"" Delhi deputy chief minister Manish Sisodia tweeted, as his government ordered all schools to be closed till Sunday in view of deteriorating air quality in the Capital./12:54pm: Some 30 trains coming to Delhi and 30 flights landing or taking off from the Delhi airport were delayed, news agency IANS?reported, quoting unnamed officials./The air quality in Delhi and adjoining Noida (Uttar Pradesh) and Gurgaon (Haryana) continued to be alarmingly bad on Wednesday./12:21pm: The US embassy website showed the concentration of PM 2.5 -- the microscopic particles that are the most damaging to health -- topped 700 early on Wednesday morning, 70 times the WHO guidelines on long-term exposure, before dropping slightly./The Indian Medical Association declared a public health emergency, urging administrators to ""curb this menace"", while the Environment Pollution Authority warned that things were set to get worse in the coming days./10:08am: A day after Delhi witnessed its worst 'air quality' and 'smog situation' of the year, CM?Arvind Kejriwal said on Wednesday he wished to meet his Haryana and Punjab counterparts to find a solution to pollution in the National Capital Region./Kejriwal tweeted: ""Am writing letters to CMs of Punjab (Amarinder Singh) and Haryana (Manohar Lal Khattar) requesting them for a meeting to find solutions to crop burning.""/The National Green Tribunal has taken the governments of Delhi, Uttar Pradesh, Punjab and Haryana to task, seeking to know why steps to prevent steps were not taken despite knowing well in advance that such a situation was likely to arise./Here are the highlights of Tuesday:/New Delhi gasped for oxygen on Tuesday as a toxic haze reduced visibility, affected flights and trains, and prompted chief minister Arvind Kejriwal to describe the national capital as a ""gas chamber""./Parking fee was hiked four times in New Delhi and its satellite cities to reduce the use of private cars as vehicle exhaust is considered one of the primary sources of air pollution./Metro was asked to slash fares after peak hours and governments were told to increase the number and frequency of public buses./6:40pm: Stubble burning is the ""main villain"" behind the severe level of pollution in Delhi and the neighbouring areas, the Delhi high court said on Monday, as it asked the AAP government and the neighbouring states what steps they have taken to address the issue./6:10pm: The Indian Medical Association said New Delhi was in the midst of a ""public health emergency"" and appealed to the city government to halt sports and other outdoor activities in schools. The association also said the Delhi Half Marathon, scheduled for November 19, was likely to leave those participating especially badly hit because the air quality is worst during the early part of the day, when the run takes place./6pm:?All primary schools in Delhi will remain closed tomorrow, if needed will extend order till day after, says Manish Sisodia./5.30pm: ""We have declared a state of public health emergency in Delhi since pollution is at an alarming level,"" the head of the Indian Medical Association (IMA) Krishan Kumar Aggarwal told AFP./5pm: All schools in Delhi have suspended outdoor activities and advised parents to ensure their children wear masks./4:16pm: Delhi-NCR governments asked to get ready for odd-even scheme if pollution reaches 'emergency' level./4:15pm: Hike parking fee across Delhi four times to curb pollution: Supreme Court-appointed anti-pollution panel to Delhi government./3:32pm: EPCA also instructs Delhi Metro to lower fares during off-peak hours for at least 10 days, introduce more coaches./3:30pm: Environment body EPCA recommends that parking fees in Delhi-NCR be quadrupled./2:20pm: The Central Industrial Security Force (CISF), a paramilitary force under the Union home ministry, has ordered on Tuesday issuance of over 9,000 face masks for its personnel deployed to guard the IGI Airport, the Delhi Metro and other government ministries and installations in Delhi, according to a PTI report./1:08pm: ""Considering high level of pollution, I have requested Sh Manish Sisodia, Education Minister, to consider closing schools for a few days,"" tweets Delhi CM Arvind Kejriwal/12:50pm: NGT slams Delhi, UP and Haryana governments over bad ambient air quality in the national capital, directs them to explain what preventive steps did they take to deal with the 'emergency situation' prevailing today, reports news agency PTI/12:25pm: Train operations have also been affected with 33 inbound trains delayed by three hours or more./12:20pm: At least 7 flights have been delayed, and one flight from Lucknow has been diverted to Jaipur./12:15pm: MeT officials say runway visibility had dropped to around 400m at 8 am in the morning, but had cleared to around 425-725m at 10:30 am./12:12pm: Delhi CM Kejriwal says Delhi has become a gas chamber for almost a month./12 noon: Delhi chief minister Arvind Kejriwal says Delhi's air pollution is this bad at this time of the year every year./11:50 am: ANI?reports that more than 20 flights were affected at Delhi airport after the runway was closed due to low visibility/11:15am: Indian Medical Association declares Delhi a public health emergency state, ANI?reports. The Association advises schools to be shut and tells people to avoid stepping out into the open/10am: Dense smog on National Highway-9 in Haryana. Long-distance trains from Bathinda to Delhi via Sirsa and Hisar are running late by an hour./Haryana Roadways cancels several early morning long-route buses to avoid accidents./8:50am: Long queues of four wheelers clog Delhi-Noida-Delhi Flyway and Noida-Greater Noida expressway as rush hour begins./8:30am: Visibility in national capital at 200 metres/8am: In Haryana, Fatehabad's district collector orders schools to open one hour later than usual. Schools to now open at 9 am for the next week./Published by HT Digital Content Services with permission from Hindustan Times. For any query with respect to this article or any other content requirement, please contact Editor at /<a href=""mailto:content.services@htlive.com"">content.services@htlive.com</a>"
DELHI GASPS FOR BREATH,"NEW DELHI, Nov. 8 -- The National Capital Region was engulfed in a toxic haze on Tuesday, with the worst pollution levels this season reducing visibility, disrupting flights and trains, and forcing the Delhi government and central authorities to announce a slew of emergency measures to minimise health hazards./A sharp drop in temperature, coupled with low wind speeds aggravated by high relative humidity, sent the average daily air quality index (AQI) to 448 - worse than the post-Diwali haze that had pushed the reading up to 403 for a day on October 20. Relief is not likely soon, the Central Pollution Control Board (CPCB) warned, predicting similar conditions for the next two to three days./Chief minister Arvind Kejriwal described the city as a ""gas chamber"" and his government ordered the closure of all primary schools on Wednesday, while restricting the outdoor activities of senior students. Junior classes will remain closed for longer if the air quality doesn't improve, the government said./The EPCA-a Supreme-court appointed pollution control panel with sweeping powers - announced a fourfold hike in parking fees across NCR, and asked the Metro rail corporation to reduce fares during off-peak hours. It also asked the government to prepare for the odd-even road rationing scheme, which will be implemented if the air quality index breaches the ""severe-plus"" zone of 500 for 48 hours as per the Graded Response Action Plan./When contacted, civic agencies said implementing the increased parking fee hike would require other approvals and may take some time. Metro officials, too, said slashing ticket prices would be difficult as they had to be referred to the fare fixation committee. But EPCA member Sunita Narain contended that the authorities did not have a choice as all orders of the panel are legally binding./The haze that started settling on Monday night brought down visibility to 200m by 5.30am on Tuesday./The CPCB insisted that what Delhi was experiencing was ""fog"", because the sulphur dioxide level in the air was not high enough for it to be classified as ""smog""./""Currently, Delhi and its neighbouring region are seeing almost still conditions at the ground level, but in the upper atmosphere, there are two wind masses - one from Punjab bringing pollutants and the other from eastern UP bringing moisture. These are colliding at higher altitudes, leading to moisture and pollution in the air but no wind at the ground level,"" said A Sudhakar, member secretary, CPCB./The Indian Medical Association (IMA) issued a stern warning on potential health hazards, describing New Delhi as a ""public health emergency state"". This was primarily because the suspended particulate matter in the air was at ""hazardous"" levels through the day across all monitoring stations./In 2016, the air pollution in Delhi was the worst on record, and the city had experienced its thickest smog in 17 years, with the average AQI hitting a peak of 497./Published by HT Digital Content Services with permission from Hindustan Times. For any query with respect to this article or any other content requirement, please contact Editor at /<a href=""mailto:content.services@htlive.com"">content.services@htlive.com</a>"
"Delhi air pollution LIVE: Emergency conditions in city, decision on odd-even tomorrow","India, Nov. 8 -- Delhi shut all primary schools on Wednesday as pollution hit 70 times the World Health Organisation's safe level, prompting doctors in the capital city to warn of a public health emergency./Dense grey smog shrouded the roads of the world's most polluted capital, where many pedestrians and bikers wore masks or covered their mouths with handkerchiefs and scarves./Here are Wednesday's live updates:/7:24pm: Supreme Court-appointed EPCA announces 'severe plus', or emergency, conditions in Delhi. It wants ban on civil construction and demolition activities, reports news agency PTI. The panel also banned the entry of trucks, except those carrying essential commodities, banned in the capital city. The panel said a decision on bringing back the odd-even scheme will be taken on Thursday./18:42pm: The Central Pollution Control Board and a Supreme Court-appointed environment body have recommended ""free of cost public transport"" in Delhi for the next few days as the region faces a ""pollution emergency""./The final decision to make bus and Metro rides free will come from the Delhi's lieutenant governor Anil Baijal, who is likely to hold an emergency meeting with environment authorities, officials said./The CPCB, which held an emergency task force meeting, told IANS that a ""pollution-clock"" was being updated on its portal to monitor the situation closely and impose a ""pollution emergency"" if PM2.5 remained at the current levels./Earlier, the apex court-appointed Environment Pollution Prevention and Control Authority barred the entry of trucks to Delhi and levied a parking fee four times the normal rates./17:56pm:/17:41pm: The National Green Tribunal lashed out at the Delhi government and the Central Pollution Control Board for not issuing orders to shut down construction and industrial activities in the capital despite the worsening air quality./It also ordered Punjab, UP and Haryana governments to spell out the steps have they taken to prevent crop burning in the states adjacent to the national capital./The green panel directed the Delhi Pollution Control Committee to collect ambient air quality samples from different parts of the city and submit an analysis containing details of different pollutants, including particulate matter (PM) 2.5 and 10./16:57pm: In his letter to Haryana and Punjab chief ministers --- Manohar Lal Khattar and Amarinder Singh --- Delhi CM?Arvind Kejriwal says the governments have ""failed to provide economically viable alternatives to stubble-burning"", reports news agency IANS./16:56pm: Major city hospitals witnessed a surge in the number of patients complaining of respiratory problems with doctors saying some may develop life-threatening conditions, reports news agency PTI./15:27pm: Doctors issued a health advisory asking people to avoid outdoor activities like jogging and cycling as high levels of air pollution in Delhi and NCR can cause chronic lung and heart diseases and also affect the health of expectant mothers./The smog that has enveloped the region for the past two days can cause allergies or aggravate already existing allergies and decrease lung immunity, according to tips shared by Fortis Healthcare./15:00pm: Earlier in the day, environment minister Harsh Vardhan said in a message on social network Twitter: ""Every possible step required to tackle the situation has been already identified, and the need of the hour is to put them into action.""/Using the hashtag ""#DelhiSmog"", Vardhan urged the state authorities to rein in pollution, even if that meant deploying helicopters to spray jets of water across the capital./1:15pm: ""Delhi's air quality is getting worse. In this situation, there can be no compromise on children's health,"" Delhi deputy chief minister Manish Sisodia tweeted, as his government ordered all schools to be closed till Sunday in view of deteriorating air quality in the Capital./12:54pm: Some 30 trains coming to Delhi and 30 flights landing or taking off from the Delhi airport were delayed, news agency IANS?reported, quoting unnamed officials./The air quality in Delhi and adjoining Noida (Uttar Pradesh) and Gurgaon (Haryana) continued to be alarmingly bad on Wednesday./12:21pm: The US embassy website showed the concentration of PM 2.5 -- the microscopic particles that are the most damaging to health -- topped 700 early on Wednesday morning, 70 times the WHO guidelines on long-term exposure, before dropping slightly./The Indian Medical Association declared a public health emergency, urging administrators to ""curb this menace"", while the Environment Pollution Authority warned that things were set to get worse in the coming days./10:08am: A day after Delhi witnessed its worst 'air quality' and 'smog situation' of the year, CM?Arvind Kejriwal said on Wednesday he wished to meet his Haryana and Punjab counterparts to find a solution to pollution in the National Capital Region./Kejriwal tweeted: ""Am writing letters to CMs of Punjab (Amarinder Singh) and Haryana (Manohar Lal Khattar) requesting them for a meeting to find solutions to crop burning.""/The National Green Tribunal has taken the governments of Delhi, Uttar Pradesh, Punjab and Haryana to task, seeking to know why steps to prevent steps were not taken despite knowing well in advance that such a situation was likely to arise./Here are the highlights of Tuesday:/New Delhi gasped for oxygen on Tuesday as a toxic haze reduced visibility, affected flights and trains, and prompted chief minister Arvind Kejriwal to describe the national capital as a ""gas chamber""./Parking fee was hiked four times in New Delhi and its satellite cities to reduce the use of private cars as vehicle exhaust is considered one of the primary sources of air pollution./Metro was asked to slash fares after peak hours and governments were told to increase the number and frequency of public buses./6:40pm: Stubble burning is the ""main villain"" behind the severe level of pollution in Delhi and the neighbouring areas, the Delhi high court said on Monday, as it asked the AAP government and the neighbouring states what steps they have taken to address the issue./6:10pm: The Indian Medical Association said New Delhi was in the midst of a ""public health emergency"" and appealed to the city government to halt sports and other outdoor activities in schools. The association also said the Delhi Half Marathon, scheduled for November 19, was likely to leave those participating especially badly hit because the air quality is worst during the early part of the day, when the run takes place./6pm:?All primary schools in Delhi will remain closed tomorrow, if needed will extend order till day after, says Manish Sisodia./5.30pm: ""We have declared a state of public health emergency in Delhi since pollution is at an alarming level,"" the head of the Indian Medical Association (IMA) Krishan Kumar Aggarwal told AFP./5pm: All schools in Delhi have suspended outdoor activities and advised parents to ensure their children wear masks./4:16pm: Delhi-NCR governments asked to get ready for odd-even scheme if pollution reaches 'emergency' level./4:15pm: Hike parking fee across Delhi four times to curb pollution: Supreme Court-appointed anti-pollution panel to Delhi government./3:32pm: EPCA also instructs Delhi Metro to lower fares during off-peak hours for at least 10 days, introduce more coaches./3:30pm: Environment body EPCA recommends that parking fees in Delhi-NCR be quadrupled./2:20pm: The Central Industrial Security Force (CISF), a paramilitary force under the Union home ministry, has ordered on Tuesday issuance of over 9,000 face masks for its personnel deployed to guard the IGI Airport, the Delhi Metro and other government ministries and installations in Delhi, according to a PTI report./1:08pm: ""Considering high level of pollution, I have requested Sh Manish Sisodia, Education Minister, to consider closing schools for a few days,"" tweets Delhi CM Arvind Kejriwal/12:50pm: NGT slams Delhi, UP and Haryana governments over bad ambient air quality in the national capital, directs them to explain what preventive steps did they take to deal with the 'emergency situation' prevailing today, reports news agency PTI/12:25pm: Train operations have also been affected with 33 inbound trains delayed by three hours or more./12:20pm: At least 7 flights have been delayed, and one flight from Lucknow has been diverted to Jaipur./12:15pm: MeT officials say runway visibility had dropped to around 400m at 8 am in the morning, but had cleared to around 425-725m at 10:30 am./12:12pm: Delhi CM Kejriwal says Delhi has become a gas chamber for almost a month./12 noon: Delhi chief minister Arvind Kejriwal says Delhi's air pollution is this bad at this time of the year every year./11:50 am: ANI?reports that more than 20 flights were affected at Delhi airport after the runway was closed due to low visibility/11:15am: Indian Medical Association declares Delhi a public health emergency state, ANI?reports. The Association advises schools to be shut and tells people to avoid stepping out into the open/10am: Dense smog on National Highway-9 in Haryana. Long-distance trains from Bathinda to Delhi via Sirsa and Hisar are running late by an hour./Haryana Roadways cancels several early morning long-route buses to avoid accidents./8:50am: Long queues of four wheelers clog Delhi-Noida-Delhi Flyway and Noida-Greater Noida expressway as rush hour begins./8:30am: Visibility in national capital at 200 metres/8am: In Haryana, Fatehabad's district collector orders schools to open one hour later than usual. Schools to now open at 9 am for the next week./Published by HT Digital Content Services with permission from Hindustan Times. For any query with respect to this article or any other content requirement, please contact Editor at /<a href=""mailto:content.services@htlive.com"">content.services@htlive.com</a>"
