headline,body
How did Delhi air become so bad? Authorities need to answer these 15 questions,"India, Nov. 14 -- The smog of November 2016 brought Delhi face-to-face with the dangers of air pollution like never before. Smoke filled the air not just outdoors but breathing became difficult in the comforts of one's home too./""It's deadly,"" people were often heard saying in drawing room conversations about the air that could now be seen and smelt. The only solace was that the authorities were at least aware of the source of smog - stubble burning in Punjab and Haryana, weather conditions, vehicular pollution, construction dust, emissions from industries in the NCR./Sadly, the lesson has gone unlearnt. A year on, Delhi is living through a similar pollution crisis and experts say it might just get worse than 2016./Who is to be blamed?/Here are 15 questions that authorities need to answer:/The Delhi government/1. Why weren't real-time AQI, health advisories publicised with hoardings, ads, dos and don'ts?/2. Why wasn't bus fleet augmented?/3. Why weren't polluting vehicles checked?/4. Why weren't measures - sprinkling on roads, banning construction activities and entry of trucks - taken sooner?/5. Why wasn't meeting sought sooner with Union environment minister to escalate issue?/Civic bodies/1. Why have radio frequency identification smart tags not been installed at toll collection booths to reduce congestion?/2. Why have waste burning and fire at dumping sites not been curbed?/3. Why did it take two days to enforce hiked parking fees as per GRAP?/4. Why weren't roads vacuum-cleaned regularly?/5. Why was water sprinkling not undertaken on time?/The Centre/1. Why wasn't there coordination with northern states on stubble burning?/2. Why has Centre not been able to enforce tighter emission norms for coal-fired power plants?/3. Why hasn't NHAI completed Peripheral Expressway to decongest Delhi and NCR?/4. Why is there no advance pollution warning system?/5. Why are there no sulphur dioxide and nitrogen oxide norms for industries?/Published by HT Digital Content Services with permission from Hindustan Times. For any query with respect to this article or any other content requirement, please contact Editor at /<a href=""mailto:content.services@htlive.com"">content.services@htlive.com</a>"
"Air quality reaches alarming level, toxins double this year","Hisar, Nov. 14 -- With the state engulfed in a toxic haze for the past one week, air pollution this time has reached hazardous level which is two times higher than last year's, prompting the administration to take measures to bring life back to normal./The air quality index in Rohtak- one of the four districts in the state where the government has set up real-time air monitoring centres - has been hovering around 420 (hazardous level). On Sunday, it touched 487, worse than most parts of the national capital and Gurgaon./There was a 30% dip in the number of migratory birds flocking the state's sanctuaries and water bodies during this time of the year, said district forest officer (Jhajjar) Sundar Sambhariya . A pollution control board report said that AQI in Charkhi Dadri and adjoining areas was 471 on Monday. On normal days, the AQI is usually between 40 and 80 (optimal level) in these areas. The data shows last year during similar period when the state was engulfed in toxic smog, the AQI at Rohtak centre was around 200. Rohtak deputy commissioner Yash Garg said to control the pollution, more than 100 brick kilns have been shut in the district while construction work has been stopped. He said heavy vehicles carrying only essential commodities were being allowed to enter the city./""It will be wrong to say that Haryana's situation is worse than Delhi going by just one random reading. But it is still quite bad. If the situation does not improve soon, we will be forced to announce traffic restrictions in Rohtak just like Delhi had in the past,"" Garg said./But experts mainly blamed stubble burning and not automobiles or industries for the killer smog. ""The only reason behind smog is excessive burning of paddy residue,"" said Mohammad Kashif, an environment scientist and assistant professor at Chaudhary Devi Lal University./""There are no big industries in Sirsa, Fatehabad or Hisar. So, the reason behind smog here cannot be emissions from industries. The condition now is not suitable and due to low atmosphere pressure and moisture in the air leads to dense smog in isolated areas,"" Kashif said./Sveral incidents of stubble burning came to light in the last one week in Sirsa and Fatehabad districts. Fatehabad DC Hardeep Singh warned farmers that stubble burning was being observed by the Haryana Space Applications Centre (HARSAC) from space and such activities carried during night time were also being monitored./Published by HT Digital Content Services with permission from Hindustan Times. For any query with respect to this article or any other content requirement, please contact Editor at /<a href=""mailto:content.services@htlive.com"">content.services@htlive.com</a>"
Not alerted on polluting weather:EPCA,"NEW DELHI, Nov. 14 -- The Supreme Court appointed Environment Pollution Control and Prevention Authority (EPCA) on Monday stressed the importance of better weather forecasts, so that government agencies have advance notice of measures that need to be implemented under the Graded Response Action Plan (GRAP)./""This year, the last information EPCA had on the prevailing weather conditions was on November 6, 2017. This did not provide any warning of the kind of anti-cyclonic weather disturbance that was happening in the upper circulatory system and the impending problems that it would bring,""the pollution panel said in a report submitted on GRAP enforcement to the Supreme Court on Monday./On November 7, Delhi's Air Quality Index (AQI) hit severe levels with 448. As of Monday night, it remains around similar levels. This was triggered by the anti-cyclonic weather, EPCA said./""Two air circulatory systems - one bringing pollutants from crop burning in Punjab and Haryana, (and according to one theory, dust from multi-day dust storm in Iraq, Kuwait and Saudi Arabia)while the other bringing moisture from the east-collided over Delhi region. This formed a cloud of pollutants, trapped in moisture,which,combined with near-calm wind conditions at the ground-level, suffocated the region,"" EPCA said./According to the report,EPCA is provided no advance warning for sudden change in weather patterns, but only has information about the current state of pollution through the real-time monitoring of the AQI./""But across the world, where such smog alert systems are in place, a robust and reliable weather forecasting system is essential for action,"" it said./Avastly strengthened system of health advisories for people to take preventive action is also required, EPCA said, acknowledging the limitations of the current web-based system where information on the level of pollution (AQI) and health impact is provided./""There is a need to have wider dissemination of this information to the general public, through apps or other means. EPCA will discuss this with MoEF & CC, CPCB and state governments to see how such a system can be put in place,"" it said./A possible example for Delhi to follow would be that of Beijing, which introduced a four-tier colour- coded system to combat air pollution after the city faced heavy smog in 2013./The Chinese capital sends out pollution alerts on social media, television, radio and mobile apps. The information is also circulated through government accounts on Weibo(China'sTwitter) and WeChat./Stressing the need to include more measures that can bring immediate relief during future haze episodes, EPCA said that stubble burning in Punjab and Haryana may be a contributory factor, but it is not the only problem during winter./""There may be a need for additional emergency measures like closure of allcoal-based thermal plants and industries in the region. Currently, the Supreme Court has imposed a ban on pet coke and FO (furnace oil), but there may be a requirement to temporarily halt all other air polluting sources during peak smog periods,"" the report says./Published by HT Digital Content Services with permission from Hindustan Times. For any query with respect to this article or any other content requirement, please contact Editor at /<a href=""mailto:content.services@htlive.com"">content.services@htlive.com</a>"
"Better weather forecasts, health advisories need of the hour, says EPCA","New Delhi, Nov. 14 -- The Supreme Court-appointed Environment Pollution Control and Prevention Authority (EPCA) on Monday stressed the importance of better weather forecasts, so that government agencies have advance notice of measures that need to be implemented under the Graded Response Action Plan (GRAP)./""This year, the last information EPCA had on the prevailing weather conditions was on November 6, 2017. This did not provide any warning of the kind of anti-cyclonic weather disturbance that was happening in the upper circulatory system and the impending problems that it would bring,"" the pollution panel said in a report submitted on GRAP enforcement to the Supreme Court on Monday./On November 7, Delhi's Air Quality Index (AQI) hit severe levels with 448. As of Monday night, it remains around similar levels. This was triggered by the anti-cyclonic weather, EPCA said./""Two air circulatory systems - one bringing pollutants from crop burning in Punjab and Haryana, (and according to one theory, dust from multi-day dust storm in Iraq, Kuwait and Saudi Arabia) while the other bringing moisture from the east - collided over Delhi region. This formed a cloud of pollutants, trapped in moisture, which, combined with near-calm wind conditions at the ground-level, suffocated the region,"" EPCA said./According to the report, EPCA is provided no advance warning for sudden change in weather patterns, but only has information about the current state of pollution through the real-time monitoring of the AQI./""But across the world, where such smog alert systems are in place, a robust and reliable weather forecasting system is essential for action,"" it said./A vastly strengthened system of health advisories for people to take preventive action is also required, EPCA said, acknowledging the limitations of the current web-based system where information on the level of pollution (AQI) and health impact is provided./""There is a need to have wider dissemination of this information to the general public, through apps or other means. EPCA will discuss this with MoEF & CC, CPCB and state governments to see how such a system can be put in place,"" it said./A possible example for Delhi to follow would be that of Beijing, which introduced a four-tier colour-coded system to combat air pollution after the city faced heavy smog in 2013. The Chinese capital sends out pollution alerts on social media, television, radio and mobile apps. The information is also circulated through government accounts on Weibo (China's Twitter) and WeChat./Stressing on the need to include more measures that can bring immediate relief during future haze episodes, EPCA said that stubble burning in Punjab and Haryana may be a contributory factor, but it is not the only problem during winter./""There may be a need for additional emergency measures like closure of all coal-based thermal plants and industries in the region. Currently, the Supreme Court has imposed a ban on pet coke and FO (furnace oil), but there may be a requirement to temporarily halt all other air polluting sources during peak smog periods,"" the report says./Published by HT Digital Content Services with permission from Hindustan Times. For any query with respect to this article or any other content requirement, please contact Editor at /<a href=""mailto:content.services@htlive.com"">content.services@htlive.com</a>"
"Haryana's air quality reaches dangerous level, pollutants twice than last year","India, Nov. 14 -- With the state engulfed in a toxic haze for the past one week, air pollution this time has reached hazardous level which is two times higher than last year's, prompting the administration to take a slew of measures to bring life back to normal./The air quality index in Rohtak- one of the four districts in the state where the government has set up real-time air monitoring centres - has been hovering around 420 (hazardous level). On Sunday, it touched 487, worse than most parts of the national capital and Gurgaon./There was a dip in the number of migratory birds flocking the state's sanctuaries and water bodies during this time of the year, a forest official said./The data shows last year during similar period when the state was engulfed in toxic smog, the AQI at Rohtak centre was around 200./Rohtak deputy commissioner Yash Garg said to control the pollution, more than 100 brick kilns have been shut in the district while construction work has been stopped. He said heavy vehicles carrying only essential commodities were being allowed to enter the city./""It will be wrong to say that Haryana's situation is worse than Delhi going by just one random reading. But it is still quite bad. If the situation does not improve soon, we will be forced to announce traffic restrictions in Rohtak just like Delhi had in the past,"" Garg said./Experts, however, mainly blamed stubble burning and not automobiles or industries for the killer smog. ""The only reason behind smog is excessive burning of paddy residue,"" said Mohammad Kashif, an environment scientist and assistant professor at Chaudhary Devi Lal University./""According to research, there are no big industries in Sirsa, Fatehabad or Hisar. So, the reason behind smog here cannot be emissions from industries. The atmospheric condition right now is not suitable and due to low atmosphere pressure and moisture in the air leads to dense smog in isolated area,"" Kashif said./Notably, several incidents of stubble burning came to light in the last one week in Sirsa and Fatehabad districts. Fatehabad DC Hardeep Singh warned farmers that stubble burning was being observed by the Haryana Space Applications Centre (HARSAC) from space and all such activities carried during night time were also being monitored./Sundar Sambhariya, district forest officer at Jhajjar, said there was a 30% decrease in the number of migratory birds that used to flock several sanctuaries and water bodies in Haryana during this time of the year. Experts said the smog was causing eyes and lungs problems to people in Haryana, advising asthma patients to stay indoors till the air quality gets better./Published by HT Digital Content Services with permission from Hindustan Times. For any query with respect to this article or any other content requirement, please contact Editor at /<a href=""mailto:content.services@htlive.com"">content.services@htlive.com</a>"
Ryan school murder: Haryana CM Manohar Lal Khattar defends state police,"New Delhi, Nov. 14 -- Haryana chief minister Manohar Lal Khattar defended his state's police on Tuesday amid allegations that they coerced a bus conductor into confessing to the murder of an eight-year-old boy in Gurgaon's Ryan International school./Khattar's comments come days after the Central Bureau of Investigation presented a new suspect - a school senior - and a new sequence of alleged events. But that suspect too has said that he was forced to implicate himself./""The Gurgaon Police investigations were on and they too would have come to the same conclusions if the case had not been handed over the CBI. No charge-sheet was filed yet. So, where does the failure part come?"" Khattar told Hindustan Times in an interview./Khattar had turned the investigation over to the federal agency after parents of the victim, Pradyuman, insisted./The bus conductor, Ashok Kumar, has said that he will sue the Haryana police for their investigation framing him. Kumar is currently in prison./""There is one more unknown person in the CCTV footage. All these angles were being probed by the police,"" the CM said./""The family and the people wanted the case to be probed by the CBI. There was intense pressure from media as well. So, we promptly handed over the case to the CBI""./He maintained that the state government was committed to ensuring justice to the family. ""We want guilty be punished and we are committed to that.""/'NO POLLUTION POLITICS'/On his war of words with his Delhi counterpart Arvind Kejriwal, Khattar said no one should indulge in ""pollution politics"" and called for long-term measures to address the problems of crop burning by farmers./Crop burning is seen as the main reason for a thick haze that envelops Haryana, Punjab and the national capital region for a month starting mid-October every year. But this year, the situation was particularly bad, prompting doctors to urge people to not go out of their homes./""I am pained at what Kejriwal is doing. No one should do politics over politics,"" he said. ""I am ready to meet him whenever he wants. There are 40,000 farmers in Delhi and surprisingly he didn't even know this.""/Kejriwal had written to Khattar and Punjab chief minister Captain Amarinder Singh on November 8, seeking a meeting to discuss the issue of air pollution after alarm bells started ringing./Khattar responded on November 10, saying he was ready to meet Kejriwal ""anywhere anytime"" and told him that no single person, organisation or government could improve the air quality. Kejriwal later tweeted that he will meet the Haryana CM in Chandigarh on Wednesday./Khattar told HT that a strong mechanism was needed to enhance the outcome of constructive and collective steps./""We should think about long-term measures as this season is already over and this pollution due to stubble burning will go within a day or two.""/Khattar agreed with Amarinder Singh that the Centre should call a meeting of all the affected states and seek their suggestions to address the problem./He said the Haryana government has started creating awareness among the farmers about the adverse impact of stubble burning. ""We have already disbursed Rs 36 crore to farmers for buying machines,"" Khattar said./Published by HT Digital Content Services with permission from Hindustan Times. For any query with respect to this article or any other content requirement, please contact Editor at /<a href=""mailto:content.services@htlive.com"">content.services@htlive.com</a>"
"For 3rd day in row, Gzb tops pollution charts","GHAZIABAD, Nov. 14 -- For the third consecutive day on Monday, the Ghaziabad city topped the pollution list of cities across the country with an air quality index (AQI) of 497./The pollution cloud has failed to dissipate, despite a series of steps taken by the district administration that include suspension of production in factories, closure of hot mix plants, water sprinkling on roads, among other measures./The AQI, as assessed by the Central Pollution Control Board (CPCB), on Monday was 497 while it was 498 and 486 on Sunday and Saturday, respectively. This is the seventh day since October 30 when the city has topped cities across the country in terms of pollution./""As a result of the prevailing conditions, we have a nearly 20% increase in patients arriving with issues of respiratory infections, breathlessness, aggravation of asthma and skin infection,"" said Dr NK Gupta, chief medical officer, Ghaziabad./""At the two government hospitals and four community health centres, we treat nearly 8,000 patients every day. Nearly/20% of them have complained of respiratory and related issues. There has been a rise of 20% in the number of patients suffering from respiratory diseases in the last one week. As we treat only/20% of the total patients in the district and the remaining 80% are treated at various private hospitals, the figures at private hospitals and clinics could be much higher than ours,"" Dr Gupta said./District magistrate Ritu Maheshwari said the administration has taken most of the prescribed steps to check pollution./""The persistent situation is dependent on other regional factors too. We are trying our best with the available resources. We are resorting to penalties and even shutdown of production in industrial areas. Many factory owners have stopped production on their own,"" she said./On Monday, too, the regional pollution control board officials ordered suspension of work at factories in various industrial areas./""On Monday, we ordered the shutdown of production in 88 factories. In all, the number of factories where production has been suspended is now at 315. The figures and action taken report will be submitted before the National Green Tribunal (NGT) on Tuesday,"" said Ajay Sharma, regional officer, UP pollution control board./The district has 356 'air polluting' factories in various industrial areas. The NGT on November 9 had taken a tough stance on the issue of rising pollution./The NGT in its November 9 order had said, ""All industrial activity in NCR of Delhi which releases emission would also not be carried out till the next date of hearing (sic)""./Published by HT Digital Content Services with permission from HT Noida & Ghaziabad. For any query with respect to this article or any other content requirement, please contact Editor at /<a href=""mailto:content.services@htlive.com"">content.services@htlive.com</a>"
"Gurgaon residents fail lungs screening test, pledge to curb air pollution","Gurgaon, Nov. 15 -- Around 100 people on Wednesday took a pledge to curb air pollution in the city after they participated in a lung screening test at an event in CyberHub. To their surprise, most residents of Gurgaon discovered that their lungs were not healthy./Kavita Kapoor, a 35-year-old non-smoker, who lives in DLF Phase-II area of the city was shocked to find out that her lungs are unhealthy. ""I am a non-smoker and the results are scary. My lungs are unable to process more than 70 liters of carbon dioxide every day.""/Healthy lungs of a woman of same age group should be able to process about 450 litres of cardon dioxide per day, said the diagnostic experts on spot./However, Kapoor was not alone in being surprised by her 'ill-health""; most residents of the city had similar lung capacity at the event organised to generate awareness about the impact of pollution on our lungs and general health. The event also shed light on the lung capacity of a patient suffering from respiratory illness by making participants hold their breath for a minute./Residents pledged to mitigate air pollution by not burning waste in the open, avoid using vehicles whenever possible and not smoking./The objective of conducting the lungs screening test was to give citizens an insight into the impact of air pollution and to raise awareness about clean air in the city on World Chronic Obstructive Pulmonary Disease (COPD) day./Accepting that respiratory problems are increasing at an alarming rate, chief medical officer of Gurgaon Civil Hospital BK Rajora said temporary aids, including pollution masks and respiratory medicines, are not a solution./""Clean air is required for development of human beings,"" said Rajora, adding that the reduced lung capacity of people living in polluted cities in not surprising./At the event, doctors claimed the region is witnessing a 25% rise in year-on-year COPD patients because of poor air quality./""At present COPD is the No.2 killer disease; it used to be at No.6 four years ago. It is a big concern as this leads to poor lung functioning and results in structural damage that cannot be treated,"" Dr Himanshu Garg, a city-based pulmonologist, told residents at the event./Health experts also pointed out that Delhi-NCR region is now seeing over 90 'poor' air quality days in a year and this is affecting the health of children who are less than five years old./Dr Naresh Sharma, president of Indian Medical Association, Gurgaon, said, ""Non-smokers, children and people with allergies are suffering more because of air pollution. It is the need of the hour that residents become proactive in consciously reducing air pollution.""/Published by HT Digital Content Services with permission from Hindustan Times. For any query with respect to this article or any other content requirement, please contact Editor at /<a href=""mailto:content.services@htlive.com"">content.services@htlive.com</a>"
