headline,body
What Lko will vote for today,"Lucknow, Nov. 26 -- This year election for Lucknow's mayor, reserved for women, is in itself the beginning of a change. Some may vote for development, some for reduction of air pollution, while others may vote for a city without filth and garbage./Young women voters are upbeat over the fact that they will vote for a woman./HT spoke to cross section of voters as to what they are voting for. Here are the excerpts:/""I will vote for a candidate who promises to check the increasing crime, not only against women, but against people in general. Also, I am rooting for a candidate who strives to curb the rising pollution in the city,"" said Fariah Zaidi (19), a student./Her friend Anupama Shukla (18) said: ""This time I will vote for someone who can work for cleanliness of the city as one can see garbage littered on roadsides and stray cattle all around. Residents have decided now to elect a candidate who can assure to rid them of the filth menace.""/Entrepreneur Kiron Chopra said this time with mayoral seat reserved for women, a lot of votes may go to the candidate and not the party, though how two ideologically different parties will co-exist should there be a candidate elected from a party other than the ruling dispensation, is something time will tell./""This, however, is not a new situation but the push and pull between the civic authorities and state agencies is a bane for the common citizen. What comes across strongly though, and is heartening, is that most of women candidates are capable and determined for a change. I hope municipal reforms finally happen,"" Chopra said./Madhu Banerjee of Gomti Nagar said the mayor is a decorative post with little powers in the general belief. Therefore, voting for either the mayor or the corporator is a futile exercise./Piyush Raj Verma of Care About People Foundation, said: ""Sunday is yet another day where Lucknow will come out to exercise its democratic right to elect local government. Lucknow will vote for development, where basic amenities reach the citizens. Lucknow will also vote for an accountable system,"" he said./Aadarsh Mishra, a research associate, said poor facilities in water supply, filth and garbage continue to thrive thereby causing several diseases. It is time for voters to hold their representatives' work into account./If you want to make a difference, vote on Sunday, is the advice from these Lucknowites./Published by HT Digital Content Services with permission from Hindustan Times. For any query with respect to this article or any other content requirement, please contact Editor at /<a href=""mailto:content.services@htlive.com"">content.services@htlive.com</a>"
Increase in vehicle count rings pollution alarm bells,"Thane, Nov. 26 -- The vehicle population in Thane city is almost equal to the population./As per the pollution control report, the number of vehicles in the city is more than 19 lakh./The RTO record states that the number of private vehicles plying in the city is 15.36 lakhs. The total number of vehicles plying in the city is 19.27 lakh. The census report of 2011 says Thane's population is 18 lakhs./A civic official said, ""In our pollution report, we have studied the vehicle population submitted by the RTO. The number of vehicles in the city last year was 18.21 lakh which increased by over one lakh this year. Twowheelers form the major chunk of vehicle population. The city has more than 10 lakh twowheelers, almost four to five lakh four-wheelers. The number of private vehicles in the city is over 15 lakhs, most of which ply on the city roads during peak hours.""/The vehicular population increases by seven to eight percent every year./The Thane municipal Corporation record states that the vehicle density in Thane is 479 vehicles per 1,000 people which is more than Delhi. This ratio was 280 per 1,000 people in 2001 and 417 per 1,000 people in 2005./From 1981 to 2001, the vehicle population in the six metropolis in India has gone up by 7.75 times./Thane has developed rapidly in areas such as Ghodbunder Road and Kolshet./However, areas in the heart of the city such as Naupada, Ambedkar Road or Khopat are still lagging in road infrastructure./Environmentalist Nagesh Tekale said, ""The roads are bad. Most areas of the roads is occupied by illegal parking and the footpaths are pathetic due to which the commuters walk on roads. All these obstructions reduce the speed of the vehicles. This increases the emission of sulphur and carbon monoxide, which increases air pollution.""/Potholes or bad quality roads lead to increase in friction between the tyres and the road releasing more lead in the air, he added./""Lead slows the brain development of children. It also leads to skin allergies. CO inhaled causes respiratory ailments like asthama, breathing or lung diseases,"" he said./""The situation might someday be like Delhi if the number of vehicles continues to increase at the same pace. Widening of roads, strengthening the public transport system, car pooling and opting for fleet or shuttle services can ease the pollution in the long run,"" Tekale added./The pollution control officer said people should start using battery-operated vehicles./""The municipal corporation is coming up with electronic buses, a green mode of transport. The biggest problems are two-wheelers, as there are over 10 lakh twowheelers in the city. Instead of bikes, people should opt for nonmotorised means of public transport like bicycle. We have also proposed to start the rent a cycle initiative for residents,"" said Manisha Pradhan, pollution control officer./Published by HT Digital Content Services with permission from Hindustan Times. For any query with respect to this article or any other content requirement, please contact Editor at /<a href=""mailto:content.services@htlive.com"">content.services@htlive.com</a>"
TIME WE MADE DELHI A MORE LIVEABLE STATE,"Mumbai, Nov. 26 -- Why is Delhi a state? That isn't a facile question. It is also a question that merits repeating. Why is Delhi a state?/India's capital was a beautiful city (before it became a beautiful-but-unlivable city-state) in the 1970s and part of the 1980s. The traffic was still manageable (the tricked-out-Maruti-800 revolution was a few years away), as was the population. It was still safe, although city-historians would later point to the horrific Sanjay and Geeta Chopra murders in 1978 as a tipping point. It had wide tree-lined avenues, beautiful parks, and a certain old-world feel. Gurgaon and Ghaziabad were yet to become the heaving satellitetowns they would become, and NOIDA was a small and immaculately planned suburb./Truth is, you can get nostalgic about almost any Indian city. Bengaluru in the 1970s, 1980s, even part of the 1990s, was one of the best places to live in India. Mumbai, almost till the late 1990s, was still a perfectly functioning metropolis. Kolkata was an important cultural and business centre in the 1980s. Of the lot, only Chennai, which received and still gets a bad rap for weather, has managed to keep some bit of its old self alive, although, like Kolkata, it has become a city of parents. Still, Delhi's case is particularly unique and not the least because it is a city-state that is home to the central government./Part of this has to perhaps do with its success. Even in the 1980s and 1990s, Mumbai was the country's commercial capital and Delhi, its political capital. That has changed. Today, the centre of gravity of business in India hovers somewhere between Mumbai and Delhi and Bengaluru (although it is still slightly polarised towards the first). Today, Delhi and its environs, called the National Capital Region, and including bits of Gurugram, Noida, Faridabad, and Ghaziabad, are home to as many, if not more, multinational corporations, than Mumbai or Bengaluru. Gurugram is the largest automobile manufacturing hub in the country. This has translated into a greater demand on the region's infrastructure. Delhi is woefully short of power and dependant on other regions. It also has its water piped in from elsewhere. Its roads are unable to cope with its volume of traffic, the result of it having more vehicles than Mumbai, Bengaluru, Chennai, and Kolkata combined. It has become unsafe for women. Every year, it has outbreaks of dengue, or chikungunya, or some other disease. It has a garbage problem. And, over the past few years, every winter, it has the worst air quality in the country./These are the kind of issues that would tax even the most efficient administrations. Only, in Delhi, it isn't clear who is in charge. The city itself is divided into three local bodies, the New Delhi Municipal Corporation that comes under the central government; the Municipal Corporation of Delhi (divided into three corporations, each elected); and the Delhi Cantonment Board which falls under the defence ministry. On top of these are Delhi's elected government or the Lieutenant Governor, an appointee of the Union government. Then there are satellites such as Gurugram, Faridabad, Noida, and Ghaziabad. The first two fall under the Haryana government and the last two under Uttar Pradesh./The number of bodies and individuals and governments responsible for Delhi puts the citystate in a uniquely piquant position. One, people do not know who is accountable for what. Indeed, ahead of this year's election to the three corporations that make up the MCD, the BJP fought at least part of its campaign on the platform of change despite having been in charge of all three corporations for the past 10 years. Two, it is easy for the people in charge to pass the buck. Indeed, this is the standard response of Delhi's Aam Aadmi Party (AAP) government./This was evident during the recent air pollution crisis. Despite being an annual affair, the government seemed unprepared. It had not implemented many of the measures promised last year. Worse, it had not bought more buses despite sitting on a green fund that had more than enough money. When this was pointed out, it pointed a finger at the Delhi Development Authority, which reports to the Lieutenant Governor, saying the agency had not given it enough land to park the buses it wanted to buy./To be fair to the state government, there are areas such as law and order, for instance, where it can do little because the Delhi Police doesn't report to it. But there are areas where it can do a lot. In some, such as education (schools), it has achieved a lot. In others, it hasn't, and the reason for this underperformance isn't always its limited powers, although it is a good excuse./As India's capital, the location of the central government, the most important vertex in the Delhi-Agra-Jaipur golden triangle in tourism, and an important cultural and commercial hub, the city-state deserves better. If this means carving out a larger region (the satellite towns and suburbs), and putting an administrative authority reporting to the Union government, then so be it. This would remove centre-state relations from the equation and create an authority responsible for a geographical area already contiguous in all aspects except governance./Sure, it would help to have such a body. Just as it would help if Delhi's state government had more powers, or had better relations with the Union government. But there is also a more pragmatic and simple solution: there is much the AAP government in Delhi could have done and can still do to make the city more livable./The Delhiite puts up with a lot: unsafe roads; harassment and rape; traffic jams; disease outbreaks; bad air; and, also helplessness arising sometimes from not knowing who to hold responsible for all this. It is time to put an end to this. It is time for the state government to step up (however limited it may feel its powers are)./Published by HT Digital Content Services with permission from Hindustan Times. For any query with respect to this article or any other content requirement, please contact Editor at /<a href=""mailto:content.services@htlive.com"">content.services@htlive.com</a>"
Time to breathe a sigh of relief!,"New Delhi, Nov. 27 -- As usual, the air quality in the National Capital has plunged to dangerous level, raising serious health concerns. /And as air pollution levels rise, many people turn to air cleaners for relief. This is important because the air that circulates inside your house is not cleaner than the one outside as you might have presumed. Actually, indoor air can be more polluted than the air outside, putting you at risk for a number of health conditions, including allergies, asthma, and other respiratory problems. Air purifiers are devices which help in removing viruses, bacteria, and various matter particulates present in air. These products are different from air cleaners in their size, cost, area of purification and application. Air purifiers are now being viewed as a necessity, instead of a luxury product, due to increasing air pollution across towns and cities. Residential as well as commercial users are progressively adopting air purifiers for upholding a cleaner, less-polluted environment. ""People should adopt new technologies for a healthy lifestyle. Daikin revolution for curbing indoor air pollution with the use of latest technology is a great move. I feel with our range of air purifiers we will be able to serve the wellbeing of people, ""says Kanwal Jeet Jawa, MD and CEO, Daikin India. Daikin air purifier is partner for HT Leadership Summit, 2017. The major drivers of the global air purifiers market are increasing air pollution anxieties, rising usage of HEPA technology, growing respiratory diseases, growing consumer expenditure on lifestyle products./Published by HT Digital Content Services with permission from Hindustan Times. For any query with respect to this article or any other content requirement, please contact Editor at /<a href=""mailto:content.services@htlive.com"">content.services@htlive.com</a>"
India accounted for 21% of all under-age deaths in 2013: Expert,"Lucknow, Nov. 30 -- You can't change your genes, but you can change your environment, said Linda Birnbaum, director, National Institute of Environmental Health Sciences and National Toxicology Program North Carolina, US during the international conference at Amity University./""The environment in which we live can have profound impact on our health and wellness. This is particularly true for women and children. Women are uniquely susceptible to specific cancers, reproductive diseases, obesity and respiratory effects of indoor air pollution. By understanding environmental exposures and their links to disease, we can identify opportunities to improve the health of vulnerable populations of women on a global scale,"" she emphasised./Pollution related diseases were responsible for 9 million deaths in the world annually while India alone accounted for 21% of all under age (below age of 5) deaths in 2013, she added./Linda said it was important to identify factors that may contribute to the progression of certain disease, factors that may be peculiar to specific countries or regions of the world./She was of the view that the incidence of conditions such as diabetes, obesity and asthma had increased substantially in the last couple of decades./Qamar Rehman, chairperson of the organising committee, said the conference was aimed at broadening the thought of society towards women's vulnerability to environmental challenges alongside related issues like rapid spread of HIV/ AIDS among women and growing danger to young mothers and their babies from toxic chemicals./Among 300 delegates attending this conference, more than 20 scientists and experts are from the United States and Germany./A diverse spectrum of scientists and policy analysts are to present latest findings on important diseases and hazards and their implications for environmental and occupational health policy./Published by HT Digital Content Services with permission from Hindustan Times. For any query with respect to this article or any other content requirement, please contact Editor at /<a href=""mailto:content.services@htlive.com"">content.services@htlive.com</a>"
'Urgent need to probe role of pollution in cancer incidences',"Lucknow, Dec. 1 -- Breast cancer is more common than cervical cancers, both in India and globally, and women below the age of 50 are affected with it, said Mary Beth Terry of Columbia University, School of Public Health, New York on Wednesday./She was among the many scientists from across the world who shared their views and findings on 'The Impact of Environment on Women's Health' at Amity University on second day of the three-day conference that ends on Friday./""Rate of breast cancer is going up and now younger woman are getting affected by the disease. We fear this could be due to rise in air pollution level. Experts need to investigate the role of pollution in cancer incidence as most studies on environmental risk factors and breast cancer are conducted in average risk cohorts and are not sufficiently powered to examine interactions across the risk spectrum,"" she said./The experts were of the view that environmental hazards are among the major causes of global deaths and diseases and the burden falls disproportionately on women, especially in developing countries./Every year, approximately 45,000 women die due to complications of pregnancy and childbirth in India, nearly all of these deaths are preventable./The second day of the conference organized by Amity University, Lucknow, in collaboration with National Institute of Environmental Health Sciences (NIEHS), USA, saw highly knowledgeable speakers across the world who also presented their research papers./Prof Qamr Rehman, dean, Research, Science and Technology, Amity University (Lucknow), said this conference would provide an opportunity for scientists and policy analysts, from both the developed and developing countries, to present the latest findings on this burning issue./A special convocation ceremony was also organized on the day. Prof Linda Birnbaum, director, NIEHS and National Toxicology Program, North Carolina, Professor Tom Wie from Columbia University, Prof Wolfgang Schareck, Rostock University (Germany), Prof Mone Zaidi, Mount Sinai Hospital, New York, and Prof Peter Langer from Germany, were conferred upon an honorary doctorate./The luminaries were honoured by Dr Ashok K Chauhan, founder-president, Ritnand Balved Education Foundation and Dr Aseem Chauhan, chairman, Amity University, Lucknow./Published by HT Digital Content Services with permission from Hindustan Times. For any query with respect to this article or any other content requirement, please contact Editor at /<a href=""mailto:content.services@htlive.com"">content.services@htlive.com</a>"
"Air quality continues to deteriorate in Delhi, PM10 levels breach 400 mark","India, Dec. 1 -- New Delhi/Delhi's air quality deteriorated further on Friday with the level of PM10 breaching the 400-mark for the first time since November 14, when the city had just come out of the week-long haze and severe levels of pollution./Experts hoped the pollution levels could go down over the next two days as the wind speed was expected to increase. Delhi could also receive a spell of very light rain in the middle of the week./In the wake of the deteriorating air quality, the South Delhi Municipal Corporation's mayor, Kamaljeet Sehrawat, distributed air purifiers to four primary schools./Delhi's average Air Quality Index on Friday was 343, marginally lower than Thursday's count of 360. The AQI had been fluctuating over the past few days. On Monday it had touched 361. Thereafter it had come down to 307 on Tuesday and 334 on Wednesday./The level of PM10, however, shot up to 412ug/m3 around 2 pm on Friday from 379ug/m3 around the same time on Thursday. This is four times above the permissible limit of 100ug/m3./""Such high concentrations of PM10 were last seen on November 14 when PM10 levels were recorded to 413ug/m3. Delhi at that time had just come out of the week-long severe levels of air pollution. The haze continued from November 7 to November 13. On November 14, the air quality improved to some extent,"" said a scientist of the Central Pollution Control Board (CPCB)./The level of PM2.5, however, fluctuated throughout the day and was comparatively lower than what it was on Thursday. It had hit a peak of 230ug/m3 on Thursday. On Friday, the highest concentration of PM2.5 was recorded to be 226ug/m3./According to the Graded Response Action Plan, if the level of PM10 and PM2.5 hits the 500 and 300 mark, respectively, and stays there for at least two days, emergency measures such as road rationing, shutting down of schools and ban on construction activities would be introduced./Experts said that fluctuation in the weather systems, particularly in the wind speed and wind directions, is affecting the pollution levels./""Sometimes, moisture-laden winds from the south-east are gushing in. This has increased the moisture content in the air. The moisture trapped the pollutants and they started accumulating,"" said D Saha, head of the air quality monitoring laboratory at Central Pollution Control Board./The local met department, however, says the wind speed will pick up over the next 48 hours and there could be light rain in Delhi-NCR on December 5./""The average wind speed, which was around 10km/hour till Friday, is expected to increase to 15 km/hour over the next two to three days. This could help in cleaning Delhi's air further. We are also expecting some very light rain on December 5,"" said Kuldeep Srivastava, a scientist with the regional weather forecasting centre./Published by HT Digital Content Services with permission from Hindustan Times. For any query with respect to this article or any other content requirement, please contact Editor at /<a href=""mailto:content.services@htlive.com"">content.services@htlive.com</a>"
"Air quality dips, civic schools get air purifiers","NEW DELHI, Dec. 2 -- Delhi's air quality deteriorated further on Friday with the level of PM10 breaching the 400-mark for the first time since November 14, when the city had just come out of the week-long haze of severe pollution./Experts hoped the pollution levels could go down over the next two days as the wind speed was expected to increase. Delhi could also receive very light rain in the middle of the week./In the wake of the deteriorating air quality, the South Delhi Municipal Corporation's mayor, Kamaljeet Sehrawat, distributed air purifiers to four primary schools./Delhi's average Air Quality Index on Friday was 343, marginally lower than Thursday's 360. The AQI had been fluctuating over the past few days. On Monday it had touched 361. Thereafter it had come down to 307 on Tuesday and 334 on Wednesday./The level of PM10, however, shot up to 412ug/m3 around 2 pm on Friday from 379ug/m3 around the same time on Thursday. This is four times above the permissible limit of 100ug/m3./""Such high concentrations of PM10 were last seen on November 14 when PM10 levels were recorded to 413ug/m3. Delhi at that time had just come out of the week-long severe levels of air pollution. The haze continued from November 7 to November 13. On November 14, the air quality improved to some extent,"" said a scientist of the Central Pollution Control Board (CPCB)./The level of PM2.5, however, fluctuated throughout the day and was comparatively lower than what it was on Thursday. It had hit a peak of 230ug/m3 on Thursday. On Friday, the highest concentration of PM2.5 was recorded to be 226ug/m3./Experts said weather fluctuations, particularly in the wind speed and wind directions, is affecting the pollution levels./""Sometimes, moisture-laden winds from the south-east are gushing in. This has increased the moisture content in the air. The moisture trapped the pollutants and they started accumulating,"" said D Saha, head of the air quality monitoring laboratory at Central Pollution Control Board./The local met department, however, says the wind speed will pick up over the next 48 hours and there could be light rain in Delhi-NCR on December 5./""The average wind speed, which was around 10 km/ hour till Friday, is expected to be 15 km/ hour over the next two to three days. This could clean Delhi's air further. We are also expecting some very light rain on December 5,"" said Kuldeep Srivastava, a scientist with the regional weather forecasting centre./Published by HT Digital Content Services with permission from Hindustan Times. For any query with respect to this article or any other content requirement, please contact Editor at /<a href=""mailto:content.services@htlive.com"">content.services@htlive.com</a>"
