headline,body
"News updates from Hindustan Times at 1 PM| 'Democracy murdered in Maharashtra', says Rahul Gandhi in Lok Sabha and all the latest news at this hour","India, Nov. 25 -- Here are today's top news, analysis and opinion curated for you at 1 PM. Know all about the latest news and other news updates from Hindustan Times./'Democracy murdered in Maharashtra': Rahul Gandhi in Parliament/Congress leader Rahul Gandhi attacked the government over the political situation in Maharashtra and said ""democracy has been murdered"". Rahul Gandhi, according to ANI said, ""I wanted to ask a question in the House but it doesn't make any sense to ask a question right now as democracy has been murdered in Maharashtra"". Read more here./Week after uniform row, Rajya Sabha marshals switch back to bandhgalas/The move came a day after the marshals appeared in the Rajya Sabha on the first day of its 250th session in deep blue winter uniform and peak caps similar to those senior army officers wear on ceremonial occasions. Gen Malik was among those who objected to the military-style uniform in a tweet on November 18. Read more here./Not horse-trading, NCP's entire stable bolted: Governor's office to SC/Maharashtra governor Bhagat Singh Koshyari's office on Monday told the Supreme Court that he was not expected to conduct a roving and fishing inquiry once he received letters of support that indicated Devendra Fadnavis had the support of 170 MLAs. Read more here./JNU administration constitutes committee for finding solution to hostel issues/Jawaharlal Nehru University (JNU) administration on Sunday said that a High-Level committee has been constituted by competent authority to get suggestions from the student representatives on finding a solution to the hostel issues. Read more here./Worried about air pollution ruining your hair? Here's how you can take care and prevent pollution damage/Air pollution can be harmful to skin, but equally to one's scalp and hair. Every minute bit of ash, dust, smoke and gaseous pollutants have the potential to damage the hair and scalp, causing irritation and damage. City-inhabitants who live in a highly air-polluted area are clearly at a higher risk of getting exposed to the pollutants. Read more here./Creta vs Creta and other SUVs in India: Hyundai looks to change game, again/The 2020 Creta could be just the shot in the arm that Hyundai needs in the SUV segment, especially with new rivals like Kia Seltos and MG Hector providing a massive challenge. Read more here./Rupee Asia's only losing emerging currency, future even bleaker: Report/The rupee, which has slumped almost 5% from this year's high in July, is also under selling pressure due to escalating levels of public debt and a credit crunch among non-bank finance companies, known as shadow banks. Read more here./Sudanese women hope new government ends flogging, violence/Nearly a year after a nationwide protest movement erupted against autocrat Omar al-Bashir -- and more than seven months since his three-decade tenure was terminated by the army -- women like Abdalla dare to hope for a violence-free future. Read more here./Best in 67 years, best-ever in India - Numbers reveal stunning impact of Indian fast bowlers/In indian cricket, the term fast bowler was an anomaly - barring Kapil Dev, Javagal Srinath, Zaheer Khan, the canvass has largely remained dry. However, under Virat Kohli, a new page has been turned and now, the side wins matches on true surface with their battery of fast-bowlers. Read more here./Lauren Gottlieb opens up on her absence from films: 'I was unhappy, turned to alcohol, prescription drugs'/Lauren Gottlieb burst on the Bollywood scene in 2012 with Remo D'Souza's ABCD: Any Body Can Dance. Though she quickly became a household name, thanks to her amazing dance moves, she suddenly went missing in action. Read more here./Published by HT Digital Content Services with permission from Hindustan Times. For any query with respect to this article or any other content requirement, please contact Editor at /<a href=""mailto:contentservices@htlive.com"">contentservices@htlive.com</a>"
New less polluting fogging technique being considered by municipal bodies,"New Delhi, Nov. 28 -- In view of the heavy pollution caused by conventional fogging mosquito control techniques that uses diesel as solvent for insecticides, Delhi's municipal bodies are considering a new device called Ultra Low Volume (ULV) that uses water instead./Insecticides are poisonous to humans and thus have to be diluted in a solvent before spraying. Conventional techniques uses a mixture that is 95% diesel and 5% insecticide. The new technique will have similar ratios but with water replacing diesel.Neither would it have the signature ""fog"" that the diesel-based spraying machines leave behind./According to municipal officials, they had thought about deploying ULV device earlier too. But one of the things that stopped them was public perception./""Diesel-based fogging causes fumes, the fog that the people see after spraying, which leads to public satisfaction that the municipalities are doing something to protect them,"" said Dr. Pramod Verma, Deputy Health Officer of the North Municipal Corporation of Delhi. ""Often, fogging is a tool for political leaders to appease residents of their constituency though we are aware that diesel fogging is not 100% effective outdoors. However, ULVs only create a 'water mist' which is invisible, and hence does not create that positive psychological effect that people seek,"" he explained./The ULV machine is extensively used in the United States, and the National Vector-Borne Disease Control Programme of India, which advises municipalities across the country on medicines and techniques to use for mosquito control, also allows it, municipal officials said./""At least 95% of the mixture in conventional fogging devices is diesel and only 5% is the insecticide - malathion or cyphenothrin, compounds which kill adult mosquitoes on contact,"" said a senior public health official of the South Delhi Municipal Corporation (SDMC), who requested to be named. ""When this mixture is heated at temperatures like 700 C and sprayed at high pressure, the diesel turns into vapours and cause air pollution""/SDMC councillor and standing committee member, Narender Kumar, also recently recommended it in a meeting of the corporation. ""We are aware how severe Delhi's air pollution situation is right now. If we have an option like ULVs, which does not use diesel, we must explore it,"" Kumar said at the meeting./Other municipal officials, though, pointed out issues with ULV which have been forbidding the technology, though, it has existed for several years now. Another issue with ULVs is that they do well in colder climates, like in USA, where the suspended water droplets don't evaporate quickly and stay afloat in the air to kill mosquitoes. ""In temperate countries like ours, the water dries up quickly, so more insecticide has to be added per litre of water for it to be effective,"" Dr Somashekhar of east Delhi municipality./Published by HT Digital Content Services with permission from Hindustan Times. For any query with respect to this article or any other content requirement, please contact Editor at /<a href=""mailto:contentservices@htlive.com"">contentservices@htlive.com</a>"
"Air quality in Lucknow, Kanpur three times worse than Delhi","LUCKNOW, Nov. 28 -- The air quality in Lucknow continued to be 'very poor' and was, in fact, three times worse than Delhi in the last 24 hours, according to Central Pollution Control Board (CPCB) data./The Air Quality Index (AQI) of Lucknow on Tuesday was 374 and that of Kanpur was 379 while AQI of Delhi was recorded at 106, the CPCB data showed./AQI in the range of 300-400 is categorized as 'very poor' and it is said to be the cause of respiratory illness due to long-term exposure. Experts said vehicular emission, dust from construction sites and smoke from factories were three major contributors to bad AQI in these cities./Commenting on the situation in the state capital, Lucknow mayor Sanyukta Bhatia said, ""The state of air quality in the city is alarming. As a concerned citizen, I will do my part to improve the situation.""/Bhatia has summoned officials of the Lucknow Municipal Corporation(LMC), Lucknow Development Authority (LDA) and Pollution Control Board to plan a working model for improving air quality./The state pollution control board continued to claim that it was making efforts to improve the air quality./Besides Lucknow and Kanpur, the air quality in other parts of the state improved slightly./The AQI in most cities in west UP, which is one of the worst hit areas by air pollution in recent weeks, improved because of recent showers in the region, according to experts. The average AQI of Ghaziabad was recorded at 105. It was 67 in Baghpat, 110 in Greater Noida and 101 in Noida./Published by HT Digital Content Services with permission from Hindustan Times. For any query with respect to this article or any other content requirement, please contact Editor at /<a href=""mailto:contentservices@htlive.com"">contentservices@htlive.com</a>"
"Asthma on the rise in Pune, say health experts","PUNE, Dec. 10 -- Doctors in the city have reported high incidence in the number of asthma cases in the city./While a study released by the pharma company Cipla said that there was a 45 per cent increase in the number of asthma cases in the city 2019, other health experts expressed a similar viewpoint./Dr. Sanjay Mankar, President of Indian Association of Paediatrics, Pune, said, ""Maharashtra is among the top three states in the country with maximum asthma patients. For per one lakh people, there are 2775 asthma patients in the country, out of which 11% may die due to asthma./Paediatrician Dr Tushar Parikh said, ""Increase in smoke, household pollution including incense sticks can also cause asthma. Household pollution is the first source of pollution for children as young as six-months old./The study stated that around one third of the population in the city will develop asthma before the age of 20-years./Doctors who were present at the launch of an awareness campaign for the use of inhalers, on Tuesday, said that although inhalers were the best solution to get asthma under control, the social stigma forced patients to quit using inhalers./The reasons for rise in asthma was attributed to air pollution, increase in air particulate matter, smoking, nutritional deficiency, hereditary predisposition and ignorance amongst parents./Published by HT Digital Content Services with permission from Hindustan Times. For any query with respect to this article or any other content requirement, please contact Editor at /<a href=""mailto:contentservices@htlive.com"">contentservices@htlive.com</a>"
"Sydney smothered with bushfire smoke, AQI over 12 times worse than 'hazardous'","India, Dec. 11 -- Bushfire smoke smothered Sydney on Tuesday, setting off fire alarms, suspending ferry services and triggering health warnings over choking air pollution./The Sydney Opera House and harbor bridge were barely discernible through the thick haze enveloping the city, with smoke stinging the eyes and making it difficult to breathe./The Air Quality Index compiled by the state environment department reached as high as 2,552 in some eastern suburbs -- soaring past the ""hazardous"" threshold of 200. The pollution has been so bad it has set off smoke alarms in office buildings across the CBD, while ash has been washing up on the city's usually pristine beaches. Flight arrivals at Sydney Airport were delayed by up to 30 minutes due to poor visibility./The number of people seeking treatment at Sydney hospitals increased by about 25%, the Australian Broadcasting Corp. cited Richard Broome, New South Wales state's director of environmental heath, as saying. ""It is some of the worst air quality we've seen,"" he said./Authorities warned people with respiratory conditions, or heart and lung problems, to stay indoors. Office workers were seen wearing face masks in the street, an unusual sight in a city more used to clear blue skies and clean air./Temperatures are forecast to soar to 42 degrees Celsius (107.6 degrees Fahrenheit) in the city's west. Rural Fire Service Commissioner Shane Fitzsimmons, who is leading efforts to tackle more than 80 blazes across the state of New South Wales, said it would be a ""very complex, very difficult day"" for his team./Some 2.7 million hectares (6.7 million acres) of land, with a perimeter of 19,235 kilometers, have been burnt so far this bushfire season./The ferocious and early start to the fires this year has stoked a debate around whether Australia's government -- a champion of the coal industry -- is doing enough to curb greenhouse gas emissions. Prime Minister Scott Morrison has repeatedly shut down claims that his government's approach to climate change has contributed in any material way to the current bushfire emergency./The devastating fire conditions were referenced several times at an energy summit in Sydney on Tuesday, where Matt Kean, the NSW state minister for the environment, said a transition to clean energy was inevitable./""Let's call it for what it is: these bushfires have been caused by extreme weather events, high temperatures, the worst drought in living memory -- the exact type of events scientists have been warning us about for decades that would have been caused by climate change,"" said Kean./The wildfires have generated more hotspots in the past two days than any other country, according to NASA satellite data./Published by HT Digital Content Services with permission from Hindustan Times. For any query with respect to this article or any other content requirement, please contact Editor at /<a href=""mailto:contentservices@htlive.com"">contentservices@htlive.com</a>"
Air quality falls across north India,"India, Dec. 12 -- The air quality across north India deteriorated on Thursday, following a sudden fall in temperature, with Ghaziabad in Uttar Pradesh the most polluted across 102 cities monitored by Central Pollution Control Board (CPCB), as winds from the north and west brought pollutants towards the northern plains./Experts said that the high base level in the region led to the air quality being in the ""severe"" category./According to CPCB 4pm buletin, AQI in Ghaziabad on Thursday was 436, in Lucknow 320, and in Kanpur 400. In several parts of western Uttar Pradesh and south Haryana, including Gurugram, Rohtak, Sonipat and Panipat, the AQI was over 400./""Pollution levels are high in December because of the drop in temperature and increase in local biomass burning due to the cold weather,"" said a senior CPCB official, who asked not to be named. Air quality was likely to remain in the ""severe"" zone over the next 24 hours, he said./Since the first week of October, air quality in the northern region hovered between ""poor"" and ""severe"". Till November 20, stubble burning in Punjab and Haryana were said to be the reasons for high air pollutions levels. A sudden dip in temperature, low wind speed, and high humidity were said to be the main reasons for the rapid accumulation of pollutants from local sources. Low temperature and high humidity lead to the formation of mist, haze and shallow fog, which blend with pollutants, and cause air pollution./Mahesh Palawat of Skymet Weather, a private forecasting agency, said only light winds were blowing over the Indo-Gangetic plains for the past few days. ""Dust, vehicular and industrial emissions remain suspended near the ground in the absence of favourable wind speed,"" he said./According to data from the UP Pollution Control Board, Lucknow did not have a single day of ""satisfactory"" or ""moderate"" -- below 100 AQI -- air quality since Diwali./Chief minister Yogi Adityananth on November 1 directed the Uttar Pradesh Pollution Control Board to prevent stubble burning and check other factors contributing to air pollution. On Thursday, state agriculture minister Surya Pratab Shahi said 4,871 incidents of stubble burning were been reported across the state and close to 1,867 first information reports (FIRs) were lodged./In Bihar, where Patna witnessed its worst air quality in decades with AQI touching close to 490 in the first week of November, the government ordered the closing of polluting industries and banned running of vehicles older than 15 years. Diesel autos in municipal areas of Patna will be banned by January 31, 2021, and in other urban pockets such as Danapur, Khagaul and Phulwari Sharif by March 31 the same year, said an official of the state pollution control board on condition of anonymity./On Thursday, environmental advocacy organizations requested Prime Minister Narendra Modi to declare a national health emergency with pollution levels in north India rising at an alarming rate over the last two days./""Almost all of north India, from West Bengal to Punjab, is reeling under severe air pollution, almost verging on 'hazardous'. This is causing irreversible health harm to every single resident of these areas,"" according to The Clean Air Collective, a network of organisations, citizens groups and institutions. ""We request the Prime Minister and all state governments to declare a national health emergency, enforce existing laws on trash and biomass burning strictly, and focus on controlling emissions arising from all sources urgently,"" it said in a statement./(With inputs from Patna and Lucknow)/Published by HT Digital Content Services with permission from Hindustan Times. For any query with respect to this article or any other content requirement, please contact Editor at /<a href=""mailto:contentservices@htlive.com"">contentservices@htlive.com</a>"
Pneumonia deaths in children below five rose by 29.7% in 3 yrs: Govt data for Maharashtra,"Mumbai, Dec. 13 -- Pneumonia deaths among children under five years of age in Maharashtra increased by 29.7% in three years, revealed data from the state public health department. A total of 2,781 children succumbed to the acute respiratory infection from 2016-17 to 2018-19./Government officials attributed the rise in numbers to better reporting from the state's rural districts. Doctors, however, said that, in addition to partial immunisation, factors such as malnutrition owing to poverty and air pollution (especially indoors) are responsible for pneumonia deaths among children. According to officials, two to three children (under age of five) died every day from lung inflammation./In 2016-17, 781 children succumbed to the lung disease, which rose to 987 in 2017-18. This number increased to 1,013 in 2018-19./The data comes at a time when the state has directed that funds be released for vaccinating children against pneumonia at Palghar, Nashik and Gadchiroli./""As pneumonia symptoms are almost similar to that of general flu, families often reach hospitals when the child's condition is critical,"" said an official./""However, reporting of such cases has increased across the state even at community and public health centres owing to rising awareness among citizens and doctors,"" added the official./According to the latest United Nations (UN) report, India had the second-highest number of child-mortality cases due to pneumonia after Nigeria in 2018. According to a study, Fighting For Breath in India, conducted by Save the Children, UNICEF, pneumonia killed more than 1,27,000 under-five years of age children across the country in 2018./""There are different forms of pneumonia. During viral infections, patients generally get better and antibiotics are adequate for bacterial infections. In cases of ventilator-associated pneumonia, patients are administered maximum antibiotic dose as the organisms found only in hospital environments display greater resistance to low dosage,"" said Dr Pallavi Saple, paediatrician and dean of JJ hospital./Doctors said lack of knowledge about pneumococcal vaccines that protects children against the infection is a stumbling block for the state to attain 100% vaccination. ""There is a strong association between pneumonia deaths among children and poverty. The only way one can save children, and especially those suffering from malnutrition, is through vaccination. Awareness needs to be raised through various campaigns, drives, and activities,"" said Dr Behram Pardiwala, internal medicine expert, Wockhardt Hospital, South Mumbai./Rising pollution levels also make children more vulnerable to the deadly infection. According to the World Health Organization (WHO), every year almost 3.8 million people die prematurely owing to household air pollution, of which 45% is attributed to pneumonia./Dr Randeep Guleria, leading pulmonologist and director of All India Institute of Medical Sciences, Delhi said, ""Long-term exposure of air pollutants (nitrogen dioxide and fine particulate matter) affects the pulmonary alveoli, which can become an additional factor in the development of pneumonia.""/Dr Vikrant Shah, consulting physician, intensivist and infectious-disease specialist, Zen Multispeciality Hospital, Chembur, said, ""Around half of all pneumonia-related deaths are associated with air pollution. Environmental factors have a substantial impact on the pulmonary system. Children with lesser immunity develop community-acquired pneumonia, which also adds to their comorbid conditions such as chronic obstructive pulmonary disease.""/Pneumonia is a form of acute respiratory lung infection that occurs due to bacteria, virus, and fungi. Children under five years and senior citizens (over 65 years) are most susceptible to the infection./Published by HT Digital Content Services with permission from Hindustan Times. For any query with respect to this article or any other content requirement, please contact Editor at /<a href=""mailto:contentservices@htlive.com"">contentservices@htlive.com</a>"
Air quality falls across north India,"New Delhi, Dec. 13 -- The air quality across north India deteriorated on Thursday, following a sudden fall in temperature, with Ghaziabad in Uttar Pradesh the most polluted across 102 cities monitored by Central Pollution Control Board (CPCB), as winds from the north and west brought pollutants towards northern plains./Experts said that the high base level in the region led to the air quality being in the ""severe"" category./According to CPCB 4pm buletin, AQI in Ghaziabad on Thursday was 436, in Lucknow 320, and in Kanpur 400. In several parts of western UP and south Haryana, the AQI was over 400./""Pollution levels are high in December because of the drop in temperature and increase in local biomass burning due to the cold weather,"" said a senior CPCB official. Air quality was likely to remain in the ""severe"" zone over the next 24 hours, he said./Since the first week of October, air quality in the northern region hovered between ""poor"" and ""severe"". Till November 20, stubble burning in Punjab and Haryana were said to be the reasons for high air pollutions levels. A sudden dip in temperature, low wind speed, and high humidity were said to be the main reasons for the rapid accumulation of pollutants from local sources. Low temperature and high humidity lead to the formation of mist, haze and shallow fog, which blend with pollutants, and cause air pollution./Mahesh Palawat of Skymet Weather, a private forecasting agency, said light winds were blowing over the Indo-Gangetic plains for the past few days. ""Dust, vehicular and industrial emissions remain suspended near the ground in the absence of favourable wind speed,"" he said./According to data from UP Pollution Control Board, Lucknow did not have a single day of ""satisfactory"" or ""moderate"" air quality since Diwali./Chief minister Yogi Adityananth on November 1 directed the UP Pollution Control Board to prevent stubble burning and check other factors contributing to air pollution./In Bihar, where Patna witnessed its worst air quality in decades with AQI touching close to 490 in the first week of November, the government ordered the closing of polluting industries and banned running of vehicles older than 15 years./On Thursday, environmental advocacy organizations asked Prime Minister Narendra Modi to declare a national health emergency with pollution levels in north India rising at an alarming rate over the last two days./""Almost all of north India is reeling under severe air pollution, almost verging on 'hazardous'. This is causing irreversible health harm to all residents,"" according to The Clean Air Collective, a network of organisations, citizens groups and institutions. ""We request the Prime Minister to declare a national health emergency,"" it said./Published by HT Digital Content Services with permission from Hindustan Times. For any query with respect to this article or any other content requirement, please contact Editor at /<a href=""mailto:contentservices@htlive.com"">contentservices@htlive.com</a>"
