headline,body
Obesity costing world economy $2 trillion a year,"LONDON: Obesity is costing the world more than almost as much as smoking or terrorism and war./The epidemic - one-third of the world's population is overweight or obese in 2013, is costing Britain almost \xA347 billion a year, while globally, it is costing the world economy $2 trillion a year in health costs and lower productivity, according to a study from the McKinsey Global Institute (MGI)./Obesity ranks far more costly than alcoholism, climate change, air pollution and drug problems and falls just behind armed conflict and smoking in terms of the most costly human-generated burdens./The financial loss to obesity is equivalent to Russia's gross domestic product (GDP)./In UK, obesity is second only to the \xA357 billion annual toll smoking takes on the economy./MGI said, ""Today obesity is jostling with armed conflict and smoking in terms of having the greatest human-generated global economic impact""./MGI said that obesity is a critical global issue that requires a comprehensive, international intervention strategy. More than 2.1 billion people - nearly 30% of the global population - are overweight or obese./MGI said, ""That's almost two-and-a-half times the number of adults and children who are undernourished. Obesity is responsible for about 5% per cent of all deaths a year worldwide and its global economic impact amounts to roughly $2 trillion annually or 2.8% of global GDP - nearly equivalent to the global impact of smoking or of armed violence, war, and terrorism""./""And the problem - which is preventable - is rapidly getting worse. If the prevalence of obesity continues on its current trajectory, almost half of the world's adult population will be overweight or obese by 2030,""/The MGI paper, ""Overcoming obesity: An initial economic analysis,"" seeks to overcome hurdles by offering an independent view on the components of a potential strategy./MGI has studied 74 interventions that are being discussed or piloted somewhere around the world to address obesity, including subsidized school meals for all, calorie and nutrition labelling, restrictions on advertising high-calorie food and drinks and public-health campaigns./""We found sufficient data on 44 of these interventions. Existing evidence indicates that no single intervention is likely to have a significant overall impact. A systemic, sustained portfolio of initiatives is needed to reverse the health burden. In the UK, such a program could reverse rising obesity, saving the national health service about $1.2 billion a year,"" MGI said./The UK spends less than \xA3638 million a year on obesity prevention programmes - about 1% of the country's social cost of obesity, the study found. But the country spends about \xA36 billion a year on the medical costs of conditions related to being overweight or obese and a further \xA310 billion on diabetes, it claimed./(Photo: )/The recommended interventions to reduce the cost of obesity include: Portion control in fast food packaged goods, investing in parental education, introducing healthy meals in schools and workplaces, changing the school curriculum to include more physical exercise and encouraging more physical activities by introducing bicycle lanes./For Reprint Rights: timescontent.com"
Waste-burning thickens smog cover over NH-24,"GHAZIABAD: Haze is not uncommon in this city, particularly in winter./But, this year's smog is worsened by the burning of industrial and bio-degradable wastes from fields, which environmentalists say have been causing large-scale air pollution./In fact, smog has affected the visibility on NH-24 also. At times, the green activists claim that wastes burn for hours on end, thereby generating large quantities of smoke, which combined with fog makes for smog, posing a great risk to commuters on the highway./The activists blame the city's civic agencies and the state pollution control board for ignoring the problem./""The burning of straw and agricultural waste is what aggravates the problem. Ideally the wastes should be disposed of in a scientific manner, which is not being done. And, the civic authorities turn a blind eye to it,"" said environmental activist Vikrant Tongad./He added, ""Disposal of municipal solid waste and industrial solid waste by burning is rampant in the city. Even electronic waste like computer keyboards and defunct mobiles is also contributing to smoke and air pollution. The pollution board is also silent on this.""/When this correspondent visited Kavinagar Industrial Area, he found a fire raging in front of a factory. Locals claimed that was industrial waste being burnt./However, when contacted, RK Singh, the commissioner of Ghaziabad Nagar Nigam (GNN), tried to play down the problem. ""The burning of municipal waste in the city is not being done by us but is being done by the people. But the problem is not so grave,"" he told TOI./Though Singh admitted that burning of industrial waste in Bulandsahar Road and Kavinagar Industrial areas ""does add up to the problem of smog"", he said that it's the district pollution board which has the right to penalize erring individual/company, under the Air (Prevention and Control of Pollution) Act, 1981./When the issue was brought to the notice of Ghaziabad Pollution Control Board chief Paras Nath, he quipped, ""GNN is responsible for pollution due to burning of municipal waste.""/For Reprint Rights: timescontent.com"
"Delhi choking on foul air, time to clean up","Your early morning routine of a walk and workout out doors this winter is likely to endanger your health rather than give you any benefits. What you may believe to be fresh morning air is anything but that. There are fine pollutants hanging in the air that get into your lungs, gradually reducing its capacity.And for those who already have a respiratory condition, any strenuous exercise or exposure outdoors is a clear invitation for trouble. Doctors say they should remain indoors during early morning hours to avoid their condition getting aggravated./According to traditional wisdom, morning air is the purest. In fact, pollutants such as ground-level ozone (O3) are at their lowest level in the morning and peak only later in the day. Ozone, which is also associated with compromised lung function, may impact people towards afternoon./But in Delhi, PM 2.5 levels seem to be peaking in the morning, especially betwe ing, especially between 6 am and 10 am. Scientists attribute this to low temperatures and calm conditions that lower the boundary layer (lowest part of atmosphere), trapping particulate pollution near the surface.The same phenomenon reduces visibility and the city appears to be in a haze./""We are seeing a trend of high particulate pollution from 7 pm to 7 am, sometimes even till 10 am. This is not just because of high emissions but because as it gets colder, pollutants are trapped. It starts getting better once the sun is out and it's relatively warmer,"" says Gufran Beig, chief scientist at SAFAR, Indian Institute of Tropical Meteorology (IITM), which monitors air quality at ten air monitoring stations in NCR, including Noida./Delhi Pollution Control Committee's (DPCC) real-time monitoring at six other stations in Delhi reflects the same trend with PM 2.5 hovering around 150 to 200 micrograms per cubic metre, two to three times the national safe standard of 60. India doesn't maintain a national air quality index (AQI) yet but the ministry of environment and forests has launched an AQI that will be operational in a few months. According to the AQI, PM 2.5 levels ranging from 121 to 250 make the air ""very poor"" and this ""may cause respiratory illness on prolonged exposure. The effect may be more pronounced in people with lung and heart diseases.""/Experts at Centre for Science and Environment (CSE) believe that trucks plying inside the city could be causing an increase in PM levels at night. ""I think there are two things happening. Trucks are emitting at night which is leaving even early mornings polluted. The second reason is that nights are very cold which brings down the boundary layer. But our analysis too shows three peaks in air pollution levels - late night, early morning and evening. There is a slight dip in the afternoon usually,"" says Anumita Roy Chowdhury, head of CSE's clean air programme. A DPCC official, who didn't wish to be quoted, said: ""The condition is quite bad in Delhi, especially in the mornings. I would suggest people speak to their physicians and follow their advice."" In Chinese cities where pollution levels are comparable with Delhi, people working outdoors have started using N 95 masks that reportedly filters almost 90% of fine pollution particles./Doctors meanwhile are seeing a steep jump in hospital admissions of patients with chronic obstructive pulmonary disorder and acute bronchitis.""People who have any respiratory illness should avoid stepping out early mornings for two reasons-it's cold and it's polluted.We always advise them to go out when its sunny. Every year, we see a 20% to 25% increase in complications associated with respiratory disorders during this time,"" said Dr Arup Basu, senior consultant, chest medicine, Sir Ganga Ram Hospital./RISK OF BEING AN EARLY BIRD/If you are stepping out early in the morning to catch that fresh air while on a walk, think again. The air quality in the city is very poor, particularly between 5.30am and 10am.The tiny PM 2.5 particles which infiltrate your lungs do the maximum damage. Noon or afternoon, when it's sunny and clear, may be a better idea./The System of Air Quality, Weather Forecasting and Research (SAFAR), Indian Institute of Tropical Meteorology (IITM), also monitors pollution in the city. This was how the graph of hourly averages looked on November 20, 2014 (the latest available)/The culprit/PM 2.5 refers to tiny particles or droplets in the air that are two-and-a-half microns or less in width. There are about 25,000 microns in an inch. When outdoor levels of PM 2.5 are elevated, staying indoors may reduce your exposure although some outdoor particles will come indoors. Some ways to reduce exposure are to limit indoor and outdoor activities that produce fine particles (for example, burning candles indoors or open burning outdoors) and avoiding strenuous activity in areas where fine particle levels are high -New York state department of health/Health impact/Numerous scientific studies have linked particle pollution exposure to a variety of problems, including premature death in people with heart or lung disease, non fatal heart attacks, irregular heartbeat, aggravated asthma, decreased lung function and increased respiratory symptoms, such as irritation of the airways, coughing or difficulty in breathing. People with heart or lung diseases, children and older adults are the most likely to be affected by this. -US EPA/Delhi Pollution Control Committee (DPCC), besides other agencies, does real-time monitoring of the pollutants. The following were the half-hourly averages for PM 2.5 (in microgram per cubic metre) recorded by DPCC for Nov 25, 2014, at three stations. (Safe limit is 60 according to National Ambient Air Quality Standard for India)/TOI'S 7-POINT ACTION PLAN FOR A LUNGFUL OF PURE AIR/Given that Delhi is the world's most polluted city according to WHO, immediate steps are needed to clean up the city's air, some of them pretty radical/1 Make it mandatory for diesel cars to have Euro 5 emission standards. This requires an expensive filter (cost about Rs 1 lakh per car). All new diesel cars \xAD that is around half of all new cars \xAD should conform to Euro 5. We would suggest so should the older diesel cars/2 Improve quality of diesel./Govt must insist that refineries supply lowsulphur diesel to cities. Euro 5 emission standards require low-sulphur diesel/3 Bring down over 3 years the price gap between diesel and petrol so that the incentive for diesel vehicles is reduced/4 Don't just use a broom to displace road dust from one place to another. Acquire an adequate fleet of mechanized vacuum cleaning vehicles that will suck out road dirt and dump it in designated pits outside the city/5 Enforce the ban on burning dry leaves. This problem is the worst in Lutyen's zone where gardeners of large bungalows tend to burn dry leaves in back lanes/6 Build a world class public transport system so that private cars are fewer on roads. While the Metro is terrific for the city, there has to be effective last-mile public transport connectivity/7 Plant more trees so that Delhi reaches the internationally mandated 33% tree cover for cities. This will bring down dust \xAD a key offender, apart from vehicular emission, for high suspended particulate matter in the Delhi air/For Reprint Rights: timescontent.com"
Burning of leaves: Agencies pass buck,"NEW DELHI: Dry leaves, which are a precious resource for making compost, are more often being burnt in the city. Smoke from such biomass burning is adding to Delhi's severe smog crisis and very high particulate pollution but agencies seem to be oblivious to this threat. Despite a ban on burning biomass waste, no FIR has been registered against the offence by any civic agency since the ban was imposed in July 1998. Delhi government's departments are busy passing the buck, claiming that none of them has the manpower or competence to crack down on offenders. But with National Green Tribunal ordering action against such burning on Wednesday, the agencies may be roused from their stupor./Every evening, small bonfires of dry leaves are a common sight in the heart of the city. People are often seen soaking in the warmth, not realizing how this will impact the already poor air quality in the city./Bhure Lal, head of Environment Pollution Control Authority (EPCA), a body constituted by the union government to monitor environmental issues in Delhi, says burning of dry leaves is very common in Lutyens' Delhi. ""It's supposed to be cleanest area of the city but I have seen so many instances here, especially in front of the Iraq embassy. This cannot be resolved until government agencies take action. There are nodal officers from New Delhi Municipal Council (NDMC) and Delhi Pollution Control Committee (DPCC) who are to be contacted when there is such burning,"" he adds./According to DPCC's/legal team, biomass waste burning is banned under the environment protection act and has provisions for up to five years of imprisonment and a Rs 1 lakh fine./Civic agencies claim they can't do much as they don't have the power to take action on private property. Also, identifying the person responsible for it is difficult, say municipal officials. Though a law is in place, there is confusion over its implementation. The civic agencies claim that action has to be taken by DPCC, but the latter says it doesn't have the manpower to carry out routine checks and that the responsibility has now been given to Delhi Parks and Gardens Society (DPGS)./""We don't have the power to take action against private properties or people. We can only complaint to DPCC. We can take action against our own staff if they are caught burning leaves,'' says Yogender Chandolia, mayor of North Delhi Municipal Corporation. DPGS, on the other hand, claims that its role is limited to creating awareness and that it doesn't have the manpower to keep a watch on such activities./NDMC too claims helplessness in taking action. ""There is a provision to file an FIR against a person for burning dry leaves as it adds to air pollution. But most of the time, we don't know who the culprit is,'' said an official in NDMC's horticulture department./NDMC is, however, planning projects for effective utilization of green waste. It has set up four green waste management plants at Lodhi Road, Nehru Park, Talkatora and Sunder Nursery. Each plant can process two tonnes of green waste and convert it into pellets which can be used as bio-fuel. ""We are planning to set up 13 more such plants so that we can process the entire waste within our area. At present, the green waste collected from streets and markets is sent to the composting site at Okhla,'' reveals a senior NDMC official./An emissions inventory prepared by System of Air Quality Weather Forecasting and Research (SAFAR), under the ministry of earth sciences, shows burning of biomass within 50km of Delhi increases emissions by at least 15%. In the city's surroundings, even tyres, plastics and tubes are burnt and these release cancer-causing chemicals like dioxin. ""Burning dry leaves mainly releases PM10 (coarse pollution particles) and carbon monoxide, but burning tyres releases dioxin, black carbon and PM 2.5 (fine respirable particles),"" said Gufran Beig, chief scientist at SAFAR./For Reprint Rights: timescontent.com"
"Pollution checking drive in Bhagalpur, 25 vehicles seized","BHAGALPUR: With a view to checking air-pollution vis-\xE0-vis vehicle emission, the district transport office (DTO) has launched a 'Go green campaign' in Bhagalpur district. The transport department's endeavor is to ensure that all the vehicles running on the roads adhere to pollution norms and do not add to air pollution./In order to ensure that the vehicles on road adhere to the pollution norms, the district transport office has installed air-pollution test kits at two places and has ordered the vehicle owners to get the fitness of their vehicles certified from the test centers about the level of fumes or pollutants being emitted by the particular vehicles./It may be mentioned here that exposure to air pollution leads to respiratory and cardiovascular diseases. According to statistics, air pollution caused for 6,20,000 early deaths till 2010 across the country. As such, Bharat stage emission standards was set up by the Government of India to regulate the output of air pollutants from internal combustion engines including different types of motor vehicles. The standards and the timeline for implementation were fixed by the Central Pollution Control Board under the ministry of environment and forests and were first introduced in 2000, but now are being enforced strictly across the country in view of reports that many vehicles run flouting air-pollution norms./More than 450 vehicles have been checked during the 'Go green campaign' in Bhagalpur district of which 135 were found lacking air-pollution norms (fitness) certificate while 25 vehicles were seized for causing major air-pollution. The DTO collected Rs 1.4 lakh by way of penalty from the vehicles lacking air-pollution fitness certificate./District transport officer Jawaharlal Singh said the operation has been launched in the district following reports about vehicles not adhering to the air-pollution norms besides not getting their vehicles checked at air-pollution test centers and not keeping fitness certificate./MVI Santosh Kumar said surprise checking will also be undertaken apart from regular checking. Four more centers for examining the air-pollution fitness of the vehicles are being opened at different locations in the district, he said and added the campaign is also aimed at creating awareness about air pollution./For Reprint Rights: timescontent.com"
Residents fume as garbage burning continues in Devguradia,"INDORE: Miffed over the continuous burning of garbage at Devguradia trenching ground that has led to a rise in pollution and health hazards, scores of people from over a dozen townships located on Bypass Road started a signature campaign to register their protest on Sunday./Over the years, several townships have come up in the vicinity of Indore Municipal Corporation's trenching ground and the burning of garbage is causing a lot of inconvenience to the residents./""The hazardous smoke emitted from burning debris is causing several health problems and people are forced to remain indoors. We cannot open our windows even during nights,"" said Sameer Karamvirkar, a resident of Kalandi Mid Town./Pushpa Sharma, a resident of Silver Spring township, said that residents of all the townships have joined hands to raise their voice against pollution caused due to burning of waste. ""Not only air, but even our ground water has got contaminated due to garbage dump,"" said Sharma. He added that besides, residents of townships, villagers from dozen of villages and educational institutions in the region are facing a tough time./Not only the humans, but even animals and plants are facing problems due to the pollution caused by burning of garbage at trenching ground. Two years back, forest department had written a letter to IMC expressing concern over hazardous effects of burning garbage over flora, fauna and wild animals at Ralamandal Wildlife Sanctuary, which is located close to Devguradia trenching ground./During hearing of a case over garbage in September 2013, Madhya Pradesh Pollution Control Board (MPPCB) in its affidavit had mentioned that around 4 km stretch near Devguradia trenching ground has been highly polluted due to huge pile of municipal waste and unauthorized burning of garbage, leading to low visibility and foul odour./MPPCB had mentioned that around 23,000 to 25,000 metric tonnes (MT) garbage is being dumped at the trenching ground every month, of which only 4500 MT garbage is being processed in a month. At present, 2.5 lakh MT of garbage is piled up at the ground./MPPCB has already filed a complaint against A2Z Company, which has the contract for collection and disposal of garbage, under Sections 21, 22, 37 and 40 of Pollution Free Environment Act. MPPCB had also informed urban administration department about air pollution in and around trenching ground. The report has also pointed out that residents are left to encounter problem of foul smell./For Reprint Rights: timescontent.com"
Law routinely broken right under nose of high & mighty,"NEW DELHI: Lutyens' Bungalow Zone, the 26-sq-km zone populated by ministers, generals and judges, is a big culprit behind air pollution in the city. The gardeners here routinely break the law by burning dry leaves, which is banned under the Environment Protection Act and is punishable with up to five years of imprisonment and Rs 1 lakh fine./Every morning the area is under a pall of smog due to the emissions overnight. Ashes from these bonfires can be spotted outside the bungalows. Most of the gardeners don't know they are breaking the law when they burn leaves. Nor do they know that they are harming themselves the most as they are the closest to/the smoke./It would appear our top ministers, law-makers and judges haven't taken the trouble to educate their gardeners--that they are committing an illegality when they burn leaves and harming themselves in the process. Nor have they told their staff about composting dry leaves which doesn't require any expensive technology./According to Chintan, an NGO working on waste management, composting can be laid in layers in the parks and covered with a wire mesh so that these don't fly around. Water can be sprinkled at regular intervals to enable it to mulch. This is already being done at the Neeti Bagh community centre. It can also be just buried in pits in the garden or avenues./The list of VVIPs in LBZ is long. Narendra Modi, Sonia Gandhi, Manmohan Singh, Rajnath Singh, Mulayam Singh Yadav, Mayawati, SC judges A K Sikri, V Gopala Gowda and Fakir Mod Ibrahim, attorney-general Mukul Rohatgi and additional solicitor-general L Nageswar Rao, election commissioner Nasim Zaidi--to name just a few. They run the country and yet allow an illegality right under their nose./According to an emissions inventory prepared by the System of Air Quality Weather Forecasting and Research (SAFAR) under the ministry of earth sciences, emissions increase by at least 15% due to waste burning in a 50km radius of Delhi. While dry leaves, twigs, paper and cardboard are often set on fire to create winter bonfires in the city, in surrounding rural areas tyres, plastics/and tubes are burnt releasing carcinogenic emissions like dioxin. Burning of dry leaves can contribute to PM2.5 (fine, respirable pollution particles)/significantly./The problem is that when VIPs break the rules, enforcement agencies look the other way. However, NDMC secretary Nikhil Kumar promises action. ""We have directed our staff to check burning of green waste in the New Delhi area. We will take stringent action against people if they are found doing so,'' said Nikhil Kumar, secretary, NDMC./For Reprint Rights: timescontent.com"
