headline,body
Doctors sound alarm on pollution affecting kids lung power,"INDORE: Sounding a note of caution on dangers of pollution on human health, doctors said curb on pollution level will enable our future generations to live longer survive. Doctors and researchers point out rising pollution in the city's ambience is directly linked to reduced lung capacity of human race, leading to shorter and sicker lives./Listed as fifth largest polluted city in the country, exposure of city residents especially children to alarmingly high level of particulate matter is an invitation to a host of diseases, including respiratory disease, chronic obstructive pulmonary disorder and lung cancer./Number of deaths due to pollution is rising and, if left uncontrolled, there would be at least 2,500 deaths due to pollution in 2020 in the city, as per Simple Interactive Model-SIM-Air Working Paper Series survey conducted by Mumbai-based Urban Emission Group. A survey of school children by India's Central Pollution Control Board (CPCB) has found a higher prevalence of upper and lower respiratory disease symptoms and lung function deficits compared to age-and sex-matched rural controls. It showed respiratory problems in 32% of children examined in Delhi, in contrast to 18.2% of rural children. Reduced lung function was recorded in 43.5% of school children in Delhi compared to 25.7% in villages./District TB officer and chest specialist Dr Vijay Chhajlani said, ""Studies have linked rising pollution to reduced lung capacity. In kids, lung function test have proved that capacity to inhale and exhale air reduces if exposure to pollutants is high."" He said problem can be solved when every individual start thinking of what legacy they are leaving for next generation and start making individual efforts to minimize societal problems./Another expert Dr Manish Siddha said, ""Pollution has more harmful effect than smoking. Though smoking is equally harmful, smoke and vehicle exhaust have harmful effect on kids as their immunity level is low and they are more prone to respiratory problem. We need to think where we are heading.""/In Indore, air pollution claims 1,800 lives every year with around 2,500 others ending up in hospitals. The revelation had come from transport minister Bhupendra Singh while replying to a query from MLA Sudharshan Gupta over increasing air pollution in commercial hub of the state./Transport minister had assured the House that a drive against vehicles with expired registration will be carried out soon and such vehicles would not be allowed to run on road. The government will also take steps to check level of dust particles in air. But they only proved words./For Reprint Rights: timescontent.com"
'Pollution masks hinder work',"AGRA: The UP government's attempt to protect traffic constables from pollution by ordering them to wear a pollution-mask has proved to be a damp squib in the city. The police personnel on traffic beat here have not taken kindly to the government directive and are resisting the idea of wearing masks. They have cited reasons like the masks are uncomfortable and a hurdle in blowing the whistle while managing traffic./Acknowledging that traffic cops are exposed to high levels of pollution during their duty hours at the city's crossings and intersections, the state government issued directives to the traffic departments of various big and small cities to provide masks to traffic constables who manage traffic at busy and prominent crossings. The masks were to be given to the traffic personnel who address maximum crowd and face pollution during working hours./Each constable has to manage traffic for eight hours. At least three constables are deployed on busy roads in three-hour shifts. During their duty they are exposed to vehicles spewing gases and dust in the air./According to sources, the city traffic department procured the masks with the help of NGOs and government funds. The masks were given to traffic constable at Sultanganj ki Pulia, Sikandara crossing, Hariparwat and water-works to name a few. Even after knowing that these masks can save them from severe health problems like respiratory infections, heart disease and lung cancer, the traffic cops resisted donning them./A traffic constable at Sultanganj ki Pulia said the pollution mask that has been given to him makes him feel choked. ""Sometimes, it is difficult to breathe. They (masks) are usually not good and make us feel uncomfortable. So, you hardly see any policemen wearing these masks,"" he added./Another traffic constable said the belt of the mask is extremely tight and difficult to wear all day long. He added, ""We have to take off the mask to whistle while controlling traffic which is inconvenient.""/At the same time, the traffic cops admitted that they often suffered from respiratory and skin-related aliments but could not suggest any solution to these problems. However, they were adamant about not wearing the masks./Health experts, however, claim that traffic cops are exposed to toxic exhaust for long hours which pose a threat to their lungs in the long run. The hazards get severe when the duty hours are long. ""Traffic cops have to undergo strain in a polluted environment due to smoke emitted by vehicles, high decibel sound of horns and dust. I am treating many traffic cops who are facing health hazards due to smoke and dust,"" said Dr Sudhir Chaudhary, a lung and chest expert./He warned that constant exposure to air pollution could lead to difficulty in breathing, wheezing, coughing, asthma and aggravation of existing respiratory and cardiac conditions. These effects can result in increased medication use, increased doctor or emergency room visits, more hospital admissions and even premature death./SP, traffic, Ashok Kumar Tripathi said wearing the mask wearing is not mandatory here but the masks have been given to the cops after the government directive. The officials also claimed that traffic cops must wear these masks and if the cops have any type of inconvenience wearing them, they can report about it./For Reprint Rights: timescontent.com"
Board tested dump yard air for toxins just three times since 2011,"CHENNAI: Despite garbage frequently catching fire or being set ablaze at the Kodungaiyur and Perungudi dump yards and repeated complaints from residents of localities nearby about smoke and health problems, the Tamil Nadu Pollution Control Board (TNPCB) has collected air samples from the sites to test for toxins only thrice since 2011./Data obtained by TOI through an RTI application has found that the board tested air at Kodungaiyur just once, in 2011-12, when it collected six samples. It tested the air in Perungudi on two occasions, collecting four samples in 2012-13 and two in 2013-14./Of the six samples from Kodungaiyur, three contained respirable suspended particulate matter (RSPM) well in excess of the maximum permissible limit of 100 ug/m3 (micrograms per cubic meter of air)./In Perungudi, the board found two of the four air samples collected in 2012-13 and one of the two collected in 2013-14 had higher than permissible RSPM levels./Research has shown that exposure to air with an RSPM levels in excess of 100ug/m3 causes a wide range of health problems, including respiratory illnesses and cancer./The corporation and private sanitation company Ramky Enviro unload more than 4,500 tonnes of garbage into the Kodungaiyur and Perungudi dump yards every day and ragpickers often set fire to garbage to collect metal. But Corporation of Chennai's public health department has not conducted a single check on residents of localities surrounding the dump yards for possible problems as a result of air pollution. The residents say many families suffer from respiratory disorders./Tests by Community Environmental Management and Global Alliance for Incinerator Alternatives in 2012 showed that air around the Kodungaiyur yard contained at least 19 toxic chemicals and carcinogens./A TNPCB official said the board does not have the equipment to monitor air pollution. ""We plan to install ambient air quality monitors in these areas as soon as possible,"" he said./Environmentalist Nityanand Jayaraman says the Swachh Bharat campaign is a good initiative but officials remain removed from ground realities such as the fallout of dumping garbage in open sites within the city. ""People in areas near the dump yards are fed up with air and water pollution. The corporation should shut down the dump yards,"" she said./For Reprint Rights: timescontent.com"
Diwali in 'D Company' grip,"KOLKATA: If you are planning to celebrate Diwali with light, not sound, beware of the 'D Company'. And the dreaded D is not the notorious terrorist and crime boss, but rather ""Duplicate"" - counterfeit fireworks that threaten to play havoc with your health./""D Company"" is the code with which numerous retailers in the city are referring to counterfeit fireworks that have flooded the market this year. For the casual buyer, they are almost impossible to distinguish from fireworks manufactured by reputable brands, since the packaging - even down to the holograms - have been done extremely well, said a police source./The most important - and crucial - differerence from branded firecrackers is that they spew a whole lot of poisonous chemicals in the air, leaving Kolkatans vulnerable to a host of serious diseases, ranging from temporary distress to even cancer, said doctors and pollution experts. And some of them can be downright dangerious to boot./""The main problem with counterfeit fireworks is that they do not conform to any emission or safety norms,"" said Somendra Mohan Ghosh of the NGO Saviour and Friends of Environment (SAFE). He, along with his colleague Sudipto Bhattacharjee of the NGO, collected samples of such fireworks to measure their noise and emission levels./""So, besides swindling customers, the fireworks will pollute the city's air. A lot of these, being packaged as noiseless fireworks, will actually create a lot of noise,"" Ghosh added./Kolkata's air, which is already polluted at the best of times, can't just bear such a huge amount of pollutants, felt Bhattacharjee. ""Everyone speaks of the high noise pollution during Diwali, but air pollution becomes the worst hit, because of the illegal fireworks. The heavy metal pollution is the worst culprit,"" he added./""It's very difficult to distinguish them from the label or hologram, but the sellers know them it all. The real picture would emerge if the law-enforcers raid the fireworks hubs in Burrabazar to collect samples and carry out the tests,"" he added./There is also a threat from fireworks of foreign origin that are being brought into Kolkata under false declarations. ""Various fireworks associations have informed us that these smuggled items include the chemical potassium chlorate, which is a hazardous chemical and can ignite or explode spontaneously,"" said a fire brigade officer. Chinese fireworks are said to be especially dangerous in this way./Inhaling fumes emitted by firecrackers not only makes one cough, go breathless and suffer from throat irritation, but it also worsens pre-existing conditions such as asthma, bronchitis and pneumonia. Children and the elderly with lung diseases are especially vulnerable, warned health experts. ""The level of air pollution during Diwali reaches almost 'poisonous' levels. As responsible citizens, we need to bring awareness about the harm we cause ourselves and our neighbours when we pollute the air by bursting firecrackers,"" said preventive healthcare expert Debasish Basu./For Reprint Rights: timescontent.com"
Air pollution on Diwali getting worse,"NEW DELHI: The festival of light seems to be the worst time for people suffering from asthma and other respiratory diseases with the city's air quality deteriorating with each passing year during Diwali. Even the Delhi government's campaign against crackers has failed to bring down the pollution levels./An analysis of levels of various pollutants on Diwali day since 2010 reveals a disturbing trend. Levels of some pollutants, including sulphur dioxide (SO2) and nitrogen dioxide (NO2), seem to be on the rise./The levels of particulate matter (PM) 2.5 (particles smaller than 2.5 micrometres), which have serious health implications as these tend to get lodged in the lung and can even enter the bloodstream, have been seven to eight times higher than the standard level for several years./PM 2.5 is associated with a number of health impacts such as asthma, bronchitis, chronic respiratory symptoms including, shortness of breath and painful breathing, and premature deaths. High SO2 levels are also linked with inflammation of airways and severe breathing difficulty./Meanwhile, the Delhi Pollution Control Committee (DPCC) on Friday announced that it had formed seven teams to assist DCs and visit various areas to check noise levels on Diwali. It asked the Delhi Police to ensure that the total number of firecracker licences issued this year should not exceed the last year's figure./List of licences granted to be displayed on the official website of licensing unit of the Delhi Police, a copy of which is to be given to the DPCC./Sub-divisional magistrates have been asked to organize meetings with RWAs to sensitize them about of Supreme Court directions regarding complete ban on bursting of sound emitting firecrackers between 10pm and 6am./As far as air pollution is concerned, Anand Vihar seems to be the worst affected. PM 10 (coarse particles) levels have been 10 to 13 times higher than the standard level in 2012 and 2013,/PM 2.5 levels have been about seven to eight times the standard. Experts say heavy traffic in Anand Vihar and vehicles from Ghaziabad may be adding to the Diwali emissions. ""We have noticed that even on regular days, air pollution levels are on the higher side in Anand Vihar, Civil Lines and IGI Airport. In Anand Vihar, the interstate traffic may be causing levels to go up. As for high SO2 levels, they may be from imported crackers that seem to have high sulphur content,"" said Anumita Roy Chowdhury, head of clean air programme at the Centre for Science and Environment (CSE)./M P George, scientist at the DPCC air lab, said Anand Vihar's high particulate matter levels could also be linked to the industries near the Delhi border./Delhi Pollution Control Committee had tested firecracker samples recently and found most of them to be flouting the Explosives Rules, 2008, as their manufacturers did not mention the chemical composition on the packages. This means that there is no monitoring of the heavy metals that are also emitted from crackers./""You will notice that a lot of colour crackers are being used now. So they are not just noisy and polluting, they may be causing toxic pollution due to presence of heavy metals. We are not even aware of what health impacts these coloured and imported crackers may be causing,"" added Roy Chowdhury./For Reprint Rights: timescontent.com"
Magical winterline makes appearance in Mussoorie,"Prachi Raturi Misra/MUSSOORIE: It's that view of the mountains that would serve as an inspiration to Nicholas Roerich. Brilliant orange meets magical mauve and there's a hint of red - the magical Mussoorie winterline has made its first appearance of the season./The winterline is a phenomenon unique to Mussoorie and parts of Switzerland, caused by the refraction of sunlight at a particular angle, and visible from mountain areas with a long, clear view of a valley towards the west. The phenomenon can be seen mid-October to January, at sunset, as the sun drops behind a false horizon creating a grey and mauve strip./The view is so rare and unique that that efforts were made last year to make the winterline a tourist draw, with the 'Winterline Carnival'./Author Bill Aitken who made Mussoorie his home years ago has just returned from a trip to Delhi, and says he cannot wait to see the winterline each evening: ""Until you go out of Mussoorie, you don't realize what you are missing everyday,"" he says./Sandeep Sahney, member of the state Tourism Development Board, also the man who conceptualized the winterline carnival, said, ""The winterline is God's unique creation and I feel privileged to have seen it through the years. It is a photographer's delight and we want to popularise it.""/The view, however, is going to be a bit hazy for a while, met department officials said./Anand Sharma, director of the meteorological department office at Dehradun, says, ""There is moisture in the air which is causing a haze. We also expect some western disturbances around Oct 24-26. Then, of course, there is the air pollution around Diwali that will dim the view. Once all these things settle, the winterline should be visible again.""/For Reprint Rights: timescontent.com"
Crackers will choke the air for three weeks,"Bangalore: Bhoomika GK, 32, a bank employee and resident of Ullal, West Bangalore, decided to skip her morning walks for the next 10 days. Her doctor-friend advised her not to venture out, especially in the morning and evening, as the air will be thick with cracker-produced pollutants during Diwali and the days to follow./According to Karnataka State Pollution Control Board (KSPCB) estimates, the pollutants will linger on in the air for at least three weeks./KSPCB chairman Vaman Acharya said suspended particles and remains of some heavy metals emitted due to bursting of crackers, stay in the air for several days after Diwali. Some of these are dangerous as they trigger respiratory problems, especially for those suffering from asthma. Bursting of crackers inside closed premises and congested areas are even more dangerous as the pollutants stay trapped there for long,"" he added./""According to our estimates, air pollution levels went up by 34% during last Diwali compared to normal days. Regular monitoring of pollutants during the post-festival period showed that they stayed on for three weeks. Both smoke and light-emitting crackers have harmful effects. Made of chemicals like sulphur, nitrate and heavy metals, they affect health in different ways,"" said a senior board official./Another official with KSPCB said this time round, Diwali is followed by an extended weekend which could mean bursting of more crackers. B Nagappa, scientific officer, said fine dust and ash molecules produced during the festival shoot up to 1 km in the air and gradually settle down. These deposits can harm people in the long run./""Following Supreme Court guidelines, the government framed strict norms on the level of chemicals to be used while manufacturing crackers. In a way, we have brought down uncontrolled use of chemicals. However, use of crackers can be checked only through awareness,"" he added./Light a lantern, fly it high/Not all Diwali festivities are about crackers and fumes. North Karnataka has had a tradition of flying lanterns called Akasha Buttis for years now. China, too, has a similar tradition where they release hot paper air balloons, better known as Chinese lanterns./Drawing a leaf out of these practices, residents of HSR Layout will celebrate the festival of lights by releasing 1,000-odd flying lanterns into the sky on Wednesday. Residents will assemble in a playground and release the flying lanterns into the air between 4pm and 8pm. Of course, crackers are a strict no-no./For Reprint Rights: timescontent.com"
Air pollution likely to increase 40-50%,"PUNE: If you live in Hadapsar, Shivajinagar or Alandi and suffer from asthma or some other respiratory disease, you may consider going out of town as these areas are likely to witness the highest rise in pollution levels during Diwali celebrations, stated the System Of Air Quality Forecasting And Research (SAFAR) at the Indian Institute of Tropical Meteorology (IITM)./""According to our model, the situation will be worst in Hadapsar this Diwali where the PM 2.5 levels are likely to shoot over 100 micro grams per cubic meter and PM 10 levels will cross 200. Pollution levels at Shivajinagar and Alandi will also remain high,"" said Neha Parkhi, programme officer at SAFAR./While pollution levels at nine observation points in the city are likely to cross the permissible 100 micro grams per cubic meter for PM 10, Manjri and Nigdi on the city's outskirts are likely to have the least pollution levels, she added./""Within the city also wind directions can play an important role. For instance the level of pollutants in Lohegaon is much higher than last year while certain areas like Shivajinagar may witness a drop in certain pollutants. This is because the winds may blow the pollutants along to areas that may witness bursting of more crackers,"" explained IITM scientist Gufran Beig, the programme director of SAFAR./The bursting of firecrackers results in an increase of all pollutants, but the ones that are of the greatest concern for the city are particulate matter - particles suspended in the air. There are two indicators - PM 10 and PM 2.5 - particles less than 10 microns in size and those less than 2.5 microns in size respectively. Of these, the finer particles (PM 2.5) can penetrate through the gaseous exchange region of the lungs and enter the bloodstream and affect other organs./Beig said the highly dangerous PM 2.5 levels are likely to increase by 40-50% across the city while PM 10 levels are likely to increase by 30-40%. ""However, if there is a 20-25% reduction in bursting of firecrackers, it could result in a significant reduction in pollution levels,"" he added./Scientists at SAFAR have used their observations of emission levels from last year's Diwali and combined the data with the predictions of weather-related factors such as temperature and winds to make the forecast. Pune is the second city in India after Delhi where these predictions have been made as a part of the SAFAR programme./AreaNov 4, 2013 (observations)Oct 24, 2014 (predictions)/Pashan57.3644.95/Shivajinagar76.6667.70/Lohegaon41.0077.22/Alandi51.3477.88/Katraj70.8774.96/Hadapsar52.11117.28/Bhosari48.2864.57/Nigdi45.1560.86/Manjri42.7629.50/According to an Air Quality Index (AQI) developed by IITM scientists, PM 10 levels will cross permissible limits in all parts of the city/Air quality will remain moderate for most areas. At this level vulnerable people like children, asthmatics and senior citizens will experience respiratory discomfort/In Hadapsar, Shivajinagar and Alandi air will be of poor quality. At this level, all people can experience some discomfort/""What is of greatest concern is the rise in PM 2.5 levels in the city. These are the particles that pose the greatest threat to our health as they can penetrate deep into the lungs, crossover and enter the bloodstream/- Gufran Beig, programme director SAFAR/For Reprint Rights: timescontent.com"
Diwali air pollution in Ghaziabad dips,"GHAZIABAD: If statistics are anything to go by, Ghaziabad is breathing somewhat easy after Diwali. The city saw a dip in air pollution levels this year compared with Diwali in the last three years, according to the state Pollution Control Board (PCB), though they continued to hover far above the acceptable threshold./A minor dip was also witnessed in the noise level, data gathered by the PCB from various locations of the city between 8am and 11pm on Thursday showed./Paras Nath, chief of the PCB in Ghaziabad, said, ""Last year, we noticed cracker sales in the city included those with noise levels exceeding 125 decibels, the maximum limit laid down by the Supreme Court. But this year, our teams that went around the market areas could not find any crackers with sound levels above 125 decibels. This is a major achievement, and shows a new maturity among cracker manufacturers.""/He felt the reduction in the pollution levels was an indication that people were becoming were sensitive to the ecology./For air pollution, the figures of suspended particulate matter (SPM) were less than the last three years - this year, it was 210 micrograms per cubic metre compared with 265 in 2013, 258 in 2012 and 265 in 2011. Similarly, the respirable suspended particulate matter (RSPM) was 215 this year as opposed to 235 in 2013, 232 in 2012 and 224 in 2011./The air quality monitoring on Diwali day was carried out by the PCB in collaboration with an NGO, Paryavaran Sachetak Samiti, with equipment made available by the Central Pollution Control Board./Vijaypal Baghel, an environmental activist who was the NGO's representative, said, ""The major difference this Diwali was that citizens could clearly see the stars in the sky, because the air was not so polluted with smoke from pyrotechnics.""/This was corroborated by city physician Dr NK Soni. ""You can be certain that air pollution was much lower this time than in the last many years. Doctors had far fewer cases of allergic bronchitis and upper respiratory tract infections to attend to this Diwali. These are the infections and allergies that mainly affect residents after a smoke-filled Diwali,"" he said./Ghaziabad chief medical officer Dr Ajay Agarwal concurred. ""We have had far fewer cases of respiratory problems reported to the government hospitals this Diwali. This obviously means more awareness and maturity among both adults and children about the value of a clean atmosphere,"" he said./For Reprint Rights: timescontent.com"
