headline,body
Gurgaon air quality comes under the radar,"Panic buttons are being pressed in Delhi over its air quality. The report that bad air can cut an Indian's life by over three years has come as a shocker. If this is the average figure for the entire country, the situation would be far more critical in Delhi, reportedly the most polluted city in the world./In fact, one environmentalist even speculated that President Barack Obama's three-day stay in India's capital may have abridged his time on the Earth by six hours./Beijing was supposed to have a high level of atmospheric pollution. Today Delhi beats that too. Dirty air leads to heart and lung diseases, and shortened life spans. The most lethal killer is PM 2.5 which is fine particulate matter that creeps insidiously into the lungs and starts the damage. The nagging cough that does not go away is just the beginning./Gurgaon should be even more worried. Basically the entire NCR falls under one atmospheric roof. The Haryana State Pollution Control Board (HSPCB) releases its own monthly data on air pollution. Its website has regular figures for PM 10, but not on the finer PM 2.5 (though sources in the Board say that they will start collating this data too on a weekly basis fairly soon.)/However, a recent one-time study by the Centre for Science and Environment in Gurgaon showed that the level of the finer killer is 13 times the safe national standard. The hourly average of PM 2.5 during peak evening hours hovered around 1,000 micrograms per cubic metre (mgcm) against the safe level of 60mgcm. Other emissions, such as carbon and nitrogen compounds, are extras. A few factors aggravate the problem here./First, there is more building activity here per square kilometre than in the capital. Delhi has more or less been built and done with. We see some sporadic construction, but nothing like the scale at which concrete structures and roads are coming up in Gurgaon. More buildings mean more excavations and more dust. It is the same for laying roads. Once work starts on any new road one has to be prepared for endless delays. Ask the people living along Golf Course Road what it is to breathe toxins floating around on the wings of dust particles for months on end. A similar situation prevails in the never-ending road work around Cyber City. No one seems to be in any hurry to finish any job./Motorized traffic emits toxic smoke everywhere, but Gurgaon has 232 such vehicles per 1,000 persons compared to Delhi's 120. So, mark that as another factor that makes the problem more acute here.""But Gurgaon does not have any thermal power plants, so the air cannot be as bad as in Delhi,"" are the words of comfort we get from HSPCB. Unfortunately - and that is the third aggravating factor - Gurgaon also has scores of condominiums that boast of 24-hour power backup./We, therefore, have reason to be worried and more so because the authorities are not. Pollution control gets little or no mention in the state's plans or the netas' speeches. So far there is no regular monitoring of PM 2.5 particles, and whatever data is collected is based on readings from just one monitoring station for the entire city./For Reprint Rights: timescontent.com"
Gurgaon air quality comes under the radar,"Panic buttons are being pressed in Delhi over its air quality. The report that bad air can cut an Indian's life by over three years has come as a shocker. If this is the average figure for the entire country, the situation would be far more critical in Delhi, reportedly the most polluted city in the world./In fact, one environmentalist even speculated that President Barack Obama's three-day stay in India's capital may have abridged his time on the Earth by six hours./Beijing was supposed to have a high level of atmospheric pollution. Today Delhi beats that too. Dirty air leads to heart and lung diseases, and shortened life spans. The most lethal killer is PM 2.5 which is fine particulate matter that creeps insidiously into the lungs and starts the damage. The nagging cough that does not go away is just the beginning./Gurgaon should be even more worried. Basically the entire NCR falls under one atmospheric roof. The Haryana State Pollution Control Board (HSPCB) releases its own monthly data on air pollution. Its website has regular figures for PM 10, but not on the finer PM 2.5 (though sources in the Board say that they will start collating this data too on a weekly basis fairly soon.)/However, a recent one-time study by the Centre for Science and Environment in Gurgaon showed that the level of the finer killer is 13 times the safe national standard. The hourly average of PM 2.5 during peak evening hours hovered around 1,000 micrograms per cubic metre (mgcm) against the safe level of 60mgcm. Other emissions, such as carbon and nitrogen compounds, are extras. A few factors aggravate the problem here./First, there is more building activity here per square kilometre than in the capital. Delhi has more or less been built and done with. We see some sporadic construction, but nothing like the scale at which concrete structures and roads are coming up in Gurgaon. More buildings mean more excavations and more dust. It is the same for laying roads. Once work starts on any new road one has to be prepared for endless delays. Ask the people living along Golf Course Road what it is to breathe toxins floating around on the wings of dust particles for months on end. A similar situation prevails in the never-ending road work around Cyber City. No one seems to be in any hurry to finish any job./Motorized traffic emits toxic smoke everywhere, but Gurgaon has 232 such vehicles per 1,000 persons compared to Delhi's 120. So, mark that as another factor that makes the problem more acute here.""But Gurgaon does not have any thermal power plants, so the air cannot be as bad as in Delhi,"" are the words of comfort we get from HSPCB. Unfortunately - and that is the third aggravating factor - Gurgaon also has scores of condominiums that boast of 24-hour power backup./We, therefore, have reason to be worried and more so because the authorities are not. Pollution control gets little or no mention in the state's plans or the netas' speeches. So far there is no regular monitoring of PM 2.5 particles, and whatever data is collected is based on readings from just one monitoring station for the entire city./For Reprint Rights: timescontent.com"
KMF Belagavi office vandalized,"BELAGAVI: Residents of Mahantesh Nagar who fed up with air pollution by the Karnataka Milk Federation (KMF) dairy, expressed their fury on Monday morning by vandalizing the KMF office./Residents have been alleging against the extra carbon being smoked by the chimney in the dairy but not received any positive response from the dairy authorities. Belagavi Milk Union of the KMF is one of the largest dairy units in the state. The milk collected from the district is processed here and converted into milk powder and milk products like pedha, lassi and kunda for which city is popular./When the people resides around the dairy woke at the morning, they shocked as there was a layer of black carbon saturated outside home, on cars, terrace and plants. Angered with this, residents rushed to the dairy premises and broke window glasses and displaced the rakes kept inside dairy. They also pelted stones on the office building and later sat on dharna outside the dairy gate, demanding shifting of the dairy unit and suspension of the managing director./According to local resident Sanjeev Rachotimath, dairy releases the boiler cleaned chemical water behind the open area of the unit which is causing to the health hazards like itching, asthama etc. Another resident Arun Marennavar alleged that the release of carbon from the chimney is regular, but it was huge scale on Monday. ""We found a thick a layer of carbon on the vehicles, roof of the houses. The Pollution Control Board has fully neglected in inspecting the unit here and checking whether the KMF following the guidelines related to environment or not"", he said./Chairman Vivekrao patil met the protesting residents along with the concerned officers of Belagavi City Corporation and heard their problem. Residents withdrew agitation after Patil assured them with solving the problem soon./For Reprint Rights: timescontent.com"
Minister Jain intervenes on behalf of villagers,"MANGALURU: Responding to the ongoing protests by villagers of Jokatte, minister for fisheries, sports and youth empowerment K Abhayachandra Jain has brought the issues related to pollution from the coke and sulphur units of Mangalore Refineries and Petrochemicals Limited (MRPL) to the notice of chief minister Siddaramaiah./The minister, who is the MLA of the constituency, has urged the CM to take suitable measures to address the problems of villagers of Jokatte and surrounding areas due to the pollution. Villagers have been fighting against units of MRPL for more than four months and they had approached the minister too./Following this, the minister has urged the CM to intervene and direct the district administration to convene a high level meeting of all officials including MRPL authorities to solve the issue of pollution./""MRPL industry is located in my constituency in Dakshina Kannada and recently they added a coke and sulphur units. The hazardous chemical particles that are being discharged from the units have destroyed the environment in large scale. In addition, air pollution, water pollution and sound pollution have made the entire region polluted. Several local residents are suffering from various diseases. Similarly, birds and animals too are on verge of extinction,"" Jain explained in the letter to chief minister (the copy of the letter is with TOI)./""Several farmers have lost their land and livelihood. Hence a meeting of MRPL chiefs and deputy commissioner of Dakshina Kannada should be convened on your behalf immediately to discuss the issues and find solutions,"" Jain urged the CM./""I have sent a letter to chief minister Siddaramaiah with regard to the problems of people due to the coke and sulphur units. At present, the CM is busy with budget preparations. Very soon, a meeting will be convened in this regard,"" Jain said. Meanwhile, Nagarika Horata Samiti has warned that the protest will be intensified if the coke and sulphur units of MRPL are not shut down./State president of Democratic Youth Federation of India (DYFI) Muneer Katipalla told reporters that school children in Jokatte and surrounding areas will hold a protest in front of the coke and sulphur units' gate on March 10. Later, the protest will be taken to Bengaluru, he added./Meanwhile, MRPL authorities say that there is no room for such concern and all possible pollution control measures have been taken by the company as stipulated by MoEF and KSPCB./For Reprint Rights: timescontent.com"
"In fight for clean air, Beijing outguns Delhi","NEW DELHI: Delhi may draw favourable comparisons with Beijing with every smog attack, but the Chinese capital has beaten Delhi in addressing air pollution, a Greenpeace analysis released on Saturday said. While Delhi's total number of ""bad air"" days in 2014 have far outnumbered Beijing's, the latter has put in place a time-bound action plan to meet the safe air quality standard by 2030 and a stringent short-term response plan with health advisory and a four-level alarm system which includes closing of schools, factories and cutting down the number of cars on the roads depending on pollution levels. Delhi has no such plan./(fine, respirable pollution particles) levels to 60 micrograms per cubic metre from the current level of 89 microgram per cubic metre by 2017. Unlike Delhi, Beijing's continuous monitoring stations have live, downloadable data for all days. The monitoring stations run by Delhi Pollution control Committee (DPCC) had no data for 56 days in 2014./Greenpeace campaigners also found that the health risks faced by people in Delhi are far more than those living in Beijing. They ran a health impact modelling exercise based on a methodology developed by the Global Burden of Disease study 2010 which found that Delhites may have a 20-25% increased risk of lung cancer, 10% to 15% increased risk of chronic respiratory diseases and a 5% increased risk of ischaemic heart disease compared to those living in Beijing./The Central Pollution Control Board reported Delhi's average PM2.5 level in 2013 to be 153 microgram per cubic metres, based on hourly measurements at 6 different stations. This is 15 times the World Health Organization (WHO) guideline and 3.8 times the national safe standard. ""Delhi's average is also 80% higher than the average in Beijing, where pollution regularly makes national and international headlines and has led to exceptionally strong action to limit use of cars, industrial emissions and emissions from coal in particular,"" a statement released by Greenpeace India on Saturday said./""Beijing, unlike Delhi, has a five-year action plan in place to protect its citizens from harmful air. It is appalling to see the union minister for environment, Prakash Javadekar recently dismiss any need for precautionary measures such as masks or school closures on heavy pollution days. The government needs to show that it cares for its citizens - children, the sick and elderly are at most risk from Delhi's toxic air. Greenpeace campaigners also demanded that ""there should be stringent targets for industrial emissions. We need an action plan similar to that of Beijing, it should include an emergency alert system that issues health advisories to public on heavy pollution days along with instructions for industries to cut down emissions. We have no emission standards for coal-fired power plants in India, a sector responsible for emitting 7500 tons of PM2.5 into the city.""/They quoted a study published last year called ""Human health risks in national capital territory of Delhi due to air pollution"" by scientists from IIT, Roorkee, Humphrey School of Public Affairs, University of Minnesota and University of Colorado at Denver which found a massive rise in mortality and morbidity associated with high air pollution levels in Delhi since 2000./For Reprint Rights: timescontent.com"
"In fight for clean air, Beijing outguns Delhi","NEW DELHI: Delhi may draw favourable comparisons with Beijing with every smog attack, but the Chinese capital has beaten Delhi in addressing air pollution, a Greenpeace analysis released on Saturday said. While Delhi's total number of ""bad air"" days in 2014 have far outnumbered Beijing's, the latter has put in place a time-bound action plan to meet the safe air quality standard by 2030 and a stringent short-term response plan with health advisory and a four-level alarm system which includes closing of schools, factories and cutting down the number of cars on the roads depending on pollution levels. Delhi has no such plan./(fine, respirable pollution particles) levels to 60 micrograms per cubic metre from the current level of 89 microgram per cubic metre by 2017. Unlike Delhi, Beijing's continuous monitoring stations have live, downloadable data for all days. The monitoring stations run by Delhi Pollution control Committee (DPCC) had no data for 56 days in 2014./Greenpeace campaigners also found that the health risks faced by people in Delhi are far more than those living in Beijing. They ran a health impact modelling exercise based on a methodology developed by the Global Burden of Disease study 2010 which found that Delhites may have a 20-25% increased risk of lung cancer, 10% to 15% increased risk of chronic respiratory diseases and a 5% increased risk of ischaemic heart disease compared to those living in Beijing./The Central Pollution Control Board reported Delhi's average PM2.5 level in 2013 to be 153 microgram per cubic metres, based on hourly measurements at 6 different stations. This is 15 times the World Health Organization (WHO) guideline and 3.8 times the national safe standard. ""Delhi's average is also 80% higher than the average in Beijing, where pollution regularly makes national and international headlines and has led to exceptionally strong action to limit use of cars, industrial emissions and emissions from coal in particular,"" a statement released by Greenpeace India on Saturday said./""Beijing, unlike Delhi, has a five-year action plan in place to protect its citizens from harmful air. It is appalling to see the union minister for environment, Prakash Javadekar recently dismiss any need for precautionary measures such as masks or school closures on heavy pollution days. The government needs to show that it cares for its citizens - children, the sick and elderly are at most risk from Delhi's toxic air. Greenpeace campaigners also demanded that ""there should be stringent targets for industrial emissions. We need an action plan similar to that of Beijing, it should include an emergency alert system that issues health advisories to public on heavy pollution days along with instructions for industries to cut down emissions. We have no emission standards for coal-fired power plants in India, a sector responsible for emitting 7500 tons of PM2.5 into the city.""/They quoted a study published last year called ""Human health risks in national capital territory of Delhi due to air pollution"" by scientists from IIT, Roorkee, Humphrey School of Public Affairs, University of Minnesota and University of Colorado at Denver which found a massive rise in mortality and morbidity associated with high air pollution levels in Delhi since 2000./For Reprint Rights: timescontent.com"
Foul Delhi air may be driving people to suicide,"NEW DELHI: The link between air pollution and respiratory diseases is well known, but foul air may be causing cases of depression too. Michael Brauer, professor at School of Population and Public Health at University of British Columbia who specializes in air pollution studies, told TOI that scientists are increasingly seeing links between air pollution and the mind./Studies have found that suicides and attempted suicides increase as levels of air pollution rise. This is because of the inflammatory effects of air pollution on body and mind. Brauer, who spoke at Anil Agarwal Dialogue 2015 organized by Centre for Science and Environment (CSE), told TOI in an interview that masks and air purifiers may not be very effective in addressing the scale of the problem, and the strategy should be to bring down air pollution in cities. ""Masks work only when they are fixed professionally. It also depends on the kind of mask being used. N 95 (a type of mask) may be effective if it's worn properly without any gaps,"" he said./Prolonged exposure to high levels of pollutants can cause lung cancer and heart disease, but short-term exposure, for instance at traffic junctions, can trigger stroke or chronic asthma. ""Air pollution is affecting or leading to almost all the major conditions. It can be responsible for developing heart disease and triggering a heart attack, chronic bronchitis, emphysema, lung cancer... We are also seeing a very strong link between infections and air pollution. It is more difficult for our bodies to fight infection. Ear infections are very common, especially among young children; they start as respiratory infection and move to the ears,"" he said./Brauer said scientists are seeing links between air pollution and diabetes, premature births and anxiety. ""These are all part of inflammation caused by air pollution. There are studies showing that when air pollution peaks, the incidence of suicide rises. The problem is, pollution particles are not living things like bacteria that can be killed."" He added that pollution particles may be carriers of proteins that trigger allergies./""I think the most effective thing is, reducing pollution in total. Only the higher income groups can buy small air filters. The emphasis should be on general health-diet and physical activity, and reducing other risk factors such as smoking and alcohol.""/Brauer said curbing air pollution has immediate positive effects. After fuel quality improved in Hong Kong, morbidity reduced. ""They got an extra year of life. In Ireland, after burning coal was made illegal, there was a 15% drop in deaths caused by cardiovascular and respiratory issues.""/For Reprint Rights: timescontent.com"
"Bio-fuel cooking methods no more a safe option, say doctors","MADURAI: If you think cooking with bio-fuel is a safe option, think twice. Experts say that though such cooking methods are employed on a large-scale in many household across the city, very few are aware of its risk factors as it results in respiratory symptoms. Bio-fuel stoves emit smoke that contains black carbon generating indoor air pollution and causes breathing problems, cough and asthma, they say./""It is important that women are aware of the health hazards caused by using the traditional bio-fuel cooking stove. The black carbon, which is emitted in the form of smoke causes many health complications and is also harmful for the environment. Families must consider using electric stove to avoid the ill-effects of black carbon,"" said Mridula Ramesh, executive director and convenor of Indian Women Network Madurai Zone./According to the 2011 census, around 166 million households in India use the traditional bio-fuel stoves. Statistics also reveal that states like Bihar, Orissa, Madhya Pradesh and Uttar Pradesh use more bio-fuel stoves. In Bihar alone, 90% of the households use bio-fuel./Burning of wood, crop waste and dung results in black smoke which creates maximum damage to women since they tend the fire. Statistics show that around eight million households in Tamil Nadu use bio-fuel, but very few are aware of its health hazards like asthma and COPD (chronic obstructive pulmonary disease). According to a report from the World Health Organisation, babies are born underweight in those families where bio-fuel is used./M Palaniappan, a pulmonologist from a city hospital said, ""In India, around 30% of women suffer from COPD due to the usage of traditional bio-fuel stoves. Those using bio-fuel should ensure proper ventilation to push out the excessive smoke. Prolonged exposure to black smoke may also cause lung cancer. Moreover, oxygen levels in pregnant women with respiratory problems will come down and can directly affect the babies."" Doctors also said the ill-effects of black carbon from bio-fuel stove is more harmful that smoking. The exposure to black smoke causes the lung passage to lose elasticity and thicken the passage. P Krishnamurthy, a chest physician said, ""The damage to the lungs of a person exposed to black smoke is similar when compared to the damage caused to a smoker. It is time families chose electric stoves over traditional cooking methods.""/For Reprint Rights: timescontent.com"
