headline,body
AJK elections," I was born on November 15, 1924, and I am not sure if I will get to see my next birthday. Extreme weather conditions, air pollution, and, on top of that, the coronavirus pandemic are too much for my age. Global warming seems to have caused abrupt weather patterns - extreme heat, droughts and flash floods. Covid-19, on the other hand, has affected the world in unimaginable ways. Despite the availability of the vaccine, this deadly virus continues to wreak havoc across the world. Our leadership, however, seems too busy with more important matters such as fighting with political opponents. While they should be following SOPs to encourage people to do the same, they do just the opposite. They hold rallies and meetings where a majority don't wear masks or follow social distancing. Even though the number of Covid-19 cases has gone down, the virus is still here. No disease can be eliminated if people do not work in complete unity. The carelessness of a few can lead to a disastrous situation, resulting in a large number of deaths and disruption of economic activities./At present, political parties are more interested in winning the upcoming elections in Azad Jammu and Kashmir (AJK). I wish our politicians had any regard for people. At this time, election campaigns can lead to a surge in coronavirus cases. Our country cannot afford it. It will be nearly impossible for us to manage the load of critically ill patients. Our politicians must realise that postponing the elections is better than dealing with crowded hospitals."
Funds released for 200 electric buses: minister," The Punjab government has released Rs3.4 billion for procurement of 200 eco-friendly electric buses to reduce air pollution./Chairing a meeting held at Civil Secretariat on Friday in connection with better transport facilities in Punjab, Punjab Finance Minister Hashim Jawan Bakht observed that the eco-friendly buses would be run in major industrial and commercial cities of Punjab to control the serious situation of air pollution. He said the buses had been selected which would not only be smoke-free but also be reasonable in operational cost. Other eco-friendly technologies will be used later to reduce air pollution, he said./The meeting was attended by Provincial Minister for Transport Jahanzeb Kachchi, Adviser to Chief Minister on Economic Affairs Dr Salman Shah, Finance Secretary Iftikhar Ali Saho, Planning and Development Secretary Imran Sikandar, transport secretary, Punjab Mass Transit Authority managing director, Chief Executive Officer Lahore Transport and other relevant officers. The transport secretary informed the meeting that electric buses had been used for public transport in developed countries since 2015. The countries in which the electric buses are being used include China, India, Europe and the United States. The major manufacturers of these buses include the companies from France, Germany, China and the United States. He said that under the Electric Vehicle Policy, a target of 1,000 buses was set in Pakistan for the next five years. 'We have to complete 50% of our target by 2030,' he said. Provincial Minister for Transport Jahanzeb Kachchi called on the private sector to invest in environment-friendly transport./The finance minister directed the transport secretary to formulate transport models for Faisalabad and Bahawalpur after Lahore. 'Create opportunities for the companies that are aware of use and usefulness of modern technology in view of the future expansion of the scope of electric transport. Green financing can also be used with the subsidised model of transport,' he said."
Pakistani children among most affected in South Asian climate crisis,"Young people living in Afghanistan, Pakistan, India and Bangladesh are among those at most risk of the impacts of climate change, threatening their health, education, and protection, according to a first-ever UNICEF report launched on Friday./In addition, Nepal and Sri Lanka are among the top 65 countries most impacted globally. 'The Climate Crisis Is a Child Rights Crisis: Introducing the Children's Climate Risk Index' (CCRI) is UNICEF's first child-focused climate risk index./It ranks countries based on children's exposure to climate and environmental shocks, such as cyclones and heatwaves, as well as their vulnerability to those shocks, based on their access to essential services./Pakistan, Bangladesh Afghanistan, and India are among four South Asian countries where children are at extremely high risk of the impacts of the climate crisis, with a ranking of 14, 15, 15, and 26 respectively. While Nepal is ranked 51, Sri Lanka is at 61st place./Bhutan is ranked 111, with children at relatively lower risk. Approximately 1 billion children live in one of the 33 countries are classified as 'extremely high-risk', including the four South Asian countries. 'For the first time, we have clear evidence of the impact of climate change on millions of children in South Asia. Droughts, floods, air pollution, and river erosion across the region have left millions of children homeless and hungry, and without any healthcare and water,' said George Laryea-Adjei, UNICEF Regional Director for South Asia./'Together, climate change and the COVID-19 pandemic have created an alarming crisis for South Asian children. The time to act is now - if we invest in water, healthcare, and education, we can protect their futures from the impacts of a changing climate and degrading environment.'/The report found that these South Asian children are in constant danger from riverine floods and air pollution, but also that investments in child health, nutrition, and education can make a significant difference to protect children from climate change./South Asia is home to over 600 million children and has the highest number of young people globally. South Asian countries are among the most vulnerable globally to the impacts of climate change. Extreme climate-related events - heatwaves, storms, floods, fires, and droughts - affect more than half of the region's population every year and continue to burden South Asian countries' economies./Rising global temperatures and changing weather patterns have put the futures of millions of children living in climate-vulnerable areas in South Asia at constant risk. Worse, before they can recover from one disaster, another one strikes, reversing any progress made./The report also reveals a disconnect between where greenhouse gas emissions are generated, and where children are enduring the most significant climate-driven impacts. The 33 extremely high-risk countries, including four from South Asia, collectively emit just 9 per cent of global CO2 emissions. Conversely, the 10 highest emitting countries collectively account for nearly 70 per cent of global emissions. 'The frightening environmental changes we are seeing across the planet are being driven by a few but experienced by many in South Asia,' added Laryea-Adjei./'We must urgently reduce greenhouse gas emissions and work together as a community to build greater resilience in South Asia. Children and young people are at the heart of this change, with almost half of 1.8 billion people below the age of 24 in South Asia.'/Compared to adults, children require more food and water per unit of their body weight, are less able to survive extreme weather events, and are more susceptible to toxic chemicals, temperature changes, and diseases, among other factors. Without the urgent action required to reduce greenhouse gas emissions globally, children will continue to suffer the most."
Tree plantation drive launched in IPH," Dean Institute of Public Health, Prof Dr Zarfishan Tahir has said that environmental and air pollutions are serious threats for human health and causing adverse impact on human life, tree plantations at massive level can overcome these issues effectively./She further said that according to the vision of Prime Minister Imran Khan and the Chief Minister, tree plantation campaign in the Institute of Public Health (IPH) has been launched to make the environment green and pollution free./She stated this while leading an awareness walk to highlight the importance of tree plantation at the institute. Besides, Dr. Saima, Dr. Anjum Razzaq, Dr. Rukhsana, all the faculty members and the staff participated in the walk. Including Dean, Dr. Zarfishan, all the faculty members planted saplings to celebrate tree plantation campaign./On this occasion, Dr. Zarfishan was of the view that environment and air pollution creating serious problems for human life and respiratory diseases, asthma, infection of eyes, skin allergy are increasing due to bad effects of pollution. She said that Pakistan is very short of forests and it is the duty of everyone to plant trees as much as possible./Dr. Zarfishan further said that present government, especially Prime Minister is taking practical steps to increase and cultivate forests in the country. Awareness campaigns also being conducted to convince the masses to participate enthusiastically in tree plantation campaign so that the set targets could be achieved with the cooperation of people. She said that IPH is ready to play its role effectively in this regard."
Pollution impacts," Among the most pernicious maladies that today's world faces is air pollution. Now, new research has confirmed that exposure to air pollution is linked to increased severity of mental illnesses. According to reports, this is the finding of the most comprehensive study of its kind which involved 13,000 people in London. Even if a relatively small increase in exposure to nitrogen dioxide takes place, it may lead to a 32 percent increase in the risk of needing community-based treatment and an 18 percent increase in the risk of being admitted to hospital. If this is the condition in developed countries, the situation in developing countries must be even worse. In countries such as Pakistan, air pollution is increasing day-by-day and the occurrence of mental illnesses may be related to this type of pollution in the country too. The research suggests that a reduction in air pollution could benefit millions of people./This study has a particular lesson for Pakistan as this pollution is modifiable if the concerned authorities in the country take it seriously. Reducing population-level exposure to air pollution in cities and towns should be one of the top priorities of the federal and provincial governments in Pakistan. The government must explore what interventions are helpful in fighting air pollution. For example, expanding low-emission zones is one such remedy that the research recommends. In Pakistan, one of the primary causes of air-pollution is toxic emission from motor vehicles. In most cities and towns of the country, there is hardly any control on such emissions as the concerned departments do not check and implement the required standards of vehicle fitness. Then there is untreated smoke emitted by factories, foundries, and brick kilns. Increasing use of air-conditioning and power generators is also compounding the problem of air pollution./When mental health hazards emerge as a result of people's exposure to such pollution, the correlation is not always established and medical interventions at the individual level become quite difficult. There are other physical ailments also that spiral from air pollution such as respiratory diseases and skin and eye problems. Research shows that even at low levels of air pollution there are significant effects on mental health. Anxiety and depression are among the foremost mental conditions that people suffer from, and in Pakistan too these are now more frequent than ever before. A mentally and physically healthy nation is the sign of a country at ease with itself. If dirty air contributes to mental disorders and leads to increased suicides, the top decision-makers of the country must take note and do something about it. Finally, there is also evidence that air pollution is adversely affecting intelligence level in children and youth and is also linked to dementia in old age. All this calls for an immediate action."
CSOs back KP government efforts for clean environment," Civil society organisations (CSOs) working for a clean environment have termed the recent directive by Peshawar Division Commissioner Riaz Khan Mehsud to take stringent action against smoke emitting-industries a great achievement of the citizens./A communication by the Sarhad Conservation Network (SCN) and Peshawar Clean Air Alliance (PCAA), which are making collective efforts for a healthier air quality, said on Thursday the citizens of Peshawar had suffered from adverse effects of uncontrolled industrial and vehicular emission in terms of increasing cardiac and respiratory diseases, cancer, deteriorating memory and cognitive functions and loss in economic terms./It said these industrial units had been operating without appropriate technology adoption for control of hazardous and life threatening emissions./They are presently in the process of installing air monitors donated by philanthropists to generate real time data of air quality in Peshawar to generate an evidence-based policy, added the press release./Besides, public interest litigation has been initiated against a few industries operating without a No-Objection Certificate (NOC) and in violation of Environmental Protection Agency (EPA) regulations, which is mandatory under the law. The EPA needs public support to implement the policy of a cleaner city./Environmental Protection Tribunal (EPT) have been moved against these industries for operating against a Peshawar High Court order which states, 'No one shall be allowed to run Industrial Unit without issuance of proper NOC and environmental Management Plan (EMP) from the concerned quarter'./The communication said the provincial government agencies should ensure that all air polluting industries like chipboard and steel should strictly adhere to the National Environmental Quality standards (NEQS) and obtain NOCs from EPA which is mandatory as per KP Environmental Protection Act 2014./As per EPA sources, none of these factories have obtained mandatory Operational NOC. The EPA lab results show some industries to be emitting above 25000 PPM against a permissible limit of 300ppm./The SCN-PCAA proposed a broad-based commission comprising independent environmental experts from the Environmental Engineering Department at the University of Engineering and Technology , experts from Environmental Science Department, University of Peshawar, environmental economics experts at IMSciences, public health experts, environment law experts and senior citizens./The communication said the SCN-PCAA members believed that environmental expert and advisor to KP government Dr Shafiqur Rehman was the best suited person to lead this commission which should support the government and the EPA at both regulatory and policy levels./It said the KP government policy on a healthy environment and strict measures to implement this agenda deserved public support through awareness and advocacy at the grassroots level to make it a success./The communication said the CSOs planned to support the ongoing clean air drive through public awareness campaigns and media group meetings for a healthy environment and eventually to pass a Clean Air Act KP bill in the assembly."
"One in two Pakistanis has hypertension and every third person is with heart disease, seminar told"," 'Heart disease is the world's number one killer and is responsible for 19 million premature deaths (more than 80 per cent of these deaths occur in low- and middle-income developing countries) and results in 31 per cent of all global deaths. The incidence of heart diseases is steadily rising, so much so that 23.6 million people are predicted to die from cardiovascular diseases by 2030.'/These statistics were shared by Prof Faisal Ahmed, eminent consultant cardiologist and head of the department, Liaquat National Hospital  and  Tabba Heart Institute, Karachi, during a public awareness seminar organised by Neurospinal  and  Cancer Care Postgraduate Institute in collaboration with prestigious Amarant pharmaceuticals on World Heart Day on Wednesday./The seminar highlighted and raised awareness of maintaining good heart health and provided advice on what to do if a heart attack was suspected. It also provided the public with tips on how to improve their heart health by sharing information about heart conditions and to help people live longer, more heart-healthy lives./Focusing on cardiovascular diseases in Pakistan, Prof Faisal Ahmed said: 'About 25 per cent of adult Pakistanis have diabetes. Obesity is also on the rise, with 20 per cent of Pakistanis being obese or overweight (severe obesity leads to structural and functional changes of the heart, which causes heart failure). One in two Pakistanis has hypertension and every third person is with heart disease. Forty-two per cent of those do not even know they have high blood pressure, which leads to strokes, CVD and kidney disease, and these conditions are causes of the high rate of heart attacks and killing 400,000 innocent Pakistanis annually.'/'It has many causes: from smoking in all forms, including the fastest growing sheesha, diabetes, high blood pressure and obesity, coronary artery diseases, heart rhythm problems, heart defects you're born with, heart valve disease, to air pollution, and less common conditions such as Chagas disease and heart infections,' he explained./Prof Faisal further said that prevention is better than cure, but we do not pay attention to it. He pointed out that cardiovascular disease in Pakistan and across the world is on the rise, and although it can often be treated, primary prevention is the best way to reverse this trend./The federal and provincial health authorities are requested to set up preventive cardiology units at district levels, preventive cardiology units will focus on lowering patients' risk of developing heart disease and having a first heart attack or stroke while also preventing further issues in people who already have cardiovascular disease./In the wake of the fourth wave of the coronavirus pandemic, 'Covid-19 has only been more heartbreaking for this figure as it has made 520 million people living with heart diseases, more vulnerable to developing severe forms of the coronavirus and now taking care of their heart is more important than ever before,' Prof Faisal added./'Remember, missing medical appointments, lack of contact with family and friends or reduced physical exercise can lead to heart diseases. It is important to avoid skipping any medication that you may be on, and do not ignore common symptoms like chest pain and tightness, shortness of breath, nausea, indigestion, heartburn and pain that spreads to the arm. Don't forget to monitor vitals like blood pressure and blood sugar regularly, So, don't let Covid-19 stop you from attending your regular check-ups especially if you have underlying health conditions like heart disease, heart failure, diabetes, high blood pressure or obesity.'/His recommendations included limiting the intake of ready-made snacks which are often high in sugar, fat and salt; ensuring the intake of at least five servings of fresh fruits and vegetables a day; reducing salt consumption to one teaspoon a day and preparing meals at home for school or work./Other suggestions are quitting smoking and increasing activity by limiting the time spent watching TV or using the computer, and getting involved in outdoor activities such as cycling, gardening, or walking and above all a calm sleep for at least eight hours, concluded by Prof Faisal./Mr Iftikhar H. Syed, renowned entrepreneur  and  philanthropist, thanked the participants and promised that they would initiate soon a very comprehensive and free campaign to detect and treat heart diseases in rural areas for less privileged communities because this was his social/responsibility./The question-answer session with the panel of doctors saw a lot of queries about day-to-day life and different faces of heart diseases, especially in women and younger population."
Three EPA air quality monitors out of order,"As smog season is approaching, three air quality monitors of Punjab Environmental Protection Agency (EPA) are out of order, The News has learnt./Sources in EPA revealed six air quality monitoring stations are present in the provincial metropolis out of which five are fixed stations and one is mobile monitoring station. The fixed stations are installed in Township, Met office, EPA Head office at Qaddafi Stadium, Town Hall and Ghurki Hospital in Wahgah Town area./Sources said air quality monitors installed at EPA head office, Wagah and Met office are out of order while the stations at Township and Town Hall are working. The mobile air quality unit is also working, sources said./The most important thing, the sources revealed is that none of the five fixed installed air quality monitors has the ability to measure the parameter of PM 2.5, which is the basic cause of smog in the provincial capital. However, the mobile air quality monitoring unit is being able to collect the data of PM 2.5. Sources said the out of order stations are not working because of petty issues such as air-conditioning unit of the monitor installed at EPA head office is not working, the electricity connection of the air quality monitor installed at Met office is not stable due to frequent tripping it restarted again and again so it was closed down while the internet connection charges of these mobile air quality units are also unpaid. Sources said the government allocated only Rs40,000 per year for repair and maintenance to the EPA's laboratory section, which is not enough. They said the annual repair and operating cost of each monitor is in millions but the government didn't allocate any funds in this regard./On the other hand, as the smog season is near, Chairman Judicial Water and Environmental Commission Justice (retd) Ali Akbar Qureshi held a meeting on smog prevention here on Thursday. The meeting was attended by newly-appointed Secretary Environment Syed Mubashir Hussain. Justice (retd) Ali Akbar Qureshi directed the EPD to be proactive in controlling smog. He said teams should be made to prevent smog. He said the teams should also ensure that all kilns were converted to Zigzag technology. The commission also passed instructions for taking strict action against smoke-emitting vehicles. It was decided to take action against industries that burn crop residues and cause air pollution. No negligence or omission will be tolerated with regard to smog, Ali Akbar Qureshi said./During the meeting, Managing Director Wasa told the commission that he has already instructed his team to stop using heavy machinery from October 15, 2021. He said all Wasa staff was directed to come to office on bicycles one day a week from October 31, 2021./When contacted, the newly-appointed secretary EPD didn't attend the call and no reply was received from his side. The News then talked to EPA's Lahore Laboratory head Farooq Alam who said that his duty was to monitor air quality and issue data to the department head. He said implementation of smog SOPs was not his work./He said he took charge of his office on June 22, 2021 and since then he started repair of the closed stations and brought two of them to work. He said the remaining stations will also be in working condition soon. To a question about the air quality data issued by private companies and individuals, he said the data of any individual or company was not reliable. He said the media should only rely on the official data released by EPA during smog. Meanwhile, Minister for EPD M Rizwan held a meeting on dengue during which he said cooperation of all stakeholders was obligatory for effective control of dengue. The minister was informed that surveillance teams were inspecting various hotspots to check the dengue larva. The meeting was informed that 27 notices were also issued while 5 FIRs also registered against relevant persons for violating of dengue prevention measures. The minister asked the department to launch campaign for dengue control through print, electronic and social media."
