headline,body
Can smog be far behind?," The phenomenon of smog has become a regular feature - the fifth season, so to say - of the Punjab, and acts as a very unwelcome harbinger of winters/Research has uncovered links between exposure to air pollution and the risk of Covid-19 mortality. Simply put, poor air quality diminishes immunity and increases risk of exposure to coronavirus. - Photos by Rahat Dar/Last year, the Air Quality Index (AQI) ranked Lahore's air quality as the second worst in the world in terms of health risks posed by the ambient air pollution. Parts of Lahore scored as high as 454 on an index of 500, second only to New Delhi, India. The phenomenon of smog has become a regular fifth season in the Punjab, acting as a very unwelcome harbinger of winters./For a number of years now, the month of October heralds in a period of increasing respiratory illnesses and eye diseases, accompanied with a thick, acrid odour of burnt garbage in the air. But that is not all, for air pollution brings with it particulate matter (PM) - microscopic particles of pollution that can end up causing long-term, permanent health damage, even fatalities./A World Health Organisation (WHO) research clearly indicates the impacts of short-term exposure to PM10 on respiratory health, including deficits in lung function, reduced lung development in children and a host of other illnesses. In terms of mortality, especially due to long-term exposure, PM2.5 is a stronger risk factor, most adversely impacting populations with pre-existing lung or heart disease, the elderly, and children. The exposure (to bad air) is ubiquitous and involuntary, increasing the significance of smog and air pollution on public health. There is no evidence of a safe level of exposure or a threshold below which no adverse health effects occur./Around the world, increasing air pollution in pre-Covid days was combated by shutting down schools, encouraging the public to wear N95 masks and restricting the operation of vehicles and industries emitting air pollution. A growing body of research has uncovered links between exposure to air pollution and the risk of Covid-19 mortality. Simply put, poor air quality diminishes immunity, increases risk of exposure to coronavirus, and may result in severe symptoms which can tip the scale away from recovery./The emergence of smog as a new phenomenon, particularly in and around Lahore, has been attributed to everything from burning crop remnants to wind vortices to poor quality fuel being consumed by vehicles. Indeed, the provincial government's Environment Protection Department (EPD) vacillates between closing brick kilns using 'old technology,' banning stubble burning and tightening the noose around small industrial and semi-industrial units./The consensus seems to be that smog or air pollution is a seasonal issue caused by massive crop-burning across the border in India. This explanation, however, cannot be lent much credence, considering that the air quality in Lahore is generally poor throughout the year./Historically, notable smog events have been accompanied by a temperature inversion - a phenomenon that is akin to a 'lid' trapping pollutants close to the surface of the earth. An inversion generally occurs when air adjacent to the earth cools rapidly, becoming cooler than the overlying warm air. This usually happens in cool weather, especially in the early mornings and late nights./Although meteorological conditions do cause air pollution to build up, it is ultimately human activities that are the culprit behind excessive pollutant emissions. Research conducted by the UN's Food and Agricultural Organisation (FAO) on the sectoral emission inventory of the Punjab showed that the major portion of total air pollutants are emitted by the transport sector (43 percent), followed by industry (25 percent), and agriculture (20 per cent)./A report by the World Bank identified main sources of air pollution in Pakistan as heavy-duty vehicles and motorised 2-3 wheelers; followed by power plants and waste-burning. The report analysed a partial inventory of emission sources (using available data) to highlight that the transport sector alone is responsible for a whopping 85 percent of particulate matter emissions of potentially carcinogenic and lethal PM2.5 and PM10 particulate matter./The exposure (to bad air) is ubiquitous and involuntary, increasing the significance of smog and air pollution for public health. There is no evidence of a safe level of exposure or a threshold below which no adverse health effects occur./According to the UNDP, Pakistan is the most urbanised country in South Asia. It is estimated that nearly half of the country's residents will live in cities by 2025. With urban centres in Pakistan continuing to swell with people, traffic, and industrial and commercial activities, the air quality is likely to deteriorate further in years to come./The increasing dependence on cheap but inefficient and highly polluting fuels, including coal, is worsening the air quality around the world, particularly in developing countries./It is estimated that the number of vehicles in Pakistan has increased by around fivefold in the past 20 years alone. The number of two-stroke engine vehicles has grown more than tenfold, and emissions from large industries and power generation have also increased. The situation is compounded by a combination of weak environmental legislation and inefficient implementation of global emission standards - one example of this is that the EPDs have no say in vehicle emissions; it has been deferred to the Petroleum Division./The Global Climate Risk Index by Germanwatch analyses global extreme weather events and their socio-economic impact. The 2020 Index ranks Pakistan as the '5th most vulnerable country to climate change.' Among growing climate challenges, air quality is emerging as a formidable new foe - one that is largely misunderstood. The general assumption appears to be that until visibility is greatly diminished, the eyes and throat are irritated, and you can wipe off pollutant particles from you face; the air is just fine./Moreover, declining government attention to air quality management results in a paucity of reliable data, further hinders effective policy interventions to tackle air pollution./Strategic interventions on air quality control should start with an emphasis by the Health and Environment Departments on reducing levels of pollutants linked to high morbidity and mortality - PM2.5, PM10, sulfur oxides [SOx] and nitrogen oxides [NOx] - in collaboration with the Petroleum Division. This includes improving fuel quality, enforcing vehicle emission standards particularly on heavy vehicles, and promotion of battery electric vehicles in the country./The Punjab government should also assign resources to develop an inventory of mobile, industrial and stationary sources of air pollution. Reliable air quality data must be made a provincial and national priority to understand the sources, transport, dispersion, and fate of air pollutants. Restrictions on burning solid waste, stubble, and ensuring control of emissions from brick kilns and industry already exist, but must be enforced./In terms of legislation, the National Environmental Quality Standards (NEQS) need to be realistically revised in view of attainable goals under the conditions that currently exist in Pakistan. Both industries and municipalities must be given incentives to reduce both the concentrations and masses of air pollutant emission, the provisions for which are there in the Pakistan Environment Protection Act./Pakistan's sectors with significant climate change mitigation and air pollution control co-benefits are energy, transport, and agriculture. Finally, national and provincial frameworks for air quality monitoring must be strengthened in order to take a solid step towards eliminating the nation's severe urban air pollution problem. Institutional strengthening at both federal and provincial levels, and effective coordination and liaison among stakeholders from climate, energy and health must be prioritiaed so that future generations are not left gasping for air./The writer is a development sector professional with nearly a decade of experience in communications and reporting. He has supported the implementation of The World Bank's Disaster and Climate Resilience Improvement Project (DCRIP) and ADB's Flood Emergency Reconstruction and Resilience Project (FERRP) in Pakistan"
Smog may increase virus deaths," Deteriorating air quality due to smog may increase the death rate among the corona patients, which are again on rise especially in the provincial metropolis and generally across the province./Following this situation, Relief Commissioner, Provincial Disaster Management Authority (PDMA), issued a letter to all the divisional commissioners to strictly implement the SOPs regarding smog prevention./In his letter issued on 15 October, the relief commissioner said that whereas, there is recorded evidence of persistent deterioration in the Air Quality Index of the city of Lahore in particular and Punjab in general, from satisfactory level to moderately and poorly polluted levels, which is likely to cause breathing discomfort, respiratory tract diseases, including asthma, besides heart related ailments amongst children and older adults specifically and the people of all age in general./It added there was a continuous trend of new COVID-19 patients throughout the province and overlap of conducive conditions for respiratory tract diseases due to smog could exacerbate the casualty rate. It has been corroborated by the World Health Organisation that 4.2 million people die every year as a result of exposure to ambient air pollution and Pakistan was declared the second most polluted country during the year 2019, it added./The letter stated that the Supreme Court of Pakistan and Lahore High Court had already directed the government to take necessary measures to control smog and the Punjab Cabinet, in its 36th meeting, declared smog a calamity under Section 3 of The Punjab National Calamities (Prevention  and  Relief), Act 1958, which has been notified vide Notification No. Smog-2020/10/Coord-1 dated 14.10.2020; hence it is mandatory to take all possible measures to contain and arrest the rapid deterioration of ambient Air Quality Index in territorial limits of the province. The relief commissioner announced that in his opinion there were sufficient grounds to proceed under Section 4 (2) (h) of The Punjab National Calamities (Prevention  and  Relief) Act 1958, as an immediate preventive and speedy remedy and the directions hereinafter appearing are necessary to ensure public safety of smog in the province of Punjab:/'Now therefore, I Babar Hayat Tarar, Relief Commissioner, Government of the Punjab, conserve lives and preempt and mitigate imminent threat in exercise of the powers vested in me under Section 4(2)(h) of The Punjab National Calamities (Prevention  and  Relief) Act, 1958, hereby order that there shall be a complete ban on the following activities in the territorial limits of the Province of the Punjab:/Burning of any type of crop residue, vehicles emitting visible smoke and pollutants, all industries working without emission control deteriorating Air Quality Index, all stone crushers operating without wet scrubbers, burning of all types of solid waste, tyres, rubber and plastics and use of all types of sub-standard fuels, all types of encroachments which hinder the smooth flow of traffic on public roads, including footpaths, any kind of parking which may hamper smooth flow of traffic, all types of activities without proper safeguard which contribute in generating fugitive dust, uncovered and open dumping/storage of construction material, uncovered transportation of construction and other material like sand, mud and cement, any unauthorised activity which may contribute to formation of smog./For brick-kilns, the letter stated that all kilns built on old methodology shall not be allowed to operate wef 7 November, 2020 to 31 December, 2020, as per the order dated 17.09.2020 passed in WP No. 227807/2018 by the Lahore High Court. All kilns built on zigzag methodology shall be allowed to operate as per SOPs devised by Environment Protection Department, Punjab, all kilns have to be converted to zigzag methodology by 31 December, 2020 as per notification issued by Environment Protection Department, Punjab. No kiln built on methodology other than zigzag methodology will be allowed to operate after 31 December, 2020./The letter stated that municipal offences under clauses 22 and 23 of Schedule 15 of Punjab Local Government Act, 2019 which relate to unlawful use of public space, contributing to pollution, will be dealt with under the Act ibid and all the municipal authorities and waste management companies shall ensure water sprinkling on roads, streets and construction sites emanating fugitive dust./This order shall remain in force in the entire province of Punjab with effect from 15 October until further orders. The order shall be given wide publicity in official Gazette, daily newspapers, broadcasting through Radio Pakistan, state TV, other TV channels as news item as well as social media for information of the general public, the letter concluded."
114 illegal treatment centres sealed," The Punjab Healthcare Commission sealed 114 illegal treatment outlets in 12 cities of the province./During the last week, commission's enforcement teams raided 780 treatment centres and sealed 114 outlets where quacks were illegally treating patients. As per data, businesses were found to have been changed on 227 quack premises. Among major actions, 19 quackery centres were sealed in Sialkot, Hafizabad 18, Layyah 17, Bahawalpur 14, 11 each in Multan and Rajanpur and 10 in Jhelum. Also, four outlets each in Lahore and Sheikhupura, Rawalpindi 3 and one was closed down in Kasur. Bilal Medical Store, Al-Sami Homoeopathic Clinic, Chicago Clinic and Ramzan Medical Centre were locked down in the provincial capital./The PHC spokesperson said so fare 84,369 raids had been made and around 28,000 quacks centres sealed. 'A fine of more than Rs570 million was imposed on quacks by the commission's hearing committees,' he added./'Pollution a big threat to human lives'/Ameer Uddin Medical College/Lahore General Hospital Principal Prof Dr Sardar Muhammad Al-freed Zafar has said that environmental pollution and climate change are big threats to the human lives and we all should perform our duties in this regard and take preventive measures./According to a press release issued here on Sunday, he said another threat in the shape of smog also needs immediate attention and people should opt for short and long-term measures to deal with it./Prof Al-freed said that if people decide to remain careful, they can easily avoid air pollution threat. Practical steps would be needed for that. Prof Al-freed stated that, in fact, smog is the merger of fog and smoke and this air pollution started with the use of coal as fuel. He called upon the citizens to drink maximum water and avoid going out of the houses unnecessarily./Similarly, motorcyclists and cyclists should also use face masks. The doors and windows of houses should be kept closed, he said./PU awards PhD/Punjab University (PU) has awarded PhD degree to a student from Nigeria. Olawale Samuel Adeyinka s/o Adeyinka has been awarded a PhD degree in the subject of Molecular Biology after roval of his thesis entitled 'Investigation of Potential Double Stranded Ribonucleic Acid (dsRNA) as Alternate Control Measure for Maize Stem Borers (Chilo Partellus)'. He has completed his PhD under the supervision of National Centre of Excellence in Molecular Biology Professor Dr Idrees Ahmad Nasir and Assistant Professor Dr Bushra Tabassam."
Pollutants increase in air to form smog," As the minimum temperature starts to go down, the concentration of pollutants has increased in the air of the provincial capital in the form of smog./The US embassy on Monday at 4pm declared the Air Quality Index (AQI) of the city as 152 AQI, which was termed unhealthy. 'Everyone may begin to experience health problem when AQI values are between 151 and 200. Members of sensitive groups may experience more serious health effects,' the US embassy website warned./The phenomenon of smog has become a permanent feature of the provincial metropolis and it is necessary for both the government and citizens to take appropriate measures before and during this season for their health./For the past many years, the smog season starts when the minimum temperature drops while the humidity level increases and this time usually comes near the end of October and continues till end of December every year./Met officials predicted that presently the humidity level in the city is around 65 per cent while minimum temperature is dropping every day and till the start of November smog season will start./Air pollution caused by industries, traffic smoke, crop burning and brick kilns is the major contributor of smog, said environmentalists, who believed that a thick layer of smog would take over the city skies in the coming days./Smog contains pollutants which cause eye/throat irritation as well as difficulty in breathing and public should take precautionary measures such as wearing sunglasses and covering mouth and nose with face masks./Naseem-ur-Rehman, a senior EPD official, said smog is the chemical reaction of sunlight, nitrogen oxides (NOx) and volatile organic compounds (VOC's) in the atmosphere, which leave airborne particles (called particulate matter) and ground-level ozone. He said Ozone (O3) is a gas that can form and react under the action of light and that is present in two layers of the atmosphere i.e first high in the atmosphere, which forms a layer that shields the earth from ultraviolet rays and second at the ground level./Usually, in developed world pre-smog health warnings are issued and citizens especially children are directed to stay indoors because smog may result in serious health hazard, especially diseases relating to eyes, lungs and skin, Dr Tariq Chishti, a family physician said./'People with heart and lungs problems such as emphysema, bronchitis and asthma should avoid going out in smog, Dr Chishti said, adding smog can also inflame breathing passages, decreasing the lung's working capacity and causing shortness of breath, pain when inhaling deeply, wheezing, and coughing. He said long-term exposure to smog at low levels can affect lungs elasticity and the ability to resist disease, effectively aging lungs prematurely./Children, the elderly, asthmatics and sufferers of other chronic lungs diseases are more susceptible to smog effects than the general population, he maintained. 'There is a dire need for public awareness in this regard as majority of citizens living in low lying and middle class localities do not know much about smog and its dangerous effects,' he said, adding any delay in starting pre-smog activities may turn disastrous./On the other hand, Environmental Protection Department (EPD) Punjab took several pre-smog measures to minimise its impact, which include closure of all brick kilns from November till December 30. Similarly, the department put a ban on burning crops and all field formations are directed to ensure closure of all smoke emitting industrial units./EPD officials said that the AQI status of Town Hall has been recorded at 209 while it was much higher at some points including Township Industrial zone, Data Darbar, Badamibagh, GT Road, Sundar Industrial Estate, Yateem Khana, Thokar Niaz Beig, etc. The EPD officials said the measures taken by the department will help in controlling smog."
Rising pollution," As the temperature goes down and people feel relieved of the sultry and humid season, the creeping smog nullifies the comfort level that a change in weather was expected to bring./Smog has begun to appear on the skies that were left clear and blue after the rainy season. Major cities face a serious problem of air and noise pollution. Both have a negative effect on the health of the citizens, school-going children and elderly alike./The polluted air causes coughing, wheezing and lung complications. Asthma patients suffer the most. Stubble burning in villages after the harvest season is the main source of air pollution in rural areas. Although stubble burning is banned, not many care about it; and nor do the reps of the environment department bother to visit the fields to ensure that no such burning takes place. And in cities, it is the burning of trash and plastics that make the air dense with suit and smoke. For instance, burning of garbage along the Ring Road in the outskirts of Lahore produces clouds of suit and smog that continue to shroud the city./According to one estimate, Lahore city produces about 9,000 tons of waste every day. Underage waste pickers comprising mostly Afghan children and women collect most of it manually before it is carted away to dumpsites. One wonders how effectively the Lahore Waste Management Company, which has a high-sounding name, handles garbage. In November 2018, it was announced that the Punjab government signed an agreement with a Chinese firm to produce 40 MW electricity by setting up an incineration plant on 52 hectares of land near Lahore. The plant was to go into operation within 22 months. Do such plants emit toxic pollutants?/The provincial environment department has warned that smog levels will rise in the coming days. A warning is not enough. The public should be informed what necessary measures the department intends to take to prevent the pollution. What adds to the smog are smoke-emitting vehicles, especially goods carrying overloaded long-body vehicles. Two-stroke engines in Chingchi rickshaws and motorcycles emit smoke and unburnt carbon particles that pollute the air./There was a time when every vehicle had to obtain a fitness certificate periodically to be declared roadworthy. The driver of the vehicle had to demonstrate to the checking staff that all lights on his/her vehicle functioned, the wipers and the indicators operated and that the vehicle didn't emit smoke. One wonders if any such checks are carried out nowadays, as we have done away with most of the civic practices of the past. These days not even traffic wardens check smoke-emitting vehicles./Noise pollution is another nuisance that could be easily controlled if the government recognised its adverse effects on the citizens' health. Human ears are designed to tolerate sound within a certain decibel (dB) level. Up to 60 dB is considered as the normal conversation level. Noise above 80 dB could trigger aggressive behaviour in humans, making them jittery, unfocussed and cantankerous./The main cause of noise pollution are the pressure horns indiscriminately used by buses and truckers. A high-pressure horn touches 200 dB. When blown incessantly on the roads, it could permanently impair the hearing of those living or working nearby. The police could easily check pressure honking if they wanted to. However, the callousness by the motorway police can be observed only a hundred meters from its kiosk on the Multan road near the NHA office. Buses park illegally, wait for passengers by blowing their pressure horns but no motorway police official seems to care. Maybe the motorway police have developed an ear for musical pressure honking./It's time for the environment department to treat noise pollution as harmful for human health as are air and water pollution. Uncontrolled noise pollution could turn us into a noisy nation that's hard of hearing, insensitive, angry and intolerant. When one hears loud, one speaks loudly. Smog is short-lived but noise pollution remains a permanent curse in our lives."
